What's Going On,Marvin Gaye,What's Going On (40th Anniversary),Tn3js66ju2stp62qjbzffpxzwxy
You'll Never Find Another Love Like Mine,Lou Rawls,Lou Rawls - The Very Best Of,Tanzg2tdrjbc6hxoga5tfs4wkmi
Tired of Being Alone,Al Green,Gets Next To You,Tggp4u3id752hixskqjarsgscuq
See You When I Git There,Lou Rawls,The Essential Lou Rawls,Tvcc4v44lbmka2ljdcarcqvwc2i
Mercy Mercy Me (The Ecology),Marvin Gaye,What's Going On,T4chdqrk774twpils422ea26l5e
Let's Stay Together,Al Green,Let's Stay Together,Tqoqj75a6pg6cfp7bmtwiostl2q
There Will Be Love,Lou Rawls,Lou Rawls - The Very Best Of,T44h64nw3u37iwrfx5tn7pm7ku4
I Want You (Single Version),Marvin Gaye,I Want You,Tb3suhmrqxcw4r47eq5vyiigu7u
Call Me (Come Back Home),Al Green,Call Me,T3bks45sgvkjliat257mdklkafy
Not the Staying Kind,Lou Rawls,The Essential Lou Rawls,Tvgdg53we3pwgezfhgsfrz2gj6u
I'm Still in Love with You,Al Green,I'm Still In Love With You,Tdpq7kndte3ffshhsfyo34a7qke
Lady Love,Lou Rawls,Lou Rawls - The Very Best Of,Tnxysxripnsy6tq2nodwituwffa
Let's Get It On,Marvin Gaye,Let's Get It On,T7mwqne7oltlxzzmah2x4r5vlmi
One Life to Live,Lou Rawls,The Essential Lou Rawls,Tnqnmh2tl467ygoed2ure6o7lnu
Let's Get Married,Al Green,Greatest Hits,Tjvg7ymvgal5x7acnpkigxepe5q
Love X Love (2015 GH Version),George Benson,The Ultimate Collection,Tvdn5jgf4cu6mvrpza4p7ojxjja
Give Me the Night (Remastered Single Version),George Benson,The Ultimate Collection,Tll6n6zs5p5ugp6yhqgtu3qou44
