bad guy,Billie Eilish,"WHEN WE ALL FALL ASLEEP, WHERE DO WE GO?",Tt7562hdl6wp3c6myajjdhwvwia
I Love You,Cesare Cremonini,La Teoria Dei Colori,T3qyjeqtzkiu5f3bcymw4lu75rm
Reckless (feat. Ub40),Afrika Bambaataa,Vuelve al Sábado Noche (Los 80 De Los 80),Tt7x3v6guprd2qxftgu7dxhe4ry
All Night Long (All Night) (Single Version),Lionel Richie,Back To Front,Tzmmovhydfepilid7at42leody4
Bad (2012 Remaster),Michael Jackson,Bad ((Remastered)),T3j2bkfgkebxag4byf2a3rbt7sy
Love Never Felt So Good,Michael Jackson,XSCAPE,Trfbrxhb7mxz62uylgixxibupki
Billie Jean,Michael Jackson,Number Ones,Tv22hnm6kt4zj3ftqiu2ltepi6a
Beat It (Single Version),Michael Jackson,Number Ones,T4pp7zsglfrkbexi2di6tnobg2q
Black or White (Single Version),Michael Jackson,Number Ones,Tek7cw76iljxrdcrm5max2kqdmi
Nothin' But A Woman,Robert Cray,Strong Persuader,Tmh4eh3xa3rt2pcfp6hkru5gl6m
It's The End Of The World As We Know It (And I Feel Fine),R.E.M.,Document,T3dqq73gdjeq6zgbwijv4jugy2q
Town Called Malice,The Jam,The Gift (Deluxe Edition),Tl5zfvcdf5i4nrr5qvtnmowz2h4
Born to Run,Bruce Springsteen,Born To Run,Tnlwgpr4rl62zblmhhowiep653a
Shiny Happy People,R.E.M.,Out Of Time (25th Anniversary Edition),Tlhmvytrecklflbguwljhzcjbve
Eye in the Sky (Remastered),The Alan Parsons Project,Platinum & Gold Collection,T3am662s32nsllnejoxxvpgtlum
Beds Are Burning (Remastered),Midnight Oil,20000 Watt RSL - The Midnight Oil Collection,Txog3qbyebpie3xf4pazl32spzq
Da Da Da (I Don't Love You You Don't Love Me Aha Aha Aha),Trio,Triologie - The Best Of Trio,Tjpxy3j5rygzztlos6rxgqglu2u
Shades,Iggy Pop,Blah Blah Blah,Trlbu6hnzhohnvz7d5xy67cb2p4
Gangnam Style,Psy,Gangnam Style,Tgmrl6gfrlrvta4jriy4qsm5jue
Living In Denial,Michael Kiwanuka,KIWANUKA,Tfdevo2rp6lb4e62ebpwf7s4juu
