Counting Backwards,Throwing Muses,The Real Ramona,Toslogctbdbvj3ca3g23w56tt5u
Ping Pong,Stereolab,Mars Audiac Quintet,Trewxjlih5cfgqjhvvrreluatxe
What Do I Do Now?,Sleeper,The It Girl,Tcfqcb472g7erqua2sn2guwvdzq
On Standby (Live),Shed Seven,Why Can't I Be You? Part 2,T3nzokak6dkq5iw6riglmdjwiwy
"Be My Light, Be My Guide",Gene,As Good As It Gets - The Best Of Gene,Tyvpfcfvw7jnp3557tizcleh5km
Valerie,The Zutons,Tired Of Hanging Around,Tekrr63plbrgrvqff6rubcplpaq
Chevy Thunder,Spector,Chevy Thunder,Tfzanefdokkfvfhms3tq7xutuoq
Take Me Out,Franz Ferdinand,Take Me Out,T235n4gamlljrcikw3ub4ib46vm
Sometime Around Midnight,The Airborne Toxic Event,The Airborne Toxic Event (Deluxe Edition),T6ki7odgbv67azc3ucr7y2hd5si
There Is a Light That Never Goes Out (2008 Remaster),The Smiths,The Sound of the Smiths (2008 Remaster),T7drq6ilg7jc3bkq7obxb5gbi6i
5000 Minutes Of Pain,Minuteman,Resigned To Life,Thwqfm3wfzseyaltjalvi2lfti4
Trains To Brazil,Guillemots,Through The Windowpane,Tuodt6b33nliuakwcup7wazwdci
Porchlight,Buffalo Tom,Let Me Come Over,Tbmswg5wc3hcm73g7usbsogyixm
Carrion,British Sea Power,The Decline of British Sea Power,Tbl53dpfmoytnbbc3rpavw6nwju
Dakota,Stereophonics,Decade In The Sun - Best of Stereophonics (Deluxe Version),Tyt3amg7lje4hzvvjny2ydtpmra
Post Break-Up Sex (Live in Brighton),The Vaccines,Come Of Age (Deluxe Version),Tidtlhbdifwlve3tunj4mx2osny
Oxygen,JJ72,JJ72,Tnze4ams6wxmj37qtsjyakkua3y
Waitin' for a Superman (2017 Remaster),The Flaming Lips,The Soft Bulletin,Tgzeoarkesgjfaoafkyjptpwmvq
The Concept,Teenage Fanclub,Upside Down: The Story Of Creation OST,Tz2tigmoj6stjci7jst2e6pwjuu
I Will,Sebadoh,Defend Yourself,Tgfjv7zhkohkmr5qkjvg6ffvwym
The 3rd Time We Opened the Capsule,Kitchens Of Distinction,Capsule (The Best of Kod: 1988-94),T6cvbyw4acjeuvqose6xlqvefs4
Brassneck (Live at the 1996 Reading Festival),Wedding Present,Singles 1995-1997,Twotdv677lmjmefkensp5kq22j4
Losing My Religion (Live),R.E.M.,Automatic For The People (25th Anniversary Edition),Tpidc25vo6mlqhvaej23utkl32y
Monkey Gone to Heaven,Pixies,Doolittle,Tmjhvpxc7fetaeycqswft2mq5ki
French Navy,Camera Obscura,My Maudlin Career,T7yrt45bgox45jke7rmy76v7vj4
Men's Needs,The Cribs,Men's Needs (DMD Maxi),Tyxdqmh3e7ogbe6tamywhzfbukm
Bloodbuzz Ohio,The National,Bloodbuzz Ohio,Tpuocub7wdtf3ly5m3vemhgpmh4
Who Can Say,The Horrors,Primary Colours,Tt6vlahga7qd5a22wkkhed4y4iu
The Man Who Sold The World (Live & Loud),Nirvana,In Utero (Super Deluxe),Tufoytrpwanwtgcpljxjk7c4x2a
A Lady of a Certain Age,The Divine Comedy,Victory For The Comic Muse,Tc765v26eygvhomdkurpsdnru2i
From Despair to Where,Manic Street Preachers,National Treasures - The Complete Singles,Tdvdeehjn66phzbqlsdtd24nyte
Yellow,Coldplay,Parachutes,Tts2wa7qolm45thek4yd6wh64za
April Skies,The Jesus And Mary Chain,Darklands,T2tatsvflv4l6euekdqxn6pmu3m
Ayla,The Maccabees,Given To The Wild,T4hwaj5onnkxd42qtbgavncc4pq
The Way That He Sings,My Morning Jacket,At Dawn,Tsn4s4w3iuu56dhapffqpfon3ca
Hard To Explain,The Strokes,Is This It,Teqy4xl65sksqub74r56q6hylby
Bye Bye Badman (Demo Remastered),The Stone Roses,The Stone Roses (20th Anniversary Legacy Edition),Toshd5wzxgsjbsnihlgh7hm25xy
The Rat,The Walkmen,Sympathy For The Download 00 (DMD Internet),Tzy46z3h2t34akuktykyekzmun4
Bizarre Love Triangle '94,New Order,(The Best Of) New Order,Tnxbufz2t6nciqhzj5qjsnngeoi
A Certain Romance,Arctic Monkeys,"Whatever People Say I Am, That's What I'm Not",T6hkvr5hecjz4w2fdd25d4lwa3i
Love Will Tear Us Apart,Joy Division,Paradiso (Hd Remastered Edition),Tvgfswqc7latvq3vfb4fv7y7fym
Razzmatazz,Pulp,Intro: The Gift Recordings,To7toeiltktfcioffq3fj7rkuci
Creep,Radiohead,Creep,T7y6pjtqwnf2k6qm7cxc6ucdsxq
Teenage Kicks,The Undertones,Spring Breakers,Tw5l7c3e5ntg2gtss47c2ttkbia
Freak Scene,Dinosaur Jr.,Bug,Tl5m4uz64armouuxs2iajaatpoa
