A Night in Tunisia,Art Blakey,100 Jazz Songs for a Summers Day,T3ugha3mq5mzpoacqnxsfnveiz4
All The Things You Are,Art Blakey,Monks Mood,Tvr4e4izt3zi5tcattrnrphwfuu
Almost Like Being In Love,Art Blakey,Art Blakey 1957,Te75l2xuidnz36le3vbi46bpp7e
Alone Together (Remastered),Art Blakey,Take Five (100 Memorable Jazz Performances),Tjsslryahntzfqiu3cpemsp3rnq
Blues,Art Blakey,Greatest Jazz Drummers of All Time,Tzhteznr4sap4po4db3352o6axm
Body and Soul,Art Blakey,Simplicity,Tlen6h3jtwhcsgb6kbtomagwwlu
Caravan,Art Blakey,Caravan,Twppkuopoioabrbaff7r3f2jfjq
Caravan,Art Blakey,Dazzle Jazzle: Jazz of the 1960's,Tyd2ebp2jq23i4hl4oq6fhogjcy
Cherokee (feat. Art Blakey),Clifford Brown Sextet,Cherokee (19 Versions Performed By:),Tdndvbkwsbjlmpgfoiy3v6vfqv4
Come Out and Meet me Tonight,Art Blakey,I Could Have Danced All Night,Tdiuvutibmtuj3omrayxk5v3way
Confirmation - Lullaby of Birdland,Art Blakey,49 Essential Art Blakey Classics,Tcdfwh2dieb5em2f2muwkr5bo3e
Don't Get Around Much Anymore (Remastered 2015),Johnny Griffin,The Best of Johnny Griffin (feat. John Coltrane / Paul Chambers / Art Blakey) [All Tracks Remastered],To65rjqy7xc5syrp3gkdbexoyei
Doodlin' (Remastered),Art Blakey & The Jazz Messengers,Tenderly (A Journey into Sentimental Mood),Tysviqoveyhsvv5i353j333msj4
I Remember Clifford,Art Blakey,Zurich '58 - In Concert,Tfb5juo3rcri73rbvtn7av6ziwe
In A Sentimental Mood (Live),Art Blakey,Keystone 3,Tfj3mfqq7lexza5x3rm7ggwvdhu
Love for Sale,Art Blakey's Jazz Messengers,Lounge Jazz Café - Tel Aviv,Tds6447dguoclgeol2ayfkblray
"Merlin (From ""Des Femmes Disparaissent"")",Art Blakey,French New Wave 1957~1963,Txhwbkjsdkokq2ahexkxck34ly4
Moanin' #3,Art Blakey,Art Blakey & The Jazz Messengers: Live In Holland 1958 & Newport 1959,T2zxiyxc7to5apvutjdlj3tj7ly
Moanin',Art Blakey,BD Music Presents Bye Bye Blackbird,Tostbimcom242hjkvwegkrfgqzy
Moanin',Art Blakey,Moanin',Tgeaupvmrwyvoueqjtpsj3uy3ge
Moanin,Art Blakey & His Jazz Messengers,The Modern Jazz Quartet,Tubzxwqi6ontjnjs7gcac6xg42u
Ruby My Dear,Art Blakey,The Thelonious Monk Sessions,Tdy5xvh7xbkvyfswthnzdt2d5km
Stardust,Art Blakey,Out of Nowhere Vol.1,T67xss5ixmrqjrp7jgv5eauug7y
Stella By Starlight,Art Blakey,Hard Bop / Jazz Messengers With Thelonious Monk / Caravan,Tbm6pw2b6tayzkkfawp2ribzspu
Summertime,Art Blakey,Art Blakey: A Jazz Message,Tw5ouowgx75elqip7hsu7u32i24
The End of a Love Affair (Remastered),Art Blakey,Easy Jazz,Td77b7thf6rzc53mpvxxil6nrle
These Foolish Things,Art Blakey,Out of Nowhere Vol.1,Tdqcuo5latsxp7cygvv2q7mywga
What Is This Thing Called Love,Art Blakey,Invitation: The Best of Art Blakey,Tq2mkftghoxxyq2iqtvemmthv3q
Yesterdays (Remastered),Art Blakey,Take Five (100 Memorable Jazz Performances),Tvwrcecu64v6apuuumtys55fhy4
