Harvest Moon,Jane Birkin,Fictions,T2bhbufu2jpb5rwe2k6qcyooova
Summertime (Live),Janis Joplin,Pearl,Ta4i4d4nz6qsh5pweekczggbi3m
Rock with You (Single Version),Michael Jackson,Off the Wall,Tdb6wyj4p44umpuxuddjy63qetu
Head On,The Jesus And Mary Chain,Automatic (Expanded Version),Tjzuylzyfbg7ks2t5zedu3m5ey4
April Skies,The Jesus And Mary Chain,Darklands,T2tatsvflv4l6euekdqxn6pmu3m
Wait Until Tomorrow (BBC Sessions),The Jimi Hendrix Experience,BBC Sessions,Tf7ii5bqg2oqzozbu5tytln2psu
I Realized,Jiva,The Soul of Atlanta,Tpfgzvpgkqiyeq4snlqjlijbxby
(Do I Ever) Cross Your Mind,Walter Beasley,Go With the Flow,Tvoeksvb6es56leacvourrymjve
O Mestre Sala dos Mares,João Bosco,Samba de Primeira,Tqebz45dqv3evlijrsucqokvgjm
Aguas de Marco,Stan Getz,Only Jazz Music,Ty6kjj55e7elv4yd7z725hnh56q
How High The Moon,Joe Pass,Virtuoso (OJC Remaster),Tijkp6b6ym3ptotlzwy6kwhpif4
East St. Louis Toodle-oo/Don’t Get Around Much Anymore,John Pizzarelli,Rockin' In Rhythm: A Tribute To Duke Ellington,T4weu6edktitnpmewtil6sc6tbq
Chasin' The Blues (feat. Tony Tedesco & Martin Pizzarelli),Rick Haydon & John Pizzarelli,Just Friends,T2fjuizogk3ukdrajyxvhr7bfyi
"The Long Black Veil (Live at Folsom State Prison, Folsom, CA (1st Show) - January 1968)",Johnny Cash,At Folsom Prison (Live),Tfdhfhno7asahwtnjsc6vwpyim4
One,Johnny Cash,Unearthed,T25ylqfx3dx4zguxowuhb3q6cqa
Ac-cent-tchu-ate The Positive,Johnny Mercer,Personality,Tchgztirgakmmu3mvafutwasmnu
Jumpin' Jack Flash (Live),Johnny Winter,The Essential Johnny Winter,T36tuh6ffhy3crt4a25b6omptxe
Memory Pain,Johnny Winter,Second Winter,Tj6l2s7ibznz7qi6m7ldodkatzm
Zumbi,Jorge Ben Jor,A Tabua De Esmeralda,Ttpvrgtahiqjp4ayxcmppo2rsym
Atmosphere,Joy Division,Paradiso (Hd Remastered Edition),Tzaggoclnl6hzfsasjkxkna2qka
Day Of The Lords,Joy Division,Paradiso (Hd Remastered Edition),T2fsqdysbdripgsn3fvv2yai2ae
Dead Souls,Joy Division,They Keep Calling Me (HD Remastered),Tahnagiitip2dxypwgvs47hnuhe
Shadowplay,Joy Division,Paradiso (Hd Remastered Edition),Tz2mkzw6no2rtotudpgtxmcm6iq
Last Nite,Jumbonics,Last Night / Red One,T2vwpaxoyi5oijdpzicawyokjzi
Creep,Karen Souza,Karen Souza Essentials,Tcbzv7potyeg6aip3alxjuo4xji
Sunshine,Keane,Hopes and Fears (Deluxe Edition),T5bsudwjmokim34dgbqt3rncr5m
Misread (Acoustic Session),Kings Of Convenience,I'd Rather Dance With You,T7xoogbn5s7by7ja2tynoi26mvi
Idle Forest of Chit Chat (feat. Souldrop),Kinny,Idle Forest of Chit Chat,Tebgsnllw5uzdvqvzxtwzlwuclu
Celebration (Live),Kool & The Gang,40 Golden Hits - The Greatest Hits of the Past Decades,Tpq445b4f4zi627xhutrt4tzku4
Celebration (Live),Kool and the Gang,Greatest Hits Live,Tvo3zhvzoculrkvr67vl5yj46ga
I See A Different You,Koop,Freshly Composted 2 - Compost 250,Tgaflbqu3xc755vgo3idmhgflfe
As Sete Vampiras,Leo Jaime,Ploc Pop 80's,T74eeahduz2cgjy4yzzmwm527ym
On The Way To San Mateo,Lalo Schifrin,Bullitt (Original Motion Picture Soundtrack),Tn7xg7z6ohqwqrwivl2ygtk3gyi
"Mannix (From ""Mannix"" Soundtrack)",Lalo Schifrin,Mannix (Themes From The Original Score Of The Paramount Television Show),T5nf3hcbosx3436kfpvymh3dtp4
Last Tango (Theme From Last Tango In Paris - Album Version),Gato Barbieri,The Shadow Of The Cat,T2fsq2qt33sgfemrgarolcxf72i
Hot Topic,Le Tigre,Le Tigre,Tz7dssqh3b7wselrnchjqlgudpu
Dancing Days (2012 Remaster),Led Zeppelin,Houses Of The Holy (Remastered),Tnyhfqperspe6xs5gzt5is2g37e
The Song Remains the Same (2012 Remaster),Led Zeppelin,Houses Of The Holy (Remastered),Tldf2oq6ufj6j7dppgtze2xuowa
Feedback Song For A Dying Friend,Legião Urbana,As Quatro Estações - Ao Vivo,Tramnvgzmxym2yc3jexdcxepoma
You Make Me Feel Like Dancing (Live),Leo Sayer,A Perfect Ten - 1977,Tcxstx7ntpmfdsv7z6v2l2ldw4q
Assedic,LES ESCROCS,Faites-Vous Des Amis,Tmjpm5b32ilebygjd5hq24faq4u
I Love You for Sentimental Reasons,Linda Ronstadt,'Round Midnight With Nelson Riddle And His Orchestra,Tlxqvcclahpjhw6l2edgjqatut4
Gentle On My Mind,Lisa Ono,Jambalaya -Bossa Americana-,Tmathoe5ergobnjmstg6sj2ixk4
28 Butts,Little Jackie,The Stoop,T3bdcssgrqzffxjeuqevwe2fzay
Long Tall Sally,Little Richard,"The Greatest!, Vol. 1 (The 1955-1957 Masters Complete Collection)",T6gcpyrihixfritfkolkdupktmm
Anna Júlia,Los Hermanos,4 X Rock,Tbamttwrt3t6dvpusi5v3fa4pse
Cara Estranho (Ao Vivo),Los Hermanos,Box Los Hermanos,T3noaeiq3w45m2bzklhg5qlduie
Sabor a Mi,Los Panchos,Si Tu Me Dices Ven,Tyoceqjttooobuuzljmg6g7tfai
Tu Me Acostumbraste,Los Panchos,Sabor a Mi,Tfq57x277hmmidcg3r3lmxj3kpm
See You When I Git There,Lou Rawls,The Essential Lou Rawls,Tvcc4v44lbmka2ljdcarcqvwc2i
There Is No Time,Lou Reed,New York,Tryel2czjclu7u32yfn3jovr4da
I'm in the Mood for Love,Louis Armstrong,Solitude,Tu7xyoyjmxe66yhrypg5vxnfvsm
Potato Head Blues,Louis Armstrong,"Satchmo from A to Z, Vol. 10",Ts6234iow34jncndysdnno6sz4q
"The Grand Duel (Parte Prima) (From ""Kill Bill Vol. 1"")",Luis Bacalov,"O último grande duelo - Sabata, o justiceiro (Trilha sonora do filme original)",Tooll62j55gk6th3xlwbd6gob4i
De repente califórnia,Lulu Santos,Smooth Pop Latin,Tzh3vf27m37wkl6aycmcj5eyy5q
Um certo alguém,Lulu Santos,O Ritmo do Momento,Tpkoa6xgm6handigs4obmwyn2ym
To Sir With Love (2002 Remastered Version),Lulu,Most Of Lulu / Lulu's Album,Thagah7iftego56meyj2ebwj3te
Les boys bandent,Mc Solaar,Le tour de la question,Tnrwr2zz6pzwujjk3elfn7ncc6i
Billy Brown,MIKA,Life In Cartoon Motion,Tke4ensfse2reiahptv2zzrx27a
I'm Gonna Sit Right Down and Write Myself a Letter,Madeleine Peyroux,Dreamland,Teue2nmzbittb474ll22435pmoa
Muddy Water,Madeleine Peyroux,Dreamland,Tjko7stcqgoulmybujjw425w42e
A Procura da Batida Perfeita,Marcelo D2,Brasilicatessen Vol. 1,Tuahphep5glalubeyrzgy6hbtze
Gotas De Luar (2004 Digital Remaster;),Marisa Monte,"Memórias, Crônicas e Declarações de Amor",T243tzqsaqpm3pf3potgjowu6aq
Love Is in the Air (Vicenzo Remix),"DJ Ino, Mc Johnny Def","Keep the Secret, Vol. 16",Tp6c3ebfdn4v2kgrnipbxpxgyxa
Come Get To This,Marvin Gaye,Let's Get It On,Tlxjmowdnqylaj54dkc4r3wvcge
I Want You,Marvin Gaye,20 #1's: R&B Love Songs,Tj737hphgb3y7nqpl46uqu3v2by
Let's Get It On,Marvin Gaye,Let's Get It On,T7mwqne7oltlxzzmah2x4r5vlmi
Mercy Mercy Me (The Ecology),Marvin Gaye,What's Going On,T4chdqrk774twpils422ea26l5e
What's Going On (Coffeehouse Mix),Marvin Gaye,What's Going On (EP),T6hyuknmu4a7rmnspaa374aizia
Where Are We Going? (Alternate Mix 2),Marvin Gaye,You're The Man,Tey6erav4bcbcyrwm2ilt2kvb3a
You Sure Love To Ball,Marvin Gaye,Let's Get It On,Te7gbcj6uluxdnairp3sv6wvnm4
Protection (The Eno Mix),Massive Attack,Singles Collection,Tlh735nw2noynekao5bhhp5i7hy
Half A Minute (Extended Version),Matt Bianco,Whose Side Are You On? (Expanded),Tinyonc532sduwsjr3n3hjmyn3u
Summer Is Coming,Matt Pond PA,The Nature Of Maps,Tja5mazqrwf4xby2bip626xqnj4
Vera Cruz,Meirelles e Os Copa 5,Esquema Novo,Tawnetgmjnsp5jydqedhgdyrrei
Bring Me Some Water (Radio Trent Version),Melissa Etheridge,Melissa Etheridge,Tfgas6uzug5bskekprwvd2nmewe
Escapism,Metropolitan Jazz Affair,Bird of Spring,Txl6uja2vrdbd3gyaotu2sypate
Fourmi Rouge,Metropolitan Jazz Affair,Bird of Spring,Tk3ihe7nyqopeduxlumn7myi5xq
Midnight Voyage,The Mamas & The Papas,All The Leaves Are Brown: The Golden Era Collection,Tpzcjoxdtsq7yhqqsqaqaz3m34e
Sway [Junkie XL Mix],Michael Bublé,Spider-Man Theme/Sway Remixes,Tyu3ulj3ocefojsluzpbas7av3m
Play Me,Michel Petrucciani,Triple Best Of Petrucciani,Tjiq7ug35lgfzqgmn2ynlw3ir74
Beds Are Burning (Remastered),Midnight Oil,Essential Oils,Ttz2mxddpvpnzu67vhxwoptnb7e
Inside Out,Mighty Lemon Drops,World Without End,Tsqoyzewjw6noblkc6ldv7ozcka
Famous,Mike Falzone,Fun With Honesty,T4cur66ixvud7zwnuxdyu3c2aky
Coisa Nº 6,Moacir Santos,Ouro Negro,Tvobm2qtixmdndjevd5occzrqd4
"Mon oncle (from ""Mon oncle"")",Frank Barcellini,Jacques Tati Soundtracks (Remastered),Th2og5zg4e2noj4ozd3sze6oszq
My Baby Just Cares for Me,Pat Boone,"First Recordings, Vol. 1",Tsxyj4udbqmyiblf7zssmtu5egq
"Nem Luxo, Nem Lixo (Ao Vivo)",Marina Lima,Síssi Na Sua (Ao Vivo),T2nihurpff5mendcmwnpnuixzqq
Run To The Sun,N.E.R.D.,In Search Of...,Tjjppvbpt4y2cqey4lfckpwpoge
Dreams (Are My Reality),Nancy Danino,"Hollywood, Mon Amour",Tuxejbnpqi6cqw4xmvisq7tht3y
Believe (Kenny Dope Remix),Nathan Haines,The Best of Chillifunk Ten Years 1996-2006 (Pt. One),T3rj3oqlzdlh247j25ylnieyc2y
"Hey Hey, My My (Into the Black)",Neil Young,Greatest Hits,Tnmgxourmjtkgs4wgxkzxoefgy4
Winterlong (Electric) (Remastered) [Live],Neil Young & Crazy Horse,Live - Cleveland Music Hall OH Feb 25th 1970 (Remastered) [Live FM Radio Broadcast Concert In Superb Fidelity],Ttxfrnrsa2pseumr3rs6gg6tw3u
Harvest Moon,Neil Young,Greatest Hits,Te3muw46ufimv6zfmn5kicbpizm
Age of Consent (2015 Remaster),New Order,Hits Of The 80s,Tytz53gqasyshfrgax3zkkh7a2i
Ceremony (Version 1) [2016 Remastered Version],New Order,Singles (Remastered),Tuz3lx7ge3rir4dsxvs6ylb3q2q
Regret,New Order,(The Best Of) New Order,Tcclqkwxauxahjujxww7t73kyp4
