Baby Shark,Super Simple Songs,Baby Shark & More Kids Songs,T2vqmdyhxpsv65bicnfumtednsa
What a Wonderful World (Remastered),Louis Amstrong,Georgia on My Mind (Remastered),Tzgjzirevpilkozk26ssqyujh74
Glorious,Adam Friedman,Rock Dog (Original Motion Picture Soundtrack),Tjqhl6yf6bj3gfs6nu6vlhgus5a
Pink Panther Theme,Henry Mancini,The Pink Panther (Original Motion Picture Soundtrack),Tjeocoiutgbuaxkklot2cgw7jxu
Livin' la Vida Loca,Ricky Martin,Ricky Martin,Tvcfjgceavzxxef2kwydwyhe6u4
Trem-Bala,Ana Vilela,Trem-Bala,Ttotmd52432t3hv3yrb4u3uu7ze
Fico Assim Sem Você,Adriana Partimpim,Adriana Partimpim,Tlo7nw2ozebvbybijdmx6bb2phi
Uma Aventura no Tempo,Turma da Mônica,Brincando Com a Turma da Mônica,T7fwvo4f4exvh33v6crypwklsii
A Pirate Says Arr,The Backyardigans,The Backyardigans,Tixpbgabmg3ta3vlnq2ztayomom
Get Stupid,Aston Merrygold,Get Stupid,Tzcvb54t4bzupxa45hibzdn25zi
Na Cadência Do Samba,Novos Baianos,Vamos Pro Mundo,T3gx3qetog67yxer4qel62ziq7u
Sunday Morning,Maroon 5,Songs About Jane,Tkyfdrs42qzpmto7l3udghwozqi
Gangnam Style,Psy,Gangnam Style,Tgmrl6gfrlrvta4jriy4qsm5jue
Mr. E's Beautiful Blues,Eels,Meet The EELS: Essential EELS 1996-2006 Vol. 1,Tajsa4dpyw5augkd7rn5qff7xyq
Lollipop,MIKA,Life In Cartoon Motion,Tma7ubwkvqfeul26dfok6k347ea
Rebana Ba Leshotho,Aura Msimang,Itshe,Trjfui2rwe2qdfkqj245ypbgzmy
Todos Estão Surdos (Versão Remasterizada),Roberto Carlos,Roberto Carlos (1971 Remasterizado),Ts2v3xv52e5ov7dsmaruf5ilymu
Meu Abrigo,Melim,Melim,Tueoxwrnyybe7giwxoimt3v436u
"Axel F (From ""Beverly Hills Cop"" Soundtrack)",Harold Faltermeyer,Beverly Hills Cop (Music From The Motion Picture Soundtrack),Tsdqgv6wdfzngaemkqynkcvjed4
Jailhouse Rock,Elvis Presley,Jailhouse Rock,Tcd7gewrded6tbao7kvtqyyo7zy
"Amor I Love You / Citação: Trecho Da Obra Intitulada ""Primo Basilio"" De Eça De Queiroz Declamado Por Arnaldo Antunes",Marisa Monte,"Memórias, Crônicas e Declarações de Amor",Tcmht7t3dx2ogaxfrwh4dvkxkwu
Sonífera ilha,Titãs,Titãs,Tp22znpls3kyc3zzf65xag55uxe
"The Neverending Story (From ""The Neverending Story"")",Limahl,Best Movie Songs,Tlj5pi4xajinwrdkfpg62noweqa
O Sol,Vitor Kley,O Sol,Tdwv6ulailivglbmax5ssaw5plq
Sugar Sugar,The Archies,"Sugar, Sugar",T7ld4nhmn2rq2wqfcussy2cygcm
State of Shock,The Jacksons,The Best Year Of My Life: 1984,Titzmzuwws6nswp7at4mxwb4v2u
"Theme From New York, New York (Remastered 2008)",Frank Sinatra,Ultimate Sinatra: The Centennial Collection,Tbqtrforavfwvy2dyzonbkggpoe
