Happy Together,The Turtles,Happy Together,T42unwncmdxhbmpzw5heurxg6zm
Don't Worry Be Happy,Bobby McFerrin,The Best Of Bobby McFerrin,Twlhbc445zdsmd4u6v3agkjzsfi
The Happy Organ,"Dave ""Baby"" Cortez",Golden Years - 1959,Tq2o3z7cjtzykin7hufgf7ooyvq
My Happiness,Connie Francis,As I Remember Them 1958,Tmw77zg2ultaow6q3g5htqnn6uu
If You Wanna Be Happy,Jimmy Soul,"Frank Guida Presents: Jimmy Soul ""If You Wanna Be Happy""",Tb2ej6gd7cbjmllfyzfn6fw7bpq
You've Made Me so Very Happy,"Blood, Sweat & Tears",Lovin' Rock Hits 1969-1989,Tjbm3ytc2dtmah4n4vyk4t7im5m
Love (Can Make You Happy),Mercy,Original Love Can Make You Happy,Tnu5qgcwarjwq742kufu6cje7ou
Happy Birthday Sweet Sixteen,Neil Sedaka,1961 - 250 Hits!,Tleschq4hjfylargptf2dpqgaea
Sha-La-La (Make Me Happy),Al Green,Explores Your Mind,Thunf2clheug5aubmquykqmsaum
Hotel Happiness,Brook Benton,Jukebox Hits 1962,Tsulcm64j2eifjbrvmft3hvtxkq
Oh Happy Day,Edwin Hawkins Singers,I Love The 60's - 1969,Thf66u5vndgmnlguourfseoaaxu
Happy (Album Version Explicit),Ashanti,Ashanti,Tkyedv65q46l7d32m2qx5fxd4im
If It Makes You Happy,Sheryl Crow,Hits And Rarities,Txcpzwmaer4zvxmwmamv4gbuasu
Shiny Happy People,R.E.M.,Out Of Time (25th Anniversary Edition),Tlhmvytrecklflbguwljhzcjbve
My Happy Ending,Avril Lavigne,Under My Skin,Tcmvkauiifeuqsfwyd667kgbe3u
Happy,Pharrell Williams,Until the morning 2,Tmiquee7smqnyholt7g7a4yxyvm
Happy Go Lucky Me,Paul Evans,US 1960 - June,Txfcxxuk62uhwubpv3p77ornuee
The Happiest Girl in the Whole U.S.A.,Donna Fargo,Happy Birthday 1972,Tuhhrfa3xlxtsupy72ylzotaede
Happy Days (Theme from ''Happy Days''),Pratt & McClain,"Pratt & McClain featuring ""Happy Days""",Twds2u5liecueqtypcawr73zkky
