One Piece at a Time,Johnny Cash,The Essential Johnny Cash (Remastered),Thtvgyd7xoezgyklna3dbwjztdm
In My Life,Johnny Cash,American IV: The Man Comes Around,Tilo2ryakgofm5aimqu2zrsurpe
Personal Jesus,Johnny Cash,American IV: The Man Comes Around,Tizqcmnlgmejqfqvpnrigssyat4
Hurt,Johnny Cash,American IV: The Man Comes Around,Tluwgayvgargoir4kerxh2px3vq
Desperado,Johnny Cash,American IV: The Man Comes Around,Tbijkk23kut3m3bdjsf76p73oke
Long Black Veil,Johnny Cash,Unearthed,Trg6ktsgkxwnz3vdw7hx3cuepqa
The Man Comes Around,Johnny Cash,American IV: The Man Comes Around,Tjmbotrhnmzvi6dhnj4jyccam5a
Solitary Man,Johnny Cash,American III: Solitary Man,T4id6ronxdf4zzgyiikg4akiqli
"Folsom Prison Blues (Live at Folsom State Prison, Folsom, CA (1st Show) - January 1968)",Johnny Cash,At Folsom Prison (Legacy Edition - Bonus Tracks),Tkhzknxwhiojnnr32hakbrwjwha
You Are My Sunshine,Johnny Cash,Unearthed,Tsfjtjku63vhih4ipg5yx7q5ezm
I Walk the Line,Johnny Cash,I Walk the Line,Tc2ethwdgmzqfv6wq6gr4zu7ipy
Bridge Over Troubled Water,Johnny Cash,American IV: The Man Comes Around,Tkst6v7tj2pnd3loxj2ex6mt2iu
Ring of Fire (Mono Version),Johnny Cash,Ring Of Fire: The Best Of Johnny Cash,Tvvihumyzovsna2z3klngioupiy
God's Gonna Cut You Down,Johnny Cash,American V: A Hundred Highways,Tls3dnszro3expw7m26jwokltq4
One,Johnny Cash,The Legend Of Johnny Cash,T5prqsfe5cauh7dcmvh542hwmxi
