World Destruction (Remastered 2005),Time Zone,Methods Of Dance (Electronica & Leftfield ‘73-‘87),Ty2s4ju2kgxxmeuunqvwpxt3vsi
Dove,Cymande,Cymande,Ttxtnfy6nm4kcwiknz754l5deze
The Hall Of Mirrors (2009 Remastered Version),Kraftwerk,Trans Europe Express (2009 Remastered Version),Tetss36g74abfv7b7fjsi7tvhoq
Everybody Wants To Rule The World,Tears For Fears,Rule The World: The Greatest Hits,Tykdktfeqbitagzoebzmxbwi62q
Criminal,Fiona Apple,"Chillout Pop inc. John Legend, Miley Cyrus & John Mayer",T3qpdbqgkypv5huxjji475elfge
Christmas Rappin',Kurtis Blow,Gotta Love Christmas,Tvciglneidwqq54n6jyn4kmmh24
All About That Bass,Meghan Trainor,All About That Bass,T3s4wi7m3eakrpzc2cakbojnea4
Don't Worry Be Happy,Bobby McFerrin,The Best Of Bobby McFerrin,Twlhbc445zdsmd4u6v3agkjzsfi
