Walk Like An Egyptian,Bangles,Different Light,Tl6ujyljrk2kbic2fhsy2lcc25q
Head Over Heels,The Go-Go's,Return To The Valley Of The Go-Go's,Tipsssefuksoybgzgfq7fhuyhaa
The War Song (Remastered 2003),Culture Club,Waking Up With The House On Fire,Tu47a3lggl73q3c3mspyqij4uiy
Town Called Malice,The Jam,The Very Best Of The Jam,Tsmbe23dfwzo3xe54tgidyqobri
Come On Eileen,Dexys Midnight Runners,Too Rye Ay (Deluxe Edition),T4q7hjeq2obc6bffl36nsa5yjvi
Here's Where the Story Ends,The Sundays,"Reading, Writing & Arithmetic",Tmgkxezjgwninp7qc7j7ya4ehcm
