All Of Me,Coleman Hawkins,Swing Legends Vol.10,Tsnmcso6ithzlf53y7xgeabm73y
All The Things You Are,Coleman Hawkins,Coleman Hawkins Selected Hits Vol. 1,Ttcgmblbentau5t5vfzearqrrni
Autumn Leaves,Coleman Hawkins,Romantic Saxophone,Tgbq5pjzqfvzgi3ujwj5k42xqhe
Body and Soul,Coleman Hawkins,Body and Soul,Txe4cbbsb5zzct2tdbinzwpjcee
I'll Wind (You're Blowin' Me No Good) (Remastered),Coleman Hawkins,My Melancholy Baby (Remastered),T6y6a6pj72qxefzl3jbjxtgxiy4
La Rosita,Ben Webster,BD Music Presents Bye Bye Blackbird,Tdu6qsziwiflltnb6olvcluv54a
Cherokee (feat. Coleman Hawkins),Shelly Manne,2 3 4 + My Fair Lady,Tl67p5ggbgpbcvwjr2dhh7dhiky
Confirmation,Ben Webster And The Modern Jazz Quartet,Rendezvous Series Vol. 1 - Coleman Hawkins & Ben Webster,Tjkmy5gsoejogwg3yx5klotvfhe
Desafinado,Coleman Hawkins,Bossa Nova The Japan Choice Verve (Doxy Collection),Tys34o6eubovnjdgtduvrdkonpm
Midnight Sun,Coleman Hawkins,Fly Me To The Moon (Hd Remastered Edition),Tieg4vsyiwqelevud47xkbcqaue
(It's No) Sin,Coleman Hawkins,Swinging Jazz: Four or Five Times,T5ee5i33mqi4iigumklti7zjqby
Have You Met Miss Jones,Coleman Hawkins,The Complete Albums Collection: 1945-1957,Tzqvwoismujce7gng5rt2ugu3ji
How High The Moon,Coleman Hawkins,Coleman Hawkins Selected Favorites Volume 6,Tfzawosjiekcqouhm6jbff46pm4
I Love You,Coleman Hawkins,Hawk,Tgvspdnaylvqs3zrnyctnaf5ale
I Remember You,Coleman Hawkins,Today and Now / Desafinado,Taq6tf2lv4gvot5q77yi3vxv47a
In a Mellow Tone,Coleman Hawkins,"In a Mellow Tone, Vol. 3",Tuvfiqziv3pqlvqkllal4vcipl4
Yesterdays,Coleman Hawkins,Sentimental Mood,T3ieparoasbq4bvksr2bugbqot4
It Could Happen To You,Coleman Hawkins & Zoot Sims & Phil Woods,Saxes Inc.,Tyqwtuifyew6b53uee4wtlockmu
Just Friends,Coleman Hawkins,The Complete Coleman,T5eszywozuyrmtr5gdyawslklmm
Rainbow Mist,Coleman Hawkins,Jazz In The Summer,T2c4cmesqj5wststc4pmai63h4m
My Funny Valentine,Coleman Hawkins,"Coleman Hawkins: Jazz Explosion, Vol. 2",Tg2j4i3gbelva5zjlc3ggiitxb4
Night And Day,Coleman Hawkins,Coleman Hawkins 1943-44,Tdfivahoq7ohxmnfkp7zhqygz6i
Sonny Boy / Oleo / Dinah,"Sonny Rollins, Coleman Hawkins","Sonny Rollins, Coleman Hawkins: Together at Newport 1963",Thgna2nvfv6cm23e4b6bx4xl6tu
Satin Doll,Coleman Hawkins,Hawkins! Eldridge! Hodges! Alive! At The Village Gate (HD Remastered),Tz3bycpdg7frsvzyzmy65mv5cf4
Loverman / Stella By Starlight,Coleman Hawkins,An Introduction To Coleman Hawkins,Ttxylbtlbib2rd3mhqxudteprtu
Well Alright Then,Coleman Hawkins,"Essential Jazz, Vol. 9",T7gfrxraujs66xnkh236ytsyavq
Midnight Sun,Coleman Hawkins,The Jazz Masters (Rare Masterworks),Teqfmz6jccuiys7tj5e4wq7mp44
Honeysuckle Rose (Remastered),Coleman Hawkins,Bean's Blue Heaven,Tmnoe4efrebzbe4hsvicmbntwu4
Sweet Georgia Brown,Coleman Hawkins,At Newport,Tm2vd6noe4knde3mhlkw7xof4xy
"Take the ""a"" Train",Coleman Hawkins,Bean Stalkin' / On Broadway / With Red Garland Trio,Trkfop6n6ual7salrn6ibs5a7oq
There Is No Greater Love,Coleman Hawkins,"Coleman Plays, Vol. 1",Tvvjoqki5vf4zihpaq7lbpkjtpa
There Will Never Be Another You,Coleman Hawkins,A Music Collection: Hallelujah!,Txuvmbq5m6zhio2pz3peitpdxmm
What Is This Thing Called Love,Ben Webster,"Ben Webster, Coleman Hawkins & Friends",Tesgfotkp3wzgolaoyrzibghzw4
Yesterdays,Coleman Hawkins Orchestra,111 Swing Classic Masterpieces (Jazz Masters),Tqm2amivxbvesnju4yu63tvjeva
Give It All Your Heart,Herbie Hancock,Lite Me Up,Tjmhsdwi2vrxhzarxdfrvuwkwoq
Mc Ghee,Sonny Rollins,All The Things You Are (1963-1964),Tygvo6itydttlpsuem3qykx26wi
Alone and I,Herbie Hancock,Midnight Together,Tdw3cm5xejlg25ukpoqott53fem
Autumn Leaves,Thanksgiving Orchestra & John Hancock Plymouth,Thanksgiving Day Music,Tcv2rypd72qhcjyngixvizv5ubu
Billie's Bounce,George Benson,Jazz Driving Soundtrack,Tihhnbacdsalsoqjx6qc3us7jlm
Watermelon Man,Herbie Mann,Latin Mann: Afro to Bossa to Blues,Tufvop6xwggsm67zfnxod4tw52i
Body and Soul,Herbie Hancock,'Round Midnight: Original Motion Picture Soundtrack,Tjo5lvgqp5yg2mub4trmxrs6xwe
Ready or Not,Herbie Hancock,Feets Don't Fail Me Now,Ttcdbkwjhbtq7boymz5kapqeiwy
"Shangri-La (feat. Pepper Adams, Herbie Hancock, Butch Warren, Billy Higgins)",Donald Byrd,The Great Jazz of All Time (Doxy Collection),Tnofyzvgi2yquvtzjd6ej3o3l4y
Footprints (Remastered 2000/Rudy Van Gelder Edition),Wayne Shorter,Classic Blue Note: The Hits,Tetgobqvbyahmj67kjxk3d6golu
Rockit (12” Version),Herbie Hancock,"The Vaults, Vol. 4",T35semicnzkhw6mnz7i4tu6dpqi
Have You Met Miss Jones,Stan Getz,Jazz Moods - Cool,Te2l2rj6hwmafv4ohhe26xdin24
You Bet Your Love (Special Disco Version),Herbie Hancock,"The Vaults, Vol. 1",Tgi2egtmtqlnakp3ynqlkcwyvsy
I'm an Old Cowhand (feat. Herbie Hancock) [Bonus Track],Donald Byrd,Donald Byrd-Pepper Adams Quintet: Out of This World (Bonus Track Version),Tajz6jt2oha2jgivzklpi7kt6pi
It Could Happen To You (1990 Remastered),Sonny Rollins,All The Things You Are (1963-1964),Tl52ks7fuf4hpdmz5v56oco2gtu
Just Friends,Tony Bennett,Jazz,Tw4c2abeppyq3ltazehgs2z3wuq
Misty,Stan Getz,Jazz Moods - Cool,Tt22ywk2w6hswac4m227zhqoumq
My Funny Valentine,Katia Labèque & Herbie Hancock,Little Girl Blue,Tiysrbwc72bm4pfzo5ouexppcnu
On Green Dolphin Street,Herbie Hancock,The Piano,Tv2ljlf4baleng53l24gsc2si5a
Satin Doll,Nat Adderley,Sayin' Somethin',Tljx2pu3yiebbrxhnpiv4fnusd4
Stella by Starlight,Herbie Hancock,Jazz Time with Herbie Hancock,Tc4bw6brofiuq4t2ye5o5h2q5gu
Dolphin Dance,Herbie Hancock,And So... The Jazz Started / Twelve,Tnkjhn37adausxkzjd54emt6dcq
Solar Wind,John Hancock,Sounds from Another Galaxy,Txybirjtte7wnmcucjyaartl7sa
St. Thomas (alternate take) (1991 Remastered - Take 8),Sonny Rollins,Alternatives,Toatvkkmcjxp32mb5dghdv2xwqu
Sweet Georgia Brown,Benny Goodman,"The Yale University Archives, Volume 6: Rainbow Grill '66 and '67",T72i5h7w77ke77ifdzcpo7znldu
Finale: The Girl From Ipanema (feat. Gal Costa & Jon Hendricks),Antonio Carlos Jobim,Antonio Carlos Jobim And Friends,Tutfut45o34yarsnpvuu34owabe
"There Is No Greater Love (feat. Herbie Hancock, Dick Hyman, Bucky Pizzarelli & Ron Carter)",Toots Thielemans,Toots Thielemans 'Toots'. Tony Mottola 'Heart and Soul',Tiyjm3eli4vpsll2noegojjvahe
What Is This Thing Called Love?,Herbie Hancock,The Cole Porter Songbook,T47y2mcc6sdnfk2pwwarezmlqwm
Don't Worry About Me,Red Garland,All Alone,Toxtczwi6ggz7ebjmayvy2yhzk4
"All the Things You Are (feat. Lee Konitz, Zoot Sims, Phineas Newborn Jr., Red Garland, Oscar Pettiford & Kenny Clarke)",J.J. Johnson|Kai Winding,The 1958 European Tour (Remastered),T5abropbmchf27zsuswsojio4ea
Billie's Bounce,Red Garland,No. 1 Classic Jazz & Swing Album,T4f6wkdf6untzjud4hy2vbngl4i
Body And Soul,Red Garland,The Most Relaxing Jazz Standards In The Universe,Tzvvl2bknqzngtsjr3ykblan7na
But Not for Me,Red Garland,Red Garland's Piano,Toynhrjgjtqh5iquhbg2jpo3vty
Bye Bye Blackbird,Red Garland,Bebop Jazz Legend,Tkfk5kfzyz424jaymyqd5ald5fi
Cherokee,Red Garland,Bebop Jazz Legend,Tozywjtbi4p66dpv7wnhag5iohy
Days of Wine and Roses,Red Garland,The Quota,Tg6wu3v4tcpwllhymmufr5po56a
Manteca,Red Garland,The Best of Latin Jazz (Doxy Collection),Tnqgppt77ptrtq7dtrwij22fohu
Four,Red Garland,"The Best of Jazz 200 Classics, Vol.8",T3t2taemczssoaemiowpu33wxni
How High the Moon,"Gene Krupa, Illinois Jacquet, Joe Guy, Howard McGhee, Willie Smith, Charlie Ventura, Garland Finney, Ulysses Livingston and Red Callender",West Coast Cool Jazz,Ti25dl2l2gagl7qlnkplyt7732m
I Hear a Rhapsody (feat. Red Garland),John Coltrane Quartet,Complete Recordings,Toktuvqexj7nz5lwqd4rajtvai4
I Love You Yes I Do,Red Garland,The Complete Recordings: 1959 - 1961,T3aaowzvaojxt3ctx7jloxvz7ju
These Foolish Things - Remember Me of You,Red Garland,Alone - Blues and Ballads,Tuw3ytpkojcfl6cmtqyddawc7ee
If I Were a Bell,Red Garland,Red Garland's Piano,Tcdlkv2kry5ulv7vbmwulfr37xa
I Want To Be Loved,Coleman Hawkins,In A Mellow Tone,Tqayg24v6chaw7c3j532s3jbecy
It Could Happen to You,Red Garland,You're My Everything,Tgrbtckfvrlfhchdsqiksttg6ei
My Funny Valentine,Red Garland,You're My Everything,Tqy6aaguo6xp573dbputj6o5ike
Oleo,"Miles Davis, John Coltrane, Red Garland, Paul Chambers, Philly Joe Jones","Four! The Complete Miles Davis Quintet 1955-1956 Recordings, Vol. 4 (Hd Remastered Edition)",To4bx2iisivyzscbxq7jgdnxbyu
On Green Dolphin Street,Red Garland,The Complete Recordings: 1961 - 1962,Tn6gugfsmgfwy2jyqcrjrmxjoli
Satin Doll,Red Garland,Bebop Jazz Legend,Tapwdl5xocljh4szlvtxdusfyxe
Stella by Starlight,Red Garland,The Jazz Collection Volume Two,Tibq5lmxfokoc52upicaln52rgu
Scrapple from the Apple,Phil Woods,Sugan (Remastered),Tzrmd7iyuvvexqnrs24kwsciria
Blackout,Red Garland,But Not for Me,Tvufeifr56dywxikturt5xefb2e
Solar,Red Garland,Solar,T2oys2i5ts5cd7sse54ltoq24em
It's a Blue World,Red Garland,Red Garland's Piano / Revisited! / The P.C. Blues / It's A Blue World,Tywg7e3thx53watwk4tltv6tgmi
Sweet Georgia Brown,Arnett Cobb,Only Jazz Music,T4wcwiau7r4kumc5gzfiulxkrgy
There Is No Greater Love,Red Garland,"Four! The Complete Miles Davis Quintet 1955-1956 Recordings, Vol. 1 (Hd Remastered Edition)",Tnga3hqapmdg5heorvh4k5vbxmu
There Will Never Be Another You,Red Garland,Bebop Jazz Legend,T2tdvx6fivqdov22ji4he6rbkg4
What Is This Thing Called Love?,Red Garland,Bebop Jazz Legend,Tzwpacet7tcemle6c6ndgechf64
Yesterdays,Red Garland,Le meilleur du jazz des années 50 (100 versions originales),Tavqx7gavhkmykyzhgnxvwitghm
All The Things,Charlie Christian,Immortal Charlie Christian - Guest Artist,T4i753fpmsundbjryn3p45h7kbi
Alone Together,Lee Konitz,Alone Together,Timhwgpfveeev6ohbkpv2ilw3gi
Cherokee,Lee Konitz,Alone Together,Tn7mkcts2v4wvosycnbc2ie6h5q
Days of Wine and Roses,Mark Turner,In This World,Tulpihffh2dsazc24iqpjlo4e24
Interlude 4,Joshua Redman,Timeless Tales (For Changing Times),Thpgadjiyso7muef7uck5vtly4e
Loving You (From Passion),Peabo Bryson,Color and Light: Jazz Sketches on Sondheim,Tttfxr25oqbqeygjrbiozux7hqa
If I Should Lose You,Kurt Rosenwinkel,Deep Song,Ttql53sv3lkftvnujryfzaqjxyu
On A Misty Night,Peter Bernstein,Somethin's Burnin',Tvfjlkw7gmvtflyiztxbgbazjpu
Stella By Starlight,Marian McPartland,Marian McPartland's Piano Jazz with Brad Mehldau,Tzxwnweevipi345mmfpdc5scm6y
"Fugue No. 16 in G Minor from The Well-Tempered Clavier Book II, BWV 885",Brad Mehldau,After Bach,Tvahcm5b5zzpxxtvxbluqly4uuy
Father And Sun,Wolfgang Muthspiel,Rising Grace,T6ayjofpwtxnejqgq7ewek65lh4
Wave / Mother Nature's Son,Brad Mehldau,Largo,T6dtu2me5k64yidbojwqbiyuqve
What Is This Thing Called Love?,Lee Konitz,Alone Together,Tvvtjxoen756slot43bmoat4qxe
Yesterdays,Joshua Redman,Timeless Tales (For Changing Times),T5aobleoqfjppwmbp2idg6lihqe
Movement 12: I Am (Don't You Run From Me) from All Rise (Edit),Wynton Marsalis,The Music Of America: Inventing Jazz - Wynton Marsalis,Tmad756k2oa4r3qnkp7qtn6l5o4
Autumn Leaves,Wynton Marsalis,Marsalis Standard Time - Volume I,Tbd4gij2kun6qdpcdahxjmarioy
Cherokee,Wynton Marsalis,Marsalis Standard Time - Volume I,T3yhjqgbvfv2pg56447vxgo5h2q
Acknowledgement,Jazz at Lincoln Center Orchestra,A Love Supreme,Tcieklsyu3r4th3jvdrfosil4yu
Eta,Wynton Marsalis,"Jazzy Wonderland, Vol. 4",Tyvxnnslgmj36ns5qlehq2xkuwy
"Baby, I Love You",Wynton Marsalis,Magic Hour,Trwnuwx25fprqangjktgrksx7di
I'll Remember April,Wynton Marsalis,Standard Time Vol. 2: Intimacy Calling,Ta3nl634afrl3yi3ipyihhsbtda
In a Mellow Tone,Marcus Roberts,The Truth Is Spoken Here,T4mz7nhgtrgbwm3gys544qyyoyq
"Swingdown, Swingtown",Wynton Marsalis,It Could Happen To You: Music From The Motion Picture,Tn24b6i7v37s5wkrcabt3o7swue
My Funny Valentine,Wynton Marsalis,My Funny Valentine,Tgkdwcjw3y7pjmm4vicdclqxn5y
"Oh, But On The Third Day (Happy Feet Blues)",Wynton Marsalis,The Music Of America: Inventing Jazz - Wynton Marsalis,Tri53cj2ap65fztpk2vbrlruw2y
"East of the Sun (feat. Oliver Gannon, Lorne Kellet, Torben Oxbol)",Wynton Marsalis,Goin' Down Home,T36zdnkcza4wur63uvk53ahukfa
Winter Wonderland,Wynton Marsalis,The Ultimate Classical Christmas,Tm4fw3eusjftzqwbqx6snhm6zyu
"Take the ""A"" Train",Jazz At Lincoln Center,Jazz At Lincoln Center: They Came To Swing,Tuseequwh5uxfalh2ycppejkz3y
My Funny Valentine,Wynton Marsalis,There'll Never Be Another You,Tcvpgz2tlnftz7wlgvrd5kqb42m
What Is This Thing Called Love?,Wynton Marsalis,Standard Time Vol. 2: Intimacy Calling,T7mynk6at5hv2ke3ck7gmqkz7fy
Yesterdays,Wynton Marsalis,Standard Time Vol. 2: Intimacy Calling,T4ldqa2vzuerp5rtdh3md3hfkma
It's All Right with Me,J. J. Johnson,Keep Calm & Jazz On,Tpt3snegc3xa3ilebj3vqyi7ou4
Alone Together,J. J. Johnson,"The Songs of J. J. Johnson, Vol. 3",Tkl3dlewuyrpkby22ejnxltp6py
Autumn Leaves (Les Feuilles Mortes),J.J. Johnson,Standards,Ttcpdyoal3wzkja6ffcdw5wkf6a
Billie's Bounce,Stan Getz and J.J. Johnson,Plays The Blues,Tnorpd2aikyreqku2xazsqryfma
Blue Bossa,J.J. Johnson,Quintergy,T2nozvzxnc7as62u5ne3uyvyoce
Body and Soul,"J.J.Johnson, Illinois Jacquet, Jack McVea, Les Paul, Johnny Miller, Lee Young","Unforgettable Jazz, Vol. 2",T6ukqlqvnjsviklivz7gbwgclp4
Bye Bye Blackbird,J. J. Johnson,50 J. J. Johnson Essentials,Tofreshhfczltutrzuy4likeiee
Viscosity (Alternate Take) [Remastered],Jay Jay Johnson,The Blue Box (Doxy Collection Remastered),T7t7kuzzpjxmejfueosj2kriawy
Overdrive,J. J. Johnson,"J. J. Jazz, Vol. 4",Tnv3vfbrk4ftixnbhx4ffbmr2qe
How High the Moon,J.J. Johnson,Jay & Kai (Bonus Track Version),Twsqxpyr5l7q35w3esncwniezvu
Third Movement: Love You Nana,J.J. Johnson,Let's Hang Out,Tugkglnjku25girlkniy24rkvr4
I Remember You,Tony Scott,"Cool Jazz, Tony Scott Y J.J. Johnson",Trjehffwohpgul76wiiefijhvka
I'll Remember April,J.J. Johnson,Trombone by Three / Four Trombones the Debut Recordings,Tvpshcz6lgtj5opvxgzduxcgxfe
I'm Old Fashioned,The Phil Swanson Trio,The Song Endures - Classics Songs for Jazz Trio,Td4cutm627yrwntqso5cdckqgya
In A Mellow Tone,Zoot Sims,Passion Flower - Zoot Sims Plays Duke Ellington,Trjbl3jrzwaqetpz37bqcny73lq
In A Sentimental Mood,J. J. Johnson,Trombone And Voices,Tte2jkmugwfodrrd3hn7yxccpjm
It Could Happen To You,J. J. Johnson,"J. J. Jazz, Vol. 3",Ttcyfmy4xn2yaxd6u44wnnp6jnm
Just Friends,J.J. Johnson,Standards,T5iq7oytnue4gwkmijnmkcjz2ay
Minor Mist,J. J. Johnson,"The Jazz Masters Series: J. J. Johnson, Vol. 9",Tdpaaxvndaak3atbhyxo6boqyk4
My Funny Valentine,J.J. Johnson,Standards,Txg4usndtmz32wcvcg4hvvul75y
Rise 'n' Shine,Jay & Kai + 6,"Day, Night and Big Big Bands",Tul7toevvihywf5y6flyju6qqse
Satin Doll,J.J. Johnson Quartet,The Trombone Master,Tf22b6452p4ewaschwqezokmfka
Stella By Starlight,J.J. Johnson,Proof Positive,Tkct7rvwxiyoj7rn7c2dzlytcei
Scrapple from the Apple,Sonny Stitt,Stitt Plays Bird / My Mother's Eyes / Sonny Stitt & Bud Powell & J.J. Johnson,Tdxu2uyulzga7qlvwhydkjlf6dq
So What,J.J. Johnson,J.J.! (Expanded),Twqmmz3bv6rrylml3m5u7ytibky
Solar,J. J. Johnson,"Classic J.J. Johnson, Vol. 2",Tdz7nlocfvpo32jy6j7n6eivtz4
"Take the ""A"" Train",The US Air Force Airmen Of Note,Two Sides of the Airmen of Note,Ty75eeeuv3krb2kmftsx7kfgtva
There Will Never Be Another You,Tony Scott,"Cool Jazz, Tony Scott Y J.J. Johnson",Tzxw5cfiahd3d2tmf632c35vuly
What Is This Thing Called Love,J.J. Johnson,The Trombone Master,Tlgha7rvl4hgvsg22mwdq57kn2m
Yesterdays,J.J. Johnson,Trombones Got Rhythm,T3bjzbe6lp7pps3bofsdbpow2ga
All of Me (feat. Johnny Hodges),Duke Ellington,Jazz Party,Twhdnbcxrnmgb6fisdkkele5yb4
All The Things You Are,Milt Jackson,La Ronde Suite Vol 4,Tz2okha3hhwizlot4e7ekwapcve
Alone Together,Milt Jackson,Milt Jackson: Alone Together,Tbc22nh2u5qq3iipvcfw6zg2kde
Autumn Leaves (Les feuilles mortes),Cannonball Adderley,Things Are Getting Better (Original Album Plus Bonus Tracks) [feat. Milt Jackson],Trkbnjhfv5snbdxlirsrvj3fxde
"Billy's Bounce (feat. Ben Webster, Percy Heath, John Lewis & Milt Jackson)",Kenny Clarke,Kenny Clarke - Volume 10,Tsb7jc7folybrtcmwbcjvsqtxme
Body And Soul,Milt Jackson,MILT volume 1,Tzmk74hlswl7xeoazsubgj53q4i
But Not for Me,Milt Jackson,"The Ultimate Jazz Store, Vol. 28",Txkksmguc4j3e2zbdhsxr3citmu
Cherokee (Indian Love Song),The Modern Jazz Quartet,M.J.Q. And Friends: A Celebration,Tfvcrtwihcsxmadm7lmu6rpychi
"Confirmation (feat. Ben Webster, Percy Heath, John Lewis & Milt Jackson)",Kenny Clarke,Kenny Clarke - Volume 10,Tq5zi4a3beq2zm25o5l4xfsb76m
Days Of Wine And Roses,Milt Jackson,Bags And Brass,Tuihw3mlxbzqyfx7edlerys65ni
Slow Death,Milt Jackson,"In A New Setting (Expanded, HD Remastered)",T3kvx5hjsllqyxzlwbvl6zdtmhe
Concorde,Milt Jackson,La Ronde Suite Vol 4,Tjnf4z3ylm67f5oegffgvn4wyhq
How High the Moon,Milt Jackson,The Atlantic Albums Collection 1956 - 1961,Tpnyzoqlmetryk7zvmmr6ohvime
I Love You,Milt Jackson,Best Of Jazz Vibraphone,Tw3mo5yj2p4tv76nvywtbb6e2du
I Remember You,Stanley Turrentine,Cherry,Tlzklvqwihejhhaciljogt2omrm
I'll Remember April,Milt Jackson,"Milt Jackson: Jazz Explosion, Vol. 3",Tznctqdw3jsrb7jslfycsgodpgm
If I Should Lose You,Milt Jackson,Big Bags,Tqkar2ykrih22lkwwa2vcth4eo4
In A Mellow Tone,Milt Jackson Quartet,Soul Route,Tpa7gahcgzkqyv76mntxgxoiyx4
In a Sentimental Mood,Milt Jackson,Bags' Groove,Tfnrstspcip7sqmjpyk25cfcvuq
Monterey Mist,Ray Brown,Ray Brown/Milt Jackson,Tiol6ffvgdsygwfvpiomf2ey7ui
My Funny Valentine,Milt Jackson,Milt Jackson Quartet,Tidjtikearock6lgkp22mnkosjm
The Night We Called a Day,Milt Jackson,Jazz Masters - 50 Classic Tracks,Tnoeugemkdg37numb4vzylh7i4q
Green Dolphin Street,Milt Jackson,Reunion Blues: The Best of Milt Jackson,Ts5q3u7rnum4k7y2uheajvbozam
Satin Doll,Duke Ellington,Jazz Party,T3dagnr75e7qccxnrteza5ablhi
Stella By Starlight,Milt Jackson Sextet,"Invitation, The Complete Sessions (HD Remastered)",T4abn2b7ru6algrkkb65eambysa
Scrapple from the Apple (Remastered 2015),Charlie Parker,The Bird Returns (Remastered 2015) [feat. Miles Davis / Max Roach / Milt Jackson],Tayxx5vuo6ahwp6v2diau5vxyh4
Heartstrings,Milt Jackson,It Might as Well be Spring - Jazz Classics,T4gisu7fsxbwy4cv4csvx7l4nsa
The Midnight Sun Will Never Set,Milt Jackson,The Ballad Artistry Of Milt Jackson,Thcb3oqwkie65tkif4dqdxlvj6m
Bag's Groove,Leon Thomas,The Creator 1969-1973: The Best Of The Flying Dutchman Masters,Tcelimzsyhgfzycxsosnhpz6n64
Sweet Georgia Brown,Milt Jackson,Vibrations,T2lg36qztqmtqmf7bpgmkekog2e
There Is No Greater Love (feat. Marty Symes & Isham Jones),Miles Davis,Miles Davis and Milt Jackson,Thu52g3ao4bwk5wnnjtvdfzqkcq
There Will Never Be Another You,The Modern Jazz Quartet,M.J.Q. And Friends: A Celebration,Tmy4kjd2p26cpwzgfxrs7o3p3mu
Yesterdays,Milt Jackson,Ready,Tedctd2d7w3u4ql2qrkdhmkpqva
"Just You, Just Me",Red Norvo,Red Norvo And His All Stars,Tns3vccbirjvrsmo2i5enzccqru
I Heaven't Changed a Thing,Red Norvo,With All My Heart and Soul,Tntx4mxf33mnndvtlt7zjckmnfy
Body And Soul,The Benny Goodman Sextet,Small Groups: 1941-1945,Tjcu5n4aglhlrno7tyvyksqs4tu
You Ain't Gonna Bother Me No More,Red Norvo,Red Norvo,Tuuht4fjbpqil2acqxlvswpjhfu
Cherokee,George Shearing,Midnight on Cloud 69 (HD Remastered),Tmc4tqh5k2phsnjrh35sbyi44wi
Move,Red Norvo,The Story Savoy (Doxy Collection),T4pacgodszd6z7wn2wn54upcdgy
Tenderly (Dancing on the Ceiling),Red Norvo,Four Classic Albums (Dancing on the Ceiling / Red Norvo in Stereo / Red Plays the Blues / Music to Listen to Red Norvo By) [Remastered],Tndxqhkmhti3kbufl6tl4ezo774
Have You Met Miss Jones,Red Norvo Trio,The Savoy Sessions: The Red Norvo Trio,Teengro4onyzlyvka6csmabgsea
How High the Moon?,"Charlie Shavers, Willie Smith, Stan Getz, Red Norvo","The Legendary Music of Artie Shaw, Firehouse Five plus Two, Dizzy Gillespie, Chet Baker and Other Hits, Vol. 4 (150 Songs)",T7sjlur77hyvyboy7iq2ahj4kqy
Why Do I Love You,Red Norvo,Jazz Classics Series: In Stereo,Tbnj7nbiyxqiagr2ihnmq2pzvta
I Remember You,Red Norvo,"More Jazz Classics, Vol. 4",Tdxnwrnvzyfglluqopysaxhuybe
I'll Remember April,Red Norvo Trio,The Savoy Sessions: The Red Norvo Trio,Tyhettnv47tck3ybg25glpexhzm
In A Mellow Tone,Red Norvo,"The V-Disc Project: Classic Jazz, Vol. 5",Tacwf6zbyq7ooi2cfw77ju32nje
It Can Happen To You,Red Norvo,100 Jazz Rarities Vol. 6 - The Mid 30's Part II,Tzuzo7ocqytblz5xzivpbdlnoxe
Just Friends (Not on original album),Benny Carter,Benny Carter All Stars,Tptx45widvv7uqwt4aexb4lgbaq
In a Mist,Red Norvo,"50 Shades of Jazz, Vol. 36",T4lkvehhcesuruni2dao44edgwe
My Funny Valentine,Red Norvo Quintet,Red Norvo Quintet: The Forward Look,Ti7dyarfekuqlksemhzpbuow3ly
Night And Day,Red Norvo Trio,The Savoy Sessions: The Red Norvo Trio,Tvkdee2o3x5dpr4gac7pq2ksnv4
On Green Dolphin Street (feat. Hank Jones & Jimmy Rowles),The Red Norvo Combo,Vibes a La Red,Tjry5elcodswnb6shwwqkwgtk6m
Stella by Starlight,Red Norvo Quintet,Red Norvo Quintet...Naturally,T5z3reyktdkqao5iyottrnfxdsq
You're So Desirable (02-27-39),Red Norvo,Complete Jazz Series 1939 - 1943,Tgzpmy5hucfmj4wztar4n2at6ni
East of the Sun,Red Norvo,"The Norvo-Mingus-Farlow Trio, Vol. 2 (HD Remastered)",Trfwapf5obtamemrgcxne4lhzum
Sweet Georgia Brown,Red Norvo,"The V-Disc Project: Classic Jazz, Vol. 1",Txyihxfyw3ctoix7ail7gklk42m
There Will Never Be Another You,Red Norvo,The Greatest Of The Small Bands,Tf7kkmmzl5eoji7r4jdwbdfvhie
What Is This Thing Called Love,Red Norvo Trio,Red Norvo With Strings,Tmwhrrqob6cn4hy4sq4dfjulvja
Congo Blues,J.C. Heard (Red Norvo & His Selected Sextet),Jazz Classics: Yesterdays,Tdbabhm5hjhgovj27snhl2niffq
All Of Me,Art Van Damme Quintet,The Art Of Van Damme,Trgc3ebx34rsupk6w5a6tlpzz44
All the Things You Are,Art Van Damme,Beyond the Sea,Ttkevn62seag52x5afo7rloptjm
Autumn Leaves,Art Van Damme Quintet,The Art Of Van Damme,T6t7sudbasxflfrlygbhgks4f5i
But Not for Me,Jo Stafford and Art Van Damme Quintet,Once Over Lightly,Tqzyqcnfybbghkaqcnfw727tlya
Bye Bye Blackbird,Art Van Damme,A Perfect Match (Bonus Track Version),Tori2ovxu4vvrjhprl6323wkmam
Cherokee,Art Van Damme,Lullaby in Rhythm,Tgqtpysf3e655jyprrpyssr6i5a
Snowfall,Art Van Damme Ensemble,Art and Four Brothers,Tbcqqesu7tpco6xwvopgx4tv2ry
Almost Like Being In Love,Art Van Damme Quintet,You Made Me Love You / Jazz + Vol 4,Twt5smxvuvkvci7ilwhq3ggbajm
I'll Remember April,Art Van Damme,The Van Damme Sound,Tpdecrxkqu56h7yhzzxcvhzfsea
