Days of Wine and Roses,Joe Pass,Joe Pass Quartet & Septet: Walking Up,Teaqrlmez5vvnckpy4cowndtvgm
Alternate Four,Clark Terry,The Alternate Blues,T4urhhpuuvkf7k76w2mydd2mu24
Have You Met Miss Jones?,Joe Pass,Virtuoso (OJC Remaster),Teymhn6gia7l5nt7cu2luvput4m
How High The Moon,Joe Pass,Virtuoso (OJC Remaster),Tijkp6b6ym3ptotlzwy6kwhpif4
I Love You,Joe Pass,Intercontinental,Tss54jw5n55ug6qzjbllvniembi
If I Should Lose You,Joe Pass,I Remember Charlie Parker,Trqgjlnbjkxfplnu6do3hpyvjgy
Ill Remember April,Miles Davis,Evolution Of A Genius,Tgfj2zdhgzy4d4pku65pno5qa24
In a Mellow Tone,Autschbach Trio,Pass It On (A Tribute to Joe Pass),Twkitqcrmftr46b2lyjjhkbj3hm
In A Sentimental Mood (Instrumental),Milt Jackson,"The Ellington Album ""All Too Soon""",T2cuukwxzuntc3u3ropkfiez4du
It Could Happen to You,Joe Pass,Something Special: The 1962 Session (Bonus Track Version),Tuabcskiogfn4xf3fco44mhmluq
Just Friends,Joe Pass,I Remember Charlie Parker,Trdffeg4qklpkqrbnhtjfmjpt6e
Misty,Joe Pass,Jazz Love Songs After Dark [Playboy Jazz Series],Thqdb5vxpsu2o2iqz432pkoatzi
My Funny Valentine,"Chet Baker, Russ Feeman, Joe Pass",Chet Baker Sings (Hd Remastered Edition),Tckesmfxmzih6zvfbqx7ybvfyee
Night And Day,Joe Pass,Virtuoso (OJC Remaster),T7wbdwu6sykv7wah2ku3iepv65i
Oleo,Joe Pass,Digital III At Montreux,Tncytuo6iyj44w45o6bgw55xwka
On Green Dolphin Street,Joe Pass,"Joe Pass Hall, Vol.2",Twzfaesybcs5ghd4df5ns6fqgjy
Satin Doll,Joe Pass,"Joe Pass Hall, Vol.2",Tz6yryz3rcqiucjh6rjbx2hmg3i
Stella By Starlight,Joe Pass,Virtuoso (OJC Remaster),Txuxjioj6cjnnhiavy7cezzta7a
So What,Joe Pass,Something Special: The 1962 Session (Bonus Track Version),Tjtcifpzay52wpp6pg5pb6hp5cq
"Midnight Sun (feat. Oscar Peterson, Joe Pass, Louis Bellson & Ray Brown)",Sarah Vaughan,Centennial Celebration: Johnny Mercer,Td4syld3mnnz7dhbrcdq7peccyi
Take The 'A' Train (Instrumental),Milt Jackson,A Celebration Of Duke,Tgitp5wxt2ysullmbrkx2z7wbau
There Is No Greater Love,Joe Pass,Joe Pass Quartet & Septet: Walking Up,Thyghujsovwwozw6pj6f5nmc6ze
There Will Never Be Another You,Joe Pass,Joe Pass Quartet & Septet: Walking Up,Tgzayqvpiahos4sswppkcf66edu
This Thing (Called Love),Tori Starlight,A Shot of Summer - Beach Music (Best of Electronic Downbeat Music),Tkjqj6jj7vgbtoygku57uyvkjta
This Too Shall Pass,Joe Layne,Yesterdays,T6ovf7g4stqllrdljtsooi2o2zm
All the Things You Are,Michel Petrucciani,Concerts Inédits: Trio,T35okvvpic3u7olksaeqzwdlsxu
Autumn Leaves,Michel Petrucciani,Concerts Inédits: Solo - Trio,Tpcji5o64wydemkngygcbslq3gu
Brazilian Suite,Michel Petrucciani,Blue Note Plays Bossa Nova,Tbo2awulnqwclgki2yhpdfofr5q
Body and Soul,"Francesco Cafiso, Riccardo Arrighini Trio",Concert for Michel Petrucciani,Tzviugiybrfm7a5t3dloj7quvna
But Not for Me,Joe Bushkin,1947-1950 (HD Remastered),Twm4sbvvwkyrycmy43qxcghd6va
Cherokee,Michel Petrucciani,Michel Petrucciani,Tig4knf2xa23usuhh3xpadfemju
Eugenia,Michel Petrucciani,Days of Wine and Roses,Ttwfwafkl5zfmjweqs3cvadiiie
My Bebop Tune (Take 4),Michel Petrucciani,Conversations with Michel,Tpxmmzncsjmmhzom23sky6nlh2a
How High the Moon,Mary Lou Williams,1945-1947 (HD Remastered),Txi5fxfzlbtyntcv5ksjkptsgqy
I Hear A Rhapsody,Lee Konitz & Michel Petrucciani,Toot Sweet,Txiz2qwr7qp5v4eatgf3ei236da
You Don't Know What Love Is,Louis Petrucciani,Darn That Dream,Tqrnbzckjizj4u2s46cjwudiaei
I remember you,WHITE NOISE THERAPY,현대인의 힐링을 위한 테라피 뮤직-너를 회상해,T6jb5xflpujcflbcsxjwpqhowry
I'll Remember April,Michel Petrucciani,Flamingo (Bonus Track Version) [New Mastering],Tlbrn5y5gxaxgswkcqap45iyz7u
Looking Up (feat. George Mraz & Al Foster),Manuel Rocheman,I'm Old Fashioned,T6urt3xbqwfb67c3nyp4hges5wa
In A Sentimental Mood,Michel Petrucciani,Triple Best Of Petrucciani,Tostn7ytjtcz2upshiq3pvzlzuu
Rachid,Tony Petrucciani,"Just Friends (feat. Thierry Gonzalez, Alain Marque, Michaël Juraver, Guy Ould-Yahoui)",Tddghfj4jbjxnlxo4ctita3afdm
Misty,Michel Petrucciani,Flamingo (Bonus Track Version) [New Mastering],Tt7gbtftpn7rlf4nkzhwdwn3haq
My Funny Valentine,Michel Petrucciani,Days of Wine and Roses,Ttivleslv75bipkkmpg2mprvwf4
Night And Day,Michel Petrucciani,Triple Best Of Petrucciani,Tzyos5jbtzxim74m7w66ljbub4y
On Green Dolphin Street,Michel Petrucciani,Concerts Inédits: Solo - Trio,Tqd4f7rz7mbkasxia5ed4tgs3se
Satin Doll,Michel Petrucciani,Triple Best Of Petrucciani,T26gdesufiswnyxe6otzqxyx7ly
Stella By Starlight (Studio),"Louis Petrucciani, Michel Petrucciani",Flashback,Tqv6njhztermwtd7m3jfwpc33i4
So What,Michel Petrucciani,Trio In Tokyo (Bonus Track Version) [New Mastering],Tq3id42on7wj2qe376xenlfhps4
Here Am I (Night Sun in Blois),Jody Shayne,Firefly Rides,Tkt632g56d5qihhxt5xqqrwvumq
St. Thomas,Michel Petrucciani,100 Hearts,Tyiri6ulnl3jgu3tmsynbwiev5e
Sweet Georgia Brown,Michel Petrucciani,Flamingo (Bonus Track Version) [New Mastering],T3aqbgfugziuqkstag7olikd56m
"Take The ""A"" Train",Michel Petrucciani,Triple Best Of Petrucciani,Tzindnc2ar7lyx2xmbjwu6iqvsm
There Will Never Be Another You,Michel Petrucciani,Days of Wine and Roses,T2b47sokz6wj3niq2smquiawxju
All Of Me,Earl Hines,"Evening With Earl Hines, An",Tq5lcokbdhhar7g2dokqxnkryne
All the Things You Are,Dizzy Gillespie Sextet,"The Best Music Collection of Dizzy Gillespie, Django Reinhardt, Earl Hines, Johnny Dodds and Other Famous Artists, Vol. 3 (150 Songs)",Tvt6vh3u2mnfmbpnb6pjdkwuuoi
Body And Soul,Earl Hines,That's a Plenty Vol.3,Tn2neyxchohcrplvex7nrt6bcre
But Not for Me,Earl Hines,Up to Date with Earl Hines,Tnpudeso53nyqjz5kuvkziowiqq
Bye Bye Blackbird,Earl Hines,The Complete Recordings: 1951-1961,Tbaww3dsjoo2xs5gid7wki5cwle
Stowaway,Earl Hines,Earl Hines (Doxy Collection),Tpglczdmwqqrkazu3b6censytfq
Pianology,Earl Hines,Big Band Era Vol 4 (The Golden Age of Swing),Ttef2xvqghf5g226rout4svxjfy
Rosetta,Garnet Clark and His Hot Club Four,How High the Moon,Thuwncgc62vuafk6b5fl46wa3va
Somebody Loves You,Earl Hines,Paris Session,T2hemellslkjvwojl44gbu23nhi
In a Sentimental Mood,Earl Hines,Earl Hines Plays Duke Ellington Vol. II,Tq64gknk53fjzeequ73jswsmyie
Just Friends,Earl Hines,Earl Hines,Tvulsuer3fvkx6acmpvzxdnouwa
Medley: Canadian Sunset / Lullaby of Birdland / Misty / Satin Doll,The Alex Welsh Band,Earl Hines with the Alex Welsh Band,Tf762gtpcda4blv6bgntgxdpznu
My Funny Valentine,The Ramsey Lewis Trio,Enjoy Great Jazz - Vol.5,T6qwjp552jvc2pamqfxdpeh5lim
Night and Day,Earl Hines,Earl Hines Plays Cole Porter,Tlwyyi3zlppxkimnlberfgccvsq
Green Dolphin Street,Bill Evans,Verve Jazz Masters 5: Bill Evans,Tbpqzdn2d5opipbx5detaefjtpi
Satin Doll,Earl Hines,Earl Hines Plays Duke Ellington Vol. II,Tj734l7ry2ej6ahh2sadfwcbfye
Stormy Monday Blues (Remastered),Billy Eckstine,Stella by Starlight,Trhhkbndgtuzo4xqpxvilnnpl6m
Everything But You,Earl Hines,The Duke Ellington Songbook,Ty6zoxsi7o3jf5u73zl6x4pv6lu
East of the Sun,Earl Hines,The Earl of Hines,Tublgxwsqqecz6zio2xgh5v5ccq
Julia,Earl Hines and His Orchestra,Hunt's-up,Teh7e3zk6alx3atdgqvv6uekrxu
Sweet Georgia Brown,Earl Hines,All Time Jazz Classics - 20 Original Hits,Tk4cfxy35nly27zuae4qo7k7uau
The Girl From Ipanema,Earl Hines,Earl Hines Classic Trio,Talx53ow5hmc45b7dcajycdwkey
There Is No Greater Love,Earl Hines,Earl Hines' Snuggly But Ugly,T2o4tq72thgxvhbxyndv25m55ka
There Will Never Ever Be Another You,Earl Hines,Tour De Force,Tnvktdo7nurflkoxf3xob63rhd4
Up Jumped The Devil,Earl Hines,Spring Time Of Love,T7prlgsma2waavvnkoxmjyg6ksq
What is This Thing Called Love?,Earl Hines,Earl Hines Plays Cole Porter,Txsrp5iqnbazblgdqkducnlee34
Boogie Woogie On St. Lewis Blues,Earl Hines,"Ghost of Yesterday, Jazz of 1940",Tdaks4htbl7lpxhk7nx2kmq7gne
All of Me,Chet Baker,"The Chet Baker & Lars Gullin Jazz Collection, Vol. 49 (Remastered)",Tu7nfz6vi77ex4pawatbuhvh2vq
All the Things You Are,Chet Baker,Songs for Love,Twhwbkfhqdrehw5oxlrv5ui6fku
Alone Together,Chet Baker,Greatest Hits,Thmpbkzgjwgn3kztcmbujccrfwm
Autumn Leaves,Chet Baker,Cool Chet Baker,Thas4caa7saiyh44idzgnkbddqu
Billie's Bounce,Chet Baker,The Chet Baker Collection- Vol. 5 - Lady Bird,T4wnvmm7j7y4qzsctfq6uu6itme
Blue Bossa,Chet Baker,Brazil On Air,Tcjbtvgq7dkescschhzwxvytxui
Body And Soul,Chet Baker,Chet Baker Sings Again,Tpmfywty3qwscnum7urjljrf56q
But Not for Me,Chet Baker,Songs for Love,Th6agv4jr7nbwfd4n3e23mkknhe
Bye Bye Blackbird,Chet Baker,Candy,Tgpg7pl6lyqijla5t7y63dp3b4i
Cherokee,Chet Baker,The Very Best Of Jazz - Chet Baker,Tuydvjdz6l5dufwo3i3vlhaflzq
Confirmation,Chet Baker,Lounge Jazz Café - Tel Aviv,Tam6qqzfldpvuwlnkvluhhjilly
Early Morning Mood,Chet Baker,"Chet (Hd Remastered, Restored, Keepnews Edition, Doxy Collection)",Tzrx6viekyxaaht2rssgbppoxla
Forgetful,Chet Baker,"Tommyhawk, Vol. 4",Tzrch4xpunmebgvjyk5zpzuon5m
Have you met Miss Jones,Chet Baker,Greatest Hits,Tupimldcccnyru2alucbzs3qewa
How High the Moon,Chet Baker,Greatest Hits,T4mucvfnxv4k6x4x36h2je4635q
I Love You,Chet Baker,I Love You,Twaxexo3vo5c44uetwimn6mwpkq
I Remember You,Chet Baker,Greatest Hits,Txb34yxuipwvyafuznbpvlpgghe
I'll Remember April,Chet Baker,The Riverside Collection,Tarw6dxpqvlc57je2qe4slfm2yq
I'M Old Fashioned,Chet Baker,Best Of Chet (Remastered),Tfy256fpfg6feal6e7buftczp2m
If I Should Lose You,Chet Baker,It's Always You - Vol. 1,Tcu4c4tzyyon2fl4rcdomogbise
In A Sentimental Mood,Chet Baker,Finest,Tsxqhhnhlvs6v3yntmln2ljahoq
It Could Happen To You,Chet Baker,Best Of Chet (Remastered),T37bepqne6ayqb6nwr4er4sx55a
Just Friends,Chet Baker,Just Chet Baker,T4uacbwk7rxiph2tudsxlhe6hpu
Romas,Chet Baker,On A Misty Night,T5kqt3dw6ml2ft2774sd67qt3sm
My Funny Valentine,Chet Baker,My Funny Valentine,Txmem2zywajimt2uxr2uqmuyvjm
A Foggy Day,Chet Baker,A Night On Bop Mountain,Tbov6tri7oqgyk7ib2ew6z4r7a4
On Green Dolphin Street,Chet Baker,"The Jazz Masters Series: Chet Baker, Vol. 15",Tx7bya3g2cmlqfmmsqrtajni7hq
Stella by Starlight,Chet Baker,Stella by Starlight,Tf2wm6hsczl5lt5z6hrh2zyvjiq
Scrapple from the Apple,Gerry Mulligan,Midnight Sax,Te4vnjpja7n2g4o5an43vdi4ejy
Success and Then What?,Chet Baker,"It's Always You, Vol. 5",Thzq2h4ttx7uuikvifyq6qjeldy
Solar,Chet Baker,Chet in New York,Tya374ktfy3fni55mcreitqkgoi
"Well, You Needn't",Chet Baker,"All That Jazz, Vol. 94: Chet Baker & Friends (Remastered 2017)",Tivsqxwkko2aw4tlmsfpijkqvlu
Sweet Georgia Brown,Chet Baker,Early Chet: Chet Baker in Germany 1955-1959 (Lost Tapes),Tfxa5qwqqdnkhhx4ph6pcvzkjbm
Autumn In New York,Chet Baker,Take the A Train - New York Jazz,Tpjsmy3u5elmtwjn463e6b7dcva
There Is No Greater Love,Chet Baker,There Is No Greater Love (Shellac Memories),T22xoadlzv4pt72y67xfzw2xzqy
There Will Never Be Another You,Chet Baker,Songs for Love,Thvmm3ed2yo2cloquezphsc2v3a
What Is This Thing Called Love,Gerry Mulligan,Gerry Mulligan. Ben Webster. Chet Baker,Tgaxnz6ni37mnuhofreszipo4ju
Yesterdays,Chet Baker,Songs for Love,Tq6ragb4i6oewj54ic7br6cfvs4
All of Me,Miles Davis,Platinum Classics,Tpygia4qoo6wmyyirpcuiw4okee
All The Things You Are,Miles Davis,From Cool To Bop,T6swq42ahkqpka6gsonvaxtntfm
Alone Together,Miles Davis,100 Miles Davis,Tqixsq4xf66wjpjkygaz2rwfbda
Autumn Leaves,Miles Davis,Absolute Miles Davis,Tlc2tcmv2siicloucid4pzztxpm
Billies Bounce,Miles Davis,The Cool Collection Vol. 1,Tmdsynipf4j4lfnyf72dv5wsvh4
Felicidade,Vince Guaraldi Trio,Jazz Impressions of Black Orpheus,Tqmxbpvha6b3gf65yhuajg4y2ga
Donna Lee,Sonny Davis,Blue Bossa,Te5xirqodiqk2ovogcradq52gue
Body and Soul,Miles Davis,Early Miles Vol. 1,T7by47uzq4vqiekgudvkz7y5kom
But Not for Me,Miles Davis,The One and Only,Tbay4jrvrosv7v6atfrvn6ib7dq
Bye Bye Blackbird,Miles Davis,Absolute Miles Davis,Ta7w7ohhxqjlgkr7ldhedgczgti
Confirmation,Miles Davis,Miles Davis - The Ultimate Collection,Tg2ggza2zsatorkzonarfoa5o54
Summertime,Miles Davis,"The Best Of (Remastered, Doxy Collection)",Tkxt3zii7rt42ozflnc275siuhy
Fly Me to the Moon,"Nat ""King"" Cole","Greatest Ever Jazz Masterpieces - The Very Best Classic Jazz Collection - Featuring Louis Armstrong, Frank Sinatra, Miles Davis, Ella Fitzgerald, Ray Charles & Many More",T3ctssca44rtvllio2uuowah7om
Footprints,Miles Davis,100 Cool Jazz Favorites,Toh55a3frhxumyb3f4lrqkewgq4
Four,Miles Davis,Absolute Miles Davis,Txi4dghgiuwdkjtfi3zkagfs3wi
Have You Met Miss Jones?,Chet Baker,Prestige Profiles: Miles Davis,Tqijdwyld4j5h7e77k6ea3md2xu
How High the Moon,Miles Davis,Platinum Classics,T3gs6wd4jb72m6mnvtizotthesm
I Loves You Porgy,Miles Davis,"Notations, Vol. 2",Thh7jacnfzljdfvei3u53bgvg54
Embraceable You,Miles Davis,I'll Remember April (Marvelous),Tpk7bqqz5pxsr6zvi22gboc5d3y
Walkin' (feat. The New Miles Davis Quintet),John Coltrane,I'm Old Fashioned,T5iwzkrzwkyozabvpmjjzilbbuu
If I Should Lose You,Chet Baker,Deux Légendes Du Jazz : Miles Davis & Chet Baker,Taxbemf57ppz5qozteiqws7bw54
If I Were A Bell,Miles Davis,If I Were A Bell,Tvwhaulyqubs7kyjbe5po2v33gi
In a Mellow Tone (Remastered Version),Billy Strayhorn,"50 Jazz Essentials, Vol.1 (The Finest Collection With Ella Fitzgerald, Miles Davis, Glenn Miller and Many More...)",Tqkbrl3xhewx234b2g2paywekfi
In A Sentimental Mood,Miles Davis,In A Sentimental Mood (14 versions performed by:),Twbplxfcjunyasn7vnhuqw7qsxm
It Could Happen to You,Miles Davis,"Miles Davis, It Could Happen to You",T6k26hf62vqgaxwgzjflp4gjbqu
"Just Friends (feat. Russ Freeman, Carson Smith, Bob Neel)",Chet Baker,Golden Trumpets (Miles Davis vs Chet Baker),Tkgd75x7etg5yi7goh2hhgsmw44
In a Mist (feat. Bix Beiderbecke),Miles Davis,Wild Man Blues,Tavzg3itwcbayybbvdyokwmpnle
My Funny Valentine,Miles Davis,My Funny Valentine,Tkxvj57d4har22paucftsak57yy
Night And Day,Miles Davis,Charlie Parker & Miles Davis,Te2lf27ohzhcjycf5mi2xwbsnj4
Oleo,Miles Davis,2 On 1 - Miles Ahead/Bags' Groove,T2o2375evlpkmkhzzurb35b2zvu
On Green Dolphin Street,Miles Davis,"Jazz Milestones: Miles Davis, Vol. 25",Tlud7zrxvlymydacv46nw6foie4
Four,Kari Gaffney,Satin Doll,Tapcmcsoys2j6godgesbazentie
Stella By Starlight,Miles Davis,Jazz Track,Tab3lmelgclechmz5kaxzxmpnge
Scrapple From The Apple,Miles Davis,Absolute Miles Davis,Tld2csczs5if4oap7e7qvfskzri
So What,Miles Davis,Kind Of Blue,T3izkaukeiwhsxjh7bamh7hkuna
Solar,Miles Davis,All My Succes,T7uq6pvztz4fnakm5scvo7k5vqq
St. Thomas,Sonny Rollins Quartet,"Greatest Ever Jazz Masterpieces - The Very Best Classic Jazz Collection - Featuring Louis Armstrong, Frank Sinatra, Miles Davis, Ella Fitzgerald, Ray Charles & Many More",Tjljtel2xkcjqrh6sjcxei3urnq
"Sweet Georgia Brown / Streets of Paris, Los Angeles",Miles Davis,Early Miles Vol. 1,Tztpljj5j5jngi45iw332ktdhdm
"Take the ""A"" Train",Duke Ellington,"Jazz Master, Duke Ellington (feat. Ella Fitzgerald)",T7he7gmd7u7nybiofdzdm6bmnh4
There Is No Greater Love,Miles Davis,There Is No Greater Love,Trmeckjb65f2hmvck3ssx24xyp4
There Will Never Be Another You,Sonny Davis,Two Artists For One Price - Miles Davis & Sonny Davis,T42e4j6evufm3wqlyi2ar7dygbi
What Is This Thing Called Love,Miles Davis,Absolute Miles Davis,Tgwbduvnps4s4vn5c5gfdydvryq
Yesterdays,Miles Davis,Absolute Miles Davis,Te32b477rinc2w2uut3g6ofjvwe
All of Me,Charlie Parker,All Time Jazz Legends,Tr63e5jdisfuuthsmvilalybq5q
All the Things You Are,Charlie Parker,All the Things You Are,Tkfekcpbl6oplatb45pryknip3a
Alone Together (feat. J.Coltrane & Ch.Parker),Miles Davis,Jazz Masters Deluxe Collections: Miles Davis,Tgqzivsp5eh3xuodf5whkezn7jy
Ornithology,Charlie Parker,Autumn Leaves,Ttfst3kvsexxcxtzslcoytf2rsa
Billies Bounce,Charlie Parker,"Popular Music From The War Years, Vol. 5",Tthavzttshcydmzdzftithr4fry
"Morning of the Carnival (From ""Black Orpheus"")",Dizzy Gillespie,"Jazz Cats, Vol. 9 - Dizzy Gillespie, Cab Calloway and Charlie Parker",Tmbchfr52wyi644nxcj5ujlwoqe
Confirmation,Gene Ammons,Blue Gene / Boss Tenor / Bad! Bossa Nova,Tkvlbfq4cgrpdi6h2blgg5nbdvq
Body and Soul,Charlie Parker,Strike up the Band,Ttpflxmfggvs6gwlt7juweythb4
All of Me,Charlie Parker,No. 1 Classic Jazz & Swing Album,Tnvosm64rdw3huifbhov3l5ubw4
Embraceable You,Miles Davis,Bye Bye Blackbird,Tcqqmpvwenegv23md5djmi5mhaq
Cherokee,Charlie Parker,The Birth Of Modern Jazz,T266d2wbqtfxhdehfokfig4e3iy
Confirmation,Charlie Parker,75 Beautiful Charlie Parker's Masterpieces (Original Recordings Digitally Remastered),Tfqmtkdggncuygxzozfuzdjosc4
Visa (Alternate Take),Charlie Parker,"Unheard Bird, the Unissued Takes (Hd Remastered Edition, Doxy Collection)",Tftvyoy4cmce5dzznjtm72zceoe
Au Privave,Jessica Galliker & Claude Diallo,Fly Me to the Moon,Tr4jzhiww534ii6ls76ttibnbnm
Anthropology,The Sunset Boulevard Jazz Trio,Footprints,Ty6yjrbtodwkq5r42ytsnnova2i
Barbados (Take 4),Charlie Parker,"The Complete Savoy And Dial Studio Recordings 1944-1948, Vol. 7 (Hd Remastered Edition)",Tkzxzm7kaeb54n5fbsl5af5hxqm
Yardbird Suite (Remastered),Tal Farlow,Have You Met Miss Jones,T24qhxbjul4e3ykv4sks2ybv6z4
How High The Moon,Charlie Parker,Parker's Mood,Tekoei35zau7oscitxxokxlbgky
Why Do I Love You?,Charlie Parker Quartet,Blue Bird,Tjufdehbybmmttd55bofqjmmgzu
I Remember You,Charlie Parker,A Night In Tunisia With Charlie Parker,Tuf2dbgti4zwn6tdkkwh7mcuwoi
I'll Remember April,Charlie Parker,Parker's Mood,Tl4frk5emserlhpz2efhiszxfjm
In a Mellow Tone,"Ella Fitzgerals, Ben Webster, Oscar Peterson, Herb Ellis","The Wonderful Jazz Music of Ella Fitzgerald, Charlie Parker, Fats Waller, Lennie Niehaus and Other Hits, Vol. 3 (140 Songs)",Tn6mcpuyg6tbrogr5wmhptqwxga
In a Sentimental Mood,"Ella Fitzgerald, Barney Kessel","The Wonderful Jazz Music of Ella Fitzgerald, Charlie Parker, Fats Waller, Lennie Niehaus and Other Hits, Vol. 3 (140 Songs)",Tyrg3zso6tcooc26ipmj2qmooui
Just Friends,Charlie Parker Quartet,Blue Bird,T5u2hlg5f7oq5wn6gqmnz7ay2xa
Misty,Parker Charles Octet,Soft Jazz Afternoon Playlist-Vol.2,Tejiza2f7hfg4wedla7deliepmy
My Funny Valentine,Charlie Parker,Charlie Parker,Top2fhlkroyxfd6rh6lceyyshui
Night and Day,Charlie Parker,All That Jazz (The Complete Jazz Collection - 245 Jazz Standards),Tjjegjqqlowdxgfqw7yetnm6r7a
Green Dolphin Street,Chad Lefkowitz-Brown,Standard Sessions,Tjo5xajsbragupqydcmzyx6yo6q
Satin Doll,"Ella Fitzgerald, Stuff Smith, Ben Webster, Paul Smith","The Wonderful Jazz Music of Ella Fitzgerald, Charlie Parker, Fats Waller, Lennie Niehaus and Other Hits, Vol. 3 (140 Songs)",Tpjuf7coic5wu34igel47jkb5be
Stella By Starlight,Charlie Parker,21th Century Blues (Asia Edition),T6ujfgkdjh6pl5qbxsn6lsslhs4
Scrapple From The Apple,Charlie Parker,"Parker's Mood, Vol. 2",Ty23z5rgabc2yw6m6r4aegfecwa
So What,Miles Davis & Charlie Parker,Jazz Selection / The Best,Tsgpazlm3f2slc3dck7nc6w6yby
East Of The Sun (West Of The Moon),Charlie Parker,Yardbird,T4cle3u5y36wh5phfdywczoo7tu
Billie's Bounce,Tomas Janzon,Experiences,T4uq5ih6347afaholvrqzdubynq
Sweet Georgia Brown,Charlie Parker,"Charlie Parker Selected Favorites, Vol. 14",Tmbf52yp5tcpbsizxi5hzxb5ode
"Take the ""a"" Train",Duke Ellington Orchestra,"The Greatest Hits of Glenn Miller,Miles Davis,Charlie Parker and Other Famous Artists, Vol. 2 (130 Songs)",Tackndjphm7x53pdvnotun42uzu
The Girl from Ipanema,Parker Charles Octet,Soft Jazz Afternoon Playlist-Vol.1,Tljbkt3kvjn2h2pw26f76pss7pe
There Is No Greater Love,Johnny Moore's Three Blazers,"The Jazz Masters Collection: Charlie Parker, Vol. 11",Tvrli4jnskhf2bhrqt3upl3moau
There'll Never Be Another You,Oscar Moore,"Charlie Parker Records: The Complete Collection, Vol. 12",Tdyo6fjq2vm3mvyhh6pfotfvrsy
What Is This Thing Called Love,Charlie Parker,The Complete Charlie,T6cplxqpz6jhh3hyuu6oqexcofm
A Place That We Call Yesterday,Charles Parker,Bring Back the Sun,Topyacxdgcdevb3svjqy3xyhsve
Come Out and Meet me Tonight,Art Blakey,I Could Have Danced All Night,Tdiuvutibmtuj3omrayxk5v3way
All The Things You Are,Art Blakey,Monks Mood,Tvr4e4izt3zi5tcattrnrphwfuu
Alone Together,Art Blakey,Alone Together,Tyemcwfwzcrry545q75qonjikby
Autumn Leaves,Art Blakey,All the Best,Titzh6uhjjbayui6vx4rtpgbur4
Billie's Bounce (Remastered),Clifford Jordan,Art Blakey: Master of the Big Beat,T5gkqe3n2lx223qh4kf35s4vtcq
Afrodisia,"Kenny Dorham, Art Blakey",Blue Bossa (Hd Remastered Edition),Tnfedqnhxoodoa4efqg7wsqdtoa
Body and Soul,Art Blakey,Simplicity,Tlen6h3jtwhcsgb6kbtomagwwlu
But Not for Me (feat. The Modern Jazz Quartet),Art Blakey,"Jazz Milestones: Art Blakey, Vol. 14",Tz3y5af5vymzq6dvo77sae6auxm
Moanin',Art Blakey,BD Music Presents Bye Bye Blackbird,Tostbimcom242hjkvwegkrfgqzy
Cherokee (feat. Art Blakey),Clifford Brown Sextet,Cherokee (19 Versions Performed By:),Tdndvbkwsbjlmpgfoiy3v6vfqv4
Confirmation,Art Blakey,100 Jazz Legend Faveorites,Tdto4wqliakhpyqoir7rf7s7hw4
Dinga,Art Blakey,The Story of Jazz (Doxy Collection),Tmyr7jjaddkhoho5tixkvd4fpd4
Afrique,Art Blakey,"Art Blakey's Jazz Message, Vol. 4",T3a2z6odlpziju7vcqjnlqrvige
How High the Moon,Jimmy Smith,A Date with Jimmy Smith,Tzahk5tgldugs4dinwnr37hoomu
I Hear a Rhapsody,Art Blakey,"Art Blakey's Jazz Message, Vol. 1",T4yitqs6q3ci6ilvwzw3mnjjobq
The Things I Love,Art Blakey,Meet You,Tufqlfsoz3dprrix3jfivzhvhiq
I Remember You (feat. Art Blakey),Horace Silver,Complete Sessions with Art Blakey (Bonus Track Version),Tobw3pqfjm2hwwm44xqyse2kt74
I'll Remember April (From 'Ride' Em Cowboy'),Horace Silver,"Highway Jazz - Horace Silver, Vol. 1",T6qazuar7soebxo4d45oevr6mee
If I Should Lose You,"Hank Mobley, Art Blakey, Wynton Kelly, Paul Chambers",Jazz in the Sixities - 50 Unforgettable Tracks,Tyen2vuslxirlcs3nbhzib7xm3q
Doodlin' (Remastered),Art Blakey & The Jazz Messengers,Tenderly (A Journey into Sentimental Mood),Tysviqoveyhsvv5i353j333msj4
It Could Happen to You (feat. Kenny Drew & Art Blakey),Buddy De Franco,"The Complete ""Mr. Clarinet"" Sessions (feat. Kenny Drew & Art Blakey)",Ttcfg6tz4tmdct2kqn7oy42hwlu
Just One Of Those Things,Silver,Horace Silver & Friends Vol 1,Tyu5hrlw6lp3nahpmt3bfsjlqh4
Twilight Mist (2005 Digital Remaster),Lee Morgan,Jazz Chill,Tekaymkmcfgzvhbfzv4rzmqa5ka
My Funny Valentine,Art Blakey,20th Century Box - Jazz,Trxozjvmppbf2chavaauuxbzhai
A Night in Tunisia,Art Blakey,100 Jazz Songs for a Summers Day,T3ugha3mq5mzpoacqnxsfnveiz4
Stella By Starlight,Art Blakey,Hard Bop / Jazz Messengers With Thelonious Monk / Caravan,Tbm6pw2b6tayzkkfawp2ribzspu
Yama,Art Blakey,So Tired,Tkijpq4jbgpshv5pncc7hrecwma
Sun Dance (feat. The Modern Jazz Quartet & Jimmy Giuffre),Art Blakey,"The Jazz Masters Series: Art Blakey, Vol. 16",Thtvssn7ejeln2asf65oo2zxpqy
Shadrack,Sonny Rollins,St Thomas - The Best of Sonny Rollins,T6m36hjojwzl4t5w2az5lzvdldm
Up Jumped Spring,Art Blakey,The Jazz Collection Volume Two,T4eqmpwnlhubu55k2wshp6wo22e
What Is This Thing Called Love,Art Blakey,Invitation: The Best of Art Blakey,Tq2mkftghoxxyq2iqtvemmthv3q
Yesterdays,Art Blakey,Yesterdays,Ttrnzvka56rkhjulvtgy2icqbiu
Love Me,Art Tatum,All God's Chillun,T7gljtklyz6nxm2hwivp6yfqeg4
All the Things You Are,Art Tatum,Jazz Ballads - 18,Tm3btbmapjwmc23ra4xmg3bjxra
Chloe,Art Tatum,Autumn Leaves: Romantic Jazz Classics,Tige6fuodrn7ewrxsu5dli6lmxa
Esquire Bounce,Billie Holiday,"The First Esquire Concert, Vol. 2",Tdfxixpxqxypptk764iyaiohnlm
Body and Soul,Art Tatum,Jazz Ballads - 18,T3bjqcwuyuemozal3n6ajc3hkx4
Willow Weep for Me,Art Tatum,"Jazz Classics Series: The Genius of Art Tatum, No. 8",Tb5h3j5ocdfzy6utxbct4iuuk4y
Cherokee,Art Tatum,Art Tatum Diamond,Tink7jil4uphp6li7xsd7ygcqci
Boogie,Art Tatum,"Art Tatum, The Comet And Asch Recordings 1944 (Hd Remastered Edition, Doxy Collection)",Ttsih7yaq24g5tiqxlsgtbhnfbi
Body And Soul,Art Tatum,HIP JAZZ BOP -Footprints In The Sand: Jazz Essentials By Jazz Greats,Tl3amedsmcdekv2lbshe57yleja
Cherokee,Art Tatum,Modern Jazz Piano Four Views,Tgfszvjjwwtokafdm4smodezaeu
Have you met Miss Jones,Art Tatum,Art Tatum Virtuoso Vol. IV,Tfu6sckfply4x2ydc5fkqfgtszq
How High The Moon,Art Tatum,The Jazz Collection Vol. 2,Tcm3edtel3dzij457imjckbnjuy
The Man I Love,Art Tatum,You're Driving Me Crazy,T5hirldc7smutmfqhz3tcnhfumq
I'll Remember April,Bud Powell,"Giants Of Jazz - Brilliance Of Piano, Vol.2 (From Art Tatum To Modern Jazz)",Tnfnwk5phch6iur4aslh4yor4hi
If I Should Loose You,Art Tatum,The Complete Jazz Chronicle Solo Session,Tc62jzsvbupcmamvjdqij32qblm
In a Sentimental Mood,Art Tatum,Jazz Ballads - 18,Tmayvmj4wkzg7fjwyemvyvywxh4
Nice Work If You Can Get It,Art Tatum,"As It Happened: Recordings from 1932-1953, Vol. 12",Tmbcxllgemchlq7v7hm64o7izba
Can't We Be Friends,Art Tatum,"Just Art Tatum, Vol. 2",Tl222d5rxc32nu6a5swvbvhwgru
Misty Mornin',Duke Ellington,"The Greatest Hits of Art Tatum, Ella Fitzgerald, Louis Armstrong and Other Famous Artists, Vol. 5 (150 Songs)",Takpcawvhpg63b5nnhddktnx7ge
My Funny Valentine,Art Tatum,Ben Webster & Art Tatum Quartet,Tg6zk5wyoswnqejpbfksnfq5j7a
Night and Day,Art Tatum,Night and Day,Taxp2h5xh6d7eprwl6gtidvhxf4
Stella By Starlight,Charlie Parker,Jazz Round Midnight,T6tmgldz3ukgzohyawr5bexrcaa
Anything But Love,Art Tatum,Solo Masterpieces,Tjdp5duyddtfmi4d7iqk7x5mezu
Body And Soul,Art Tatum & His Swingsters,Jazz in the Charts Vol. 32 - Where Is the Sun?,Tasypjokk2kd6rhh7h4fl7vestu
IV. Like Bartok crossed with Art Tatum,Nathaniel Bartlett,"Schindler, A.: Precipice / Thomas, A.R.: Silhouettes / Reich, S.: Vermont Counterpoint / Glass, P.: Opening",Tuxxrrjhjikhui4etc6pumj3bya
Sweet Georgia Brown,Art Tatum,God Is in the House (Original 1940-41 Recordings),Tdh67h626xrmbunudrge3s32a5i
Tiger Rag,Art Tatum,Take The 'A' Train - The Big Band Album,Tmfl4z5aof6j4lliiu3c6sl2ubi
There Will Never Be Another You,Art Tatum,This Is...Art Tatum,Tmoery5ksxxdtdeki5doyxlmd2a
What Is This Thing Called Love,Art Tatum,"Tickle the Ivories: Classic Jazz Piano, Vol. 13",Tf7g6p3rtpido3rowm7zi6j5g3u
Yesterdays,Art Tatum,Art Tatum's Wrap Your Troubles In Dreams,Tx3t3ywmc3brggcfun2byr6wwpq
All the Things You Are,Wes Montgomery,Love Me : 30 Songs for Your Moments In Love,Ti34pvbiahc24vdncja3emv6ahu
All The Things You Are,Wes Montgomery,All the Best,Tfcqbsdrjgfw43b5e6vy4ky7zem
Alone Together,Wes Montgomery,Wes Montgomery & The Billy Taylor Trio,Tte6le7iripc6yorppjegxjvmpy
Blue Monk,Wes Montgomery,"Wet Autumn Leaves, Vol.3",Teqbqugwsnrfiqgd72h2q336dwi
Billies Bounce,Wes Montgomery,The Jazz Collection,Tul4qje3nikykxjvd2756olmcsa
Body and Soul,Wes Montgomery,Body and Soul,Tsrnwkxhsrbn5qmulf2fjsszoby
Days of Wine and Roses,Wes Montgomery,Boss Guitar (Remastered),Tjozbqs4g6xg4kybdenmfoagt4y
