Round Midnight,Art Blakey,"Night in Tunisia, Vol. 2 (Live)",Tr7axq7blqvtdrumj47vr2y3cl4
When a Child Is Born,Boney M.,The Christmas Mix,Tj62uurdzr34y4orb3vinzlgemu
A Foggy Day,"Billie Holiday, Harry Edison, Ben Webster, Jimmy Rowles","The Best Music Collection of Art Blakey, Charles Mingus, Kid Ory and Other Famous Artists, Vol. 10 (150 Songs)",T3k2ylsbawdrx4wtr3xrhwcrqxe
Song For My Father,Horace Silver,Best Of Jazz Songs,Tvusi2gw66lz6idby5b4kg5ys6q
Blues,Art Blakey,All the Best,Tsovlv2andakngj6h6uj7wy3s2y
Come Out and Meet me Tonight,Art Blakey,I Could Have Danced All Night,Tdiuvutibmtuj3omrayxk5v3way
All The Things You Are,Art Blakey,Monks Mood,Tvr4e4izt3zi5tcattrnrphwfuu
Almost Like Being In Love,Art Blakey,Art Blakey 1957,Te75l2xuidnz36le3vbi46bpp7e
Autumn Leaves,Art Blakey,All the Best,Titzh6uhjjbayui6vx4rtpgbur4
Begin The Beguine,Artie Shaw,Forever Gold - The Very Best Of,Th6jnzhzxuf3grjgz3qye77qohy
Black Orpheus,Christoph Spendel,"The Piano Side of Brazil, Vol.1",Tiuf33rpxkkfwhaj5g65zl2ujdm
Bluesette (feat. Alessandro Schittone),Patrizia Capizzi,Unwind With Bossa Nova Music,Tix34ffxqi7nrwf7jvgta2fehlm
Body and Soul,Art Blakey,Simplicity,Tlen6h3jtwhcsgb6kbtomagwwlu
But Not for Me (feat. The Modern Jazz Quartet),Art Blakey,"Jazz Milestones: Art Blakey, Vol. 14",Tz3y5af5vymzq6dvo77sae6auxm
Moanin',Art Blakey,BD Music Presents Bye Bye Blackbird,Tostbimcom242hjkvwegkrfgqzy
C Jam Blues,Mary Lou Williams,1951-1953 (HD Remastered),Ttrhofetw7yb6es5wsl6xyh72au
Cantaloupe Island,Herbie Hancock,The Soul of Jazz,Tg7okuylsq4khluyaz7rjdhqr2i
Caravan,Art Blakey,Dazzle Jazzle: Jazz of the 1960's,Tyd2ebp2jq23i4hl4oq6fhogjcy
Cheek to Cheek,"Billie Holiday, Harry Edison, Ben Webster, Jimmy Rowles","The Best Music Collection of Art Blakey, Charles Mingus, Kid Ory and Other Famous Artists, Vol. 10 (150 Songs)",Tzrrlwxy7xd335efeznxkg63bhu
Cherokee (feat. Art Blakey),Clifford Brown Sextet,Cherokee (19 Versions Performed By:),Tdndvbkwsbjlmpgfoiy3v6vfqv4
Corner Pocket (aka Until I Met You),Duke Ellington,First Time! The Count Meets The Duke,Tirxjhfkpel6n5js6u5st3tcm2y
Dear Old Stockholm,Miles Davis,'Round About Midnight (Legacy Edition),Tsvmbybqlluq7m2zgt4g5vslbsi
Desafinado,Christoph Spendel,"The Piano Side of Brazil, Vol.1",Tqkz57tbkmrv3yqqz3sz5uwaii4
Don't Get Around Much Anymore (Remastered 2015),Johnny Griffin,The Best of Johnny Griffin (feat. John Coltrane / Paul Chambers / Art Blakey) [All Tracks Remastered],To65rjqy7xc5syrp3gkdbexoyei
The End of a Love Affair (Remastered),Art Blakey,Easy Jazz,Td77b7thf6rzc53mpvxxil6nrle
Everytime We Say Goodbye,Ella Fitzgerald,Jazz Journeys Presents High Speed Swing - Vol. 6 (100 Essential Tracks),T7imdt2hacpx4v7dpz2lxkzhlxu
Fly Me to the Moon,Stanislaw Soyka,Romantyczni panowie,Tzxgj75wk7zwvconje4mmy7owtq
"Garota de Ipanema (feat. Daniele Bragaglia, Fiammetta D'arienzo)",Moreno Romagnoli,Relaxing Evening Bossa Nova,Tracbokwqddbnaxquwliforlcfa
Honeysuckle Rose,Thelonious Monk,The Unique (Bonus Track Version) [Hd Remastered Edition],Tfqhngahlhsevateia2smilmhsu
How High the Moon,Jimmy Smith,A Date with Jimmy Smith,Tzahk5tgldugs4dinwnr37hoomu
I Got Rhythm,"Red Norvo, Roy Eldridge, Jack Teagarden, Barney Bigard, Art Tatum, Coleman Hawkins, Al Casey, Oscar Pettiford, Sidney Catlett","The Best Music Collection of Art Blakey, Charles Mingus, Kid Ory and Other Famous Artists, Vol. 10 (150 Songs)",Tiydcbiz2d244phfsmm6toc27ka
I Remember Clifford,Art Blakey,Zurich '58 - In Concert,Tfb5juo3rcri73rbvtn7av6ziwe
I'm Gonna Sit Right Down (And Write Myself A Letter),Ronnie Lane's Slim Chance,Ronnie Lane's Slim Chance,T2rkdjflte45xw2nlvyw2l37ac4
(I've Got You) Under My Skin,Bobby Caldwell,The Consummate Caldwell,Tuabaib23oqvripccc34depbxla
In a Mellow Tone,Oscar Peterson,"Oscar Peterson, Essential Tracks, Vol. 3",T6i2s7dq5zdn2ha4l4qcmri5vh4
In A Sentimental Mood (Live),Art Blakey,Keystone 3,Tfj3mfqq7lexza5x3rm7ggwvdhu
"Just You, Just Me",Thelonious Monk,The Unique (Bonus Track Version) [Hd Remastered Edition],Tjglolaarnctiapf52b67g7lthu
Love for Sale,Art Blakey's Jazz Messengers,Lounge Jazz Café - Tel Aviv,Tds6447dguoclgeol2ayfkblray
Confirmation - Lullaby of Birdland,Art Blakey,49 Essential Art Blakey Classics,Tcdfwh2dieb5em2f2muwkr5bo3e
Twilight Mist (2005 Digital Remaster),Lee Morgan,Jazz Chill,Tekaymkmcfgzvhbfzv4rzmqa5ka
Moaning,Art Blakey,Autumn Leaves,Tvwmxrpovugq3wyvdidnav7cfsq
Moonlight Serenade,Glenn Miller,"The Best Music Collection of Art Blakey, Charles Mingus, Kid Ory and Other Famous Artists, Vol. 10 (150 Songs)",Tebrrapmwqxqvjywxtd7pawgx5q
A Night in Tunisia,Art Blakey,100 Jazz Songs for a Summers Day,T3ugha3mq5mzpoacqnxsfnveiz4
On the Sunny Side of the Street (Live),Coleman Hawkins,Coleman Hawkins: 1929-1934 (Live),Tdclso3i6ksjyhdxu2rwbemfptq
Penthouse Serenade,Nat King Cole,The Complete Capitol Recordings Of The Nat King Cole Trio,T3hruvizovouwdhbtmhi6sswehe
Poinciana,Luiz Bonfá,100 Grandes Sucessos,T3js3mbhhxrdzeil5f6ffv7mkm4
Ruby My Dear,Art Blakey,The Thelonious Monk Sessions,Tdy5xvh7xbkvyfswthnzdt2d5km
Samba De Orpheu,Art Blakey
Satin Doll,Duke Ellington,Take the A Train,Tgpbssgwipwpniwygde6tbcv54y
Sophisticated Lady,"Billie Holiday, Harry Edison, Ben Webster, Jimmy Rowles","The Best Music Collection of Art Blakey, Charles Mingus, Kid Ory and Other Famous Artists, Vol. 10 (150 Songs)",Tvd43qgg63jbvm733kqyiquedcy
Stardust,Art Blakey,Out of Nowhere Vol.1,T67xss5ixmrqjrp7jgv5eauug7y
Stella By Starlight,Art Blakey,Hard Bop / Jazz Messengers With Thelonious Monk / Caravan,Tbm6pw2b6tayzkkfawp2ribzspu
Sugar,Benny Goodman,"The Best Music Collection of Art Blakey, Charles Mingus, Kid Ory and Other Famous Artists, Vol. 10 (150 Songs)",Tydzimm7ywkwvroz2fxkmwzf53a
Summertime,Art Blakey,Art Blakey: A Jazz Message,Tw5ouowgx75elqip7hsu7u32i24
Alone Together (Remastered),Art Blakey,Take Five (100 Memorable Jazz Performances),Tjsslryahntzfqiu3cpemsp3rnq
Take The 'A' Train,Duke Ellington,Forever Gold -75 All Time Greats,Txuswwkes7p2v2ucsxi6s3kdowq
Tea For Two,Thelonious Monk,The Unique (Bonus Track Version) [Hd Remastered Edition],T3htweewydhmstbyh2m63mfljai
Tenderly,Bud Powell,Bud Powell '57,Tbzq7hvh42eyib6khotsr2jzi3a
The Girl from Ipanema,King Curtis,Latin Hits,Tm3kurhz27xwmyjpnrktufib5yy
There Will Never Be Another You (Live),Chet Baker,I Can't Get Started: Live in Palermo 1976,Tbmjwkfvv2jcqp73rowagvboyqq
These Foolish Things,Art Blakey,Out of Nowhere Vol.1,Tdqcuo5latsxp7cygvv2q7mywga
They Can't Take That Away from Me,"Billie Holiday, Harry Edison, Ben Webster, Jimmy Rowles","The Best Music Collection of Art Blakey, Charles Mingus, Kid Ory and Other Famous Artists, Vol. 10 (150 Songs)",Ttatmhgzz4mbftz7on7hyoh6g7a
Three Little Words,Fred Astaire,"The Golden Age of Hollywood Musicals -, Vol. 9",Ttv4kqoyszrteopmjji56xs5f5q
Watermelon Man,Herbie Hancock,Takin' Off (Rudy Van Gelder Edition),Tlc26vkm3cht2vlcquagyrukc5q
"Suspense, Tom Et Nasol (From ""Des Femmes Disparaissent"")",Art Blakey,French New Wave 1957~1963,Tsrzdgzqxgcxl5ejwspw6w6tsru
West Coast Blues,Wes Montgomery,Riverside Profiles: Wes Montgomery,Ttp6667w5yeb5lvlrnat6o4tblq
What Is This Thing Called Love,Art Blakey,Invitation: The Best of Art Blakey,Tq2mkftghoxxyq2iqtvemmthv3q
You're Driving Me Crazy,Don Redman,McKinney's Cotton Pickers 1930-1931 Don Redman and His Orchestra 1939-1940 (HD Remastered),Tvuxzsk434gogactq6pq3vcmoi4
Round Midnight,Art Pepper,Twelve Classic Albums: 1954-1962,Tcdknhx6wnhonwuh6co3m6rblwy
A Foggy Day,Art Pepper,Twelve Classic Albums: 1954-1962,Tuozcu2mh4sehez5jacathuxtua
Blues Out,Art Pepper,All My Success,Tgyu32zebrwrafpvvw2a57piesq
All of Me,Art Pepper,Surfride Plus,Tgv5pf2sxejbkps6nnd5zpclxk4
All The Things You Are,Art Pepper,The Essential Collection,Ttdhvzawkwhmeyifcoducj6ho5i
Almost Like Being In Love,Nat King Cole,A Fine Romance,Tafzpl5kuanrqjnqrkiuol45wh4
Autumn Leaves,Art Pepper,Mambo Jumbo,Tx67ozdm5wa5oce5rrpfjkpbuzy
Begin The Beguine,Art Pepper,The Essential Collection,Tn5bqdtjlneixoz5nbdq2gp3dge
Body And Soul,Art Pepper,The Essential Collection,Tjjdttrwghcy5bnww7s3wvqlmam
But Not for Me,Chet Baker,Sings & Plays,Trxovords7fx2kftyvoosvlnrna
'Round Midnight,Art Pepper,BD Music Presents Bye Bye Blackbird,Twe72hoifgifzz7ysc5hfz5isnu
Caravan,Art Pepper,Live in Japan,Tim3yb7mldsfl4zqddhmrtrzz4u
"Cheek to Cheek (feat. Mal Waldron, Pepper Adams, Art Taylor, Idrees Sulieman, Jerome Richardson, John Coltrane, Paul Quinichette, Doug Watkins, George Joyner & Ray Barretto)",Gene Ammons,Gene Ammons' All Stars. Complete Recordings,Tcyvr36rsoi7kjr372gz37fygfq
Cherokee (Live),Art Pepper,Live in the USA,Tj5zy37cycfbek5smes522d7hf4
Don't Get Around Much Anymore,Louis Armstrong,"The Great Summit, The Master Takes (HD Remastered)",Tgc7xecstnbzzisw6w7kqu7mfxa
Easy to Love,Helyne Stewart,Love Moods,Tywmgihd375h4mw3oz3k5jzcjee
In Other Words (Fly Me to the Moon) [feat. Ralph Sharon Group],Chris Connors,"The Wonderful Jazz Music of Art Pepper, Chris Connors, John Kirby, Marty Paich and Other Hits, Vol. 2 (155 Songs)",T7kn2p2yutzri477n2yorsqq3ve
Honeysuckle Rose,Fats Waller,Forever Gold -75 All Time Greats,Tjxdm2bishs23dnzsxesbpne6c4
How High the Moon,Art Pepper,Those Kenton Days,Tgt5ihoicg26xxtjjaipctg5gnu
Rhythm-A-Ning,Art Pepper,Getting' Together !,Tvdrnpqucabcocqluyscjhb5qaq
I Remember Clifford,Lee Morgan,Lee Morgan Vol 3,Tebd4e6hkpovpezrfitdnlnn5am
In a Sentimental Mood,Café Lounge,"Jazz Music for a Break: Swing Tracks for a Moment of Rest from Work, Study or Daily Home Duties",Tpsmu3dex3yw2fivsc67beqlqza
"Just You, Just Me",Nat King Cole Trio,The Nat King Cole Trio - The Complete Capitol Transcription Sessions,T6bbztrnscer3dffuoogoy4qa2m
Love for Sale (feat. Art Pepper),Marty Paich,Love for Sale (15 Versions Performed By:),Tk7sqf55km2ymsytumvukuaigva
Lullaby of Birdland,"Chris Connors, Ellis Larkins","The Wonderful Jazz Music of Art Pepper, Chris Connors, John Kirby, Marty Paich and Other Hits, Vol. 2 (155 Songs)",Tx34itvy336g3tuvhnv65qzvmbm
"In a Mist (feat. Art Farmer, Bob Brookmeyer, Al Cohn & Pepper Adams)",Manny Albam,Manny Albam and His Jazz Greats: Jazz New York (Bonus Track Version),Ti53glgzvu7srghmzflipkibirm
Moanin',Art Pepper,Bebop Café,Tdyqqs3fklcaitfjrpwo3sy73u4
Moonlight Serenade,Glenn Miller,"Lindas Melodías, Vol. 12",T2zkvq7mczo2jses22vworkvjum
Night and Day (Remastered),Art Pepper,The Continental,T2mtyowayz3zale7ykca6grzpty
Ruby My Dear,Thelonious Monk & John Coltrane,Live At The Five Spot Café '58,T5gu6geqpbw3l4upzb3pflzas2e
Samba De Orpheu,Art Pepper 
Sophisticated Lady,Duke Ellington,Forever Gold - The Very Best Of,Tyl4wpgegatea5klojg2gb2qf7i
Stardust (Live) (feat. Jason Marsalis),Lionel Hampton Big Band,Live at Rossmoor,T757lmbxsilconf62ka5bfhouii
Stella By Starlight,Chet Baker,Chet Baker - Volume 7,Tzjlrorocs5oz5suvkqe55t4fvm
Sugar Blues,"Barney Kessel, Art Pepper & Shelly Manne",Some Like It Hot,T7rngtmc5cmv3mipsdalbahd3xa
Summertime,Art Pepper,The Essential Collection,Tgugyah2nccjimgmddbkhp7gi4u
Chili Pepper (Take 5),Art Pepper,Discoveries,Texstxhamuqgytaaovblplu6abm
"Take The ""A"" Train","Maynard Ferguson, Art Pepper, Bud Shank, Jimmy Giuffre & Shorty Rogers",100 Jazz Classics,Tziz6in5jyc3imirzfsl5kmjyey
Tea for Two,Mary Lou Williams,The Chronological Mary Lou Williams (1927-1940) (HD Remastered),Thoilemyhoo2jx2h4j4dqapmhhi
Tenderly,Chet Baker & Art Pepper,Complete Recordings,Tc5xkhg4z6hxnpikkkqu6sxjlou
There Will Never Be Another You,Tal Farlow,"The Wonderful Jazz Music of Art Pepper, Chris Connors, John Kirby, Marty Paich and Other Hits, Vol. 2 (155 Songs)",Tzgnlfgdsapqxy7ygfeg5hlipam
These Foolish Things (Remind Me of You),Art Pepper,All The Things You Are: A Jazz Bop Compendium,Tzgwvswgq2ro2fu6jf3nbevs4m4
They Can't Take That Away from Me,Hal McKusick,Confirmation,T3fsgqr3op2tdposdow7zdspala
Waves,The Vamps,Missing You - EP,Tiyzmjnqqgbt2bxe2rswrshn4we
Blues In,Art Pepper,West Coast Cool Jazz,Trxlodwhwcvkqhgvtrlqqzk5ra4
What Is This Thing Called Love,Art Pepper,Complete Tv Studio Recordings,T4v75526nea7g7elvpzwwhkp7da
You're Driving Me Crazy,Art Pepper,"Art Pepper: Jazz Explosion, Vol. 2",T5d5morglldovmxjzkd226i23iu
Round Midnight,Thelonious Monk,"Giants Of Jazz - Brilliance Of Piano, Vol.2 (From Art Tatum To Modern Jazz)",Twt4nilawwia2rfnizzp3lmtepe
A Foggy Day,Art Tatum,Keep Calm & Jazz On,Tl6holrjb2dgdoa265olgusvy4e
Limehouse Blues,Art Tatum,All That Jazz,Tkur72lacw5n4kdtywb2zucloo4
Love Me,Art Tatum,All God's Chillun,T7gljtklyz6nxm2hwivp6yfqeg4
All the Things You Are,Art Tatum,Jazz Ballads - 18,Tm3btbmapjwmc23ra4xmg3bjxra
Chloe,Art Tatum,Autumn Leaves: Romantic Jazz Classics,Tige6fuodrn7ewrxsu5dli6lmxa
Begin the Beguine,Art Tatum,The Genius of Art Tatum,Tb5sqnwxdcaq7czi3mppyqzab6y
Body and Soul,Art Tatum,Jazz Ballads - 18,T3bjqcwuyuemozal3n6ajc3hkx4
Willow Weep for Me,Art Tatum,"Jazz Classics Series: The Genius of Art Tatum, No. 8",Tb5h3j5ocdfzy6utxbct4iuuk4y
"Bye, Bye Blackbird",Frank Sinatra,"Deluxe: Anthology, Vol. 5 - The Rat Pack",Ti3eq5lrkspopcf2xj4aiaxsa6q
Caravan,Art Tatum,Live Performances 1934-1956 Vol.7,Td6wxy3ivgqwlkqzecjfw2f5w6a
Cheek to Cheek,Putney Dandridge,1935-1936 (HD Remastered),Tmnru37qkrrpywzmn5kbsliv7um
Cherokee,Art Tatum,Coffee House Jazz,Tdgxklipoife2i2dawzn3q6omje
Don't Get Around Much Anymore,Christina Quilico,Ings,Trzu5uvwi3bhozl5yblixlfthi4
What Is This Thing Called Love? (Live) [Remastered],Art Tatum,Easy Jazz,Tud5rssny5kha4x5xx47axbgq3a
Honeysuckle Rose,Art Tatum,Moonglow,T2rldp5sfgzfs6ombrfcviqk4be
How High The Moon,Art Tatum,The Jazz Collection Vol. 2,Tcm3edtel3dzij457imjckbnjuy
I Got Rhythm,Art Tatum,Jazz Journeys Presents High Speed Swing - Art Tatum,T365bzuqgd2kb7jfvgwf56dosxi
I'm Gonna Sit Right Down and Write Myself a Letter,Art Tatum,Gene Norman Presents: Art Tatum at the Piano,Tjtyfszzoom46ulp5bnpxjevnsm
In a Sentimental Mood,Art Tatum,Jazz Ballads - 18,Tmayvmj4wkzg7fjwyemvyvywxh4
You Gave Me Everything But Love,Art Tatum,"Just Art Tatum, Vol. 7",Thhvnxd36hkcqibhcujyndwfx2e
Love for Sale,Art Tatum,Jazz Ballads - 18,Tgqv3zxmz32crvtk3xvnrktzt4e
Lullaby of Birdland,George Shearing,"Giants Of Jazz - Brilliance Of Piano, Vol.2 (From Art Tatum To Modern Jazz)",Tkcg2ml7fnqxmjp3le635k45qzi
Misty Mornin',Duke Ellington,"The Greatest Hits of Art Tatum, Ella Fitzgerald, Louis Armstrong and Other Famous Artists, Vol. 5 (150 Songs)",Takpcawvhpg63b5nnhddktnx7ge
Moanin' (3),Mills Blue Rhythm Band,1931 (HD Remastered),Tkiomkdstqixd64ocrfrvxa3yai
Tea For Two,Art Tatum  Solo Piano,Jazz in the Charts Vol. 50 - Moonlight Serenade,Tju6chdipjaijzwmvtuk2yh7dgy
Night and Day,Art Tatum,The Song Is You,Tghzir2xtgccklpwlkyap4ilify
Sunny Side Of The Street,Art Tatum,The Art Tatum Legacy,T7tg45mv3tynd27dwqkbzadwfbe
Penthouse Serenade,Erroll Garner Trio,"Giants Of Jazz - Brilliance Of Piano, Vol.2 (From Art Tatum To Modern Jazz)",T5tslqkxzyqj4iablr2eb3dzhjq
Ruby My Dear,Thelonious Monk,"Giants Of Jazz - Brilliance Of Piano, Vol.2 (From Art Tatum To Modern Jazz)",Tucwqjhhhd5v7l2axuq2625l7mu
Samba De Orpheu,Art Tatum
Sophisticated Lady,Art Tatum,The Genius of Art Tatum,T2j2cs7eglryoekiasbwpnfebaa
Stardust,Art Tatum,Jazz Ballads - 18,T4h2xzqy37bt42xd7ur4shqh4tu
Stella By Starlight,Luiz Bonfá,100 Grandes Sucessos,Tjjqxxfqsjunb5r37zphxjczhoa
Sugar Foot Stomp,Art Tatum,Art Tatum 1945,Tk7cnceszhbnod5crza547uvnee
"The Man I Love, Summertime",Art Tatum,95 Hits : Art Tatum,Tfvgmjlnm5tbzkbwuix7esud77u
Come Rain or Come Shine (Take 2),Art Tatum,Live Performances 1934-1956 Vol.5,T4ch52rdcet73bdp7atpfcxfpxe
Tiger Rag,Art Tatum,Take The 'A' Train - The Big Band Album,Tmfl4z5aof6j4lliiu3c6sl2ubi
Tea for Two,Art Tatum,111 Swing Classic Masterpieces (Jazz Masters),Tcz5ytmkz3zgl7z2yurlscjbfba
Tenderly,Art Tatum,Jazz Ballads - 18,Th7ib7ymfsiukfr6ffkymlkomiy
There Will Never Be Another You,Art Tatum,This Is...Art Tatum,Tmoery5ksxxdtdeki5doyxlmd2a
These Foolish Things (Remind Me Of You),Art Tatum,The Best Of Art Tatum Vol 8 (Remastered),Txulq4cvi6ow667r3qi6jirv2gq
They Can't Take That Away from Me,Art Tatum,Jazz Ballads - 18,Tts5mrkk7pk3r5gwvd6acsesply
Three Little Words,Art Tatum,Night and Day,Thnpc2hr7vtvkjgwpaplwi3u2ii
Heat Wave,Art Tatum,Solo Masterpieces,Tcckib2lusyqnmhmbxbqwvp3zoq
What Is This Thing Called Love (Previously Unissued - Alternate Take),Art Tatum,Complete Masterpieces Part 1,Tewl6nqbtxrlpskhprm3aneko2a
You're Driving Me Crazy,Art Tatum,You're Driving Me Crazy,Tt4alyijgcl7k5vk6xwv4hrhcba
Round' Midnight,Jazzistic,Spring Time Chill Out,T3kzba4kj2pvc22wvgbdgjyth5i
A Foggy Day,Art Van Damme Quintet,Cocktail Capers,Tdsen37jpvzmpedbi5xvmydm3hm
All Blues (Studio Sequence),Miles Davis,Kind Of Blue (Legacy Edition),Tdnxbf5uj6ol7w25t3ddmri3ya4
All Of Me,Art Van Damme Quintet,The Art Of Van Damme,Trgc3ebx34rsupk6w5a6tlpzz44
All the Things You Are,Art Van Damme,Beyond the Sea,Ttkevn62seag52x5afo7rloptjm
Almost Like Being in Love,Jo Stafford and Art Van Damme Quintet,Once Over Lightly,T3prmhslyl5v5lxrxyczoo23stm
Autumn Leaves,Art Van Damme Quintet,The Art Of Van Damme,T6t7sudbasxflfrlygbhgks4f5i
Bluesette,Art Van Damme,Jazz Set,Tq2c5red6utwdo6u2iqxwle5ylu
Body and Soul,Anita Baker,90s Pop Classics,Tvcqu5jp5beuvdwum3dsl2ujoym
But Not for Me,Jo Stafford and Art Van Damme Quintet,Once Over Lightly,Tqzyqcnfybbghkaqcnfw727tlya
Bye Bye Blackbird,Art Van Damme,A Perfect Match (Bonus Track Version),Tori2ovxu4vvrjhprl6323wkmam
Caravan,Ambrose and His Orchestra,Oldies But Goldies Vol. 12,T3phzy7sgvkzib5gnz5xx55akay
Cheek to Cheek (Bonus Track),Art Van Damme,A Perfect Match (Bonus Track Version),Tre3rscdzjof6efamoh3wlt7hk4
Cherokee,Art Van Damme,Lullaby in Rhythm,Tgqtpysf3e655jyprrpyssr6i5a
Easy to Love,Art Van Damme Ensemble,Art and Four Brothers,Tr6kj6mp4ov5w3csyqrwvmfzkna
How HighThe Moon,Dave Brubeck,The Jazz Biography,Tftef5g4qsripmedb3fxvmp72ia
I Get a Kick Out of You,Art Van Damme,Lullaby in Rhythm,T3mpiepfipb63bydds72gyzfmzy
I've Got You Under My Skin,Art Van Damme Quintet,Cocktail Capers,Tzqwupyxglgfz3wxjklhb7aizqy
"Just You, Just Me",Art Van Damme Quintet,Accordion Classics,Tlwkpjo2lgxmtwfrcng6prh22oa
Love for Sale,Art Van Damme,Lullaby in Rhythm,T6xse6kqzh3leqqkx6ysis34y34
Lullaby of Birdland,Alice Babs,Swedish Jazz,T67il4jdfxza33pwsewtmjdxsly
Swings Sweetly Medley: But Not For Me / Skylark / The Nearness Of You / Moonlight Becomes You / Misty / Remind Me / Angel Eyes / Darrylyn / All The Things You Are / There Will Never Be Another You / What's New? / After You've Gone,Art Van Damme,Swings Sweetly Medley: But Not For Me / Skylark / The Nearness Of You / Moonlight Becomes You / Misty / Remind Me / Angel Eyes / Darrylyn / All The Things You Are / There Will Never Be Another You / What's New? / After You've Gone,Tdo32shnvgs763ibjslgowzwfs4
Night and Day,Rebirth Yoga Music Academy,"Tranquil Yoga Training: 15 Gentle Songs for Undisturbed, Calm and Deep Meditation and Yoga Exercises",T6p62ychhbzjxjncwon2rozbssq
Poinciana,Art Van Damme,A Perfect Match (Bonus Track Version),T7e7qls7qzaw4yka7ghqimxtapq
Samba De Orpheu,Art Van Damme
Satin Doll,Art Van Damme,Ecstasy,Tf2yiq3f3inybekg7kmz2krn7ze
Stella By Starlight,Art Van Damme Quintet,Manhattan Time: 1956,Tco4ojdbhnbojku7fvfpvqvoxti
Sugar,Maroon 5,Summer Hits,Tl4lylqhjgqh5ngzsdlrl7xwzjy
Summer Time,RINGO DEATHSTARR,Sparkler,Ts5mamknzpkas6ft6mrludmwnve
Take Five,Art Van Damme
Tea for Two,Art Van Damme,The Van Damme Sound,Tvikrtpmzc4uyy4magencqe5kwi
Tenderly (Bonus Track),Art Van Damme,A Perfect Match (Bonus Track Version),T6gmpu5z4gtp7bm7ip3t2zupms4
There Will Never Be Another You,Art Van Damme,Beyond the Sea,Tbbqhejosd7ge63kraisvmu3mni
These Foolish Things,Jo Stafford and Art Van Damme Quintet,Once Over Lightly,Trwuy7tlb5plpum2g6rz5nagvre
Wave,Art van Damme,State of Art,Ti5fdh3atgoyzbu4mldofwiex74
This Thing (Called Love),Tori Starlight,A Shot of Summer - Beach Music (Best of Electronic Downbeat Music),Tkjqj6jj7vgbtoygku57uyvkjta
Blue Skies,Ben Webster,Round Midnight (Original Recordings),T3lrer3pa5ykv2vswivaxuzrhly
Bounce Blues,Ben Webster,All the Best,Thkpruh75xwv3ccgsqb2k4ssg6a
All of Me,Ben Webster,Ben/Buck,Tv5adj7nrtvt5awdwqrrwkoocbi
All The Things You Are,Ben Webster,Dig Ben,Tbsxjakeryfs6voctqgnqvz3fni
Almost Like Being in Love,Ben Webster,The Very Best Jazz Playlist,Tw7nm7gtvnbiuo5cwwslya4dk5a
Autumn Leaves,Ben Webster,Dig Ben,Tfqwg6yz5aywigz65m74z3lcrya
Begin the Beguine,Artie Shaw,The Masters of Jazz: 33 Best of Artie Shaw & Ben Webster,T234lhuc5sfhhhu6gge3foalshm
Body and Soul,Ben Webster,Ben and the Boys,Toqxevntidiv7w3zk5xbrvnr2vy
But Not For Me (Take 4),Ben Webster,Meets Bill Coleman,Tif6af7q4tpaf5q6r5aqudnii6e
Bye Bye Blackbird,Ben Webster,Live,T7jl5v6nwy7wbuejuq4rz6hfusa
C Jam Blues,Ben Webster,"Masters Of Jazz, Vol. 4",Txyehvzs55awvdksuv4d6i3iuqu
Caravan,Ben Webster,Valentines Day 1964 Live!,Tj7ttwbwj63xmdmfcp7lcznft5q
"Cherokee (Incomplete) [feat. Ben Webster, Dizzy Gillespie & Roy Eldridge] [Bonus Track]",Lester Young,"J.A.T.P. Live at Carnegie Hall 1955 (feat. Ben Webster, Dizzy Gillespie & Roy Eldridge) [Bonus Track Version]",Tnl4fi5oiokmcztx3edeueu32cq
Desafinado,Coleman Hawkins,"Ben Webster, Coleman Hawkins & Friends",T55caayrzfsqsqnqael2j4c7rg4
Don't Get Around Much Anymore,Ben Webster,Dig Ben,T7iofd6jg3ctux5wnyd7sufir7q
Easy To Love,Ben Webster,Nostalgic Memories-The Very Best of Ben Webster-Vol. 91,Tktrjeap4klhcamjn4ruze4nzfa
Honeysuckle Rose,Ben Webster,A Salute To Ben Webster 1936-1945,Thhaniiilskgfaojzduu3hhouvq
How High The Moon,Ben Webster,Dig Ben,Tygiwmfzecjq6huoqi5tcqk5uay
I Got Rhythm,Ben Webster,Confluence,T4czq6jtltmc7zmcxhoj3vvw4iq
I'm Gonna Sit Right Down and Write Myself a Letter,Ben Webster,"Live at Jazzhus Montmartre, Vol. 2",T3c25jy34edtjkabsvxk7hugv7i
I've Got You Under My Skin,Stan Getz,"The Famous Jazz Masterpieces' of Lionel Hampton, Jimmie Lunceford, Ben Webster and Other Hits, Vol. 5 (140 Songs)",Tj6hr5mfj4yq4n4js7bmal7nqxe
In a Mellow Tone (Live),Ben Webster,Ben's Blues,T6ymfxjivorz2lgvv3czr5h4nla
In a Sentimental Mood,Ben Webster,"Ben Webster, Coleman Hawkins & Friends",Tsxdlduhzahshexprkx6o6362u4
"Just You, Just Me","Flip Phillips, Ben Webster, Illinois Jacquet, Dizzy Gillespie, Roy Eldridge, Johnny Hodges, Oscar Peterson & Lionel Hampton",Best of the Jazz Sessions,Tp5zfhqlzuayanqysh6t2xbhcue
Love for Sale (Concept I),"Art Tatum, Benny Carter, Loule Bellson, Roy Eldrige, Buddy De Franco, Ben Webster","The Complete Pablo Group Masterpieces (Hd Remastered Edition, Doxy Collection)",Tt2pfskb46uqsgwgoo5fu6f4kt4
You're My Thrill,Ben Webster Quartet,"Lullaby Of Birdland, Vol. 2",Tmuiqdhopci6o5nlq4gav7wzcse
Misty,Ben Webster,"Live at Jazzhus Montmartre, Vol. 1",Tbm4dehsxeaxh5zvxylhfafk2lq
Night and Day,Ben Webster,"Grandes Éxitos, Vol. 1",Tc4xxcw7j3bgpe6j543hke5jxza
On The Sunny Side Of The Street,Ben Webster,"The Swing Tenors: Ben Webster, Coleman Hawkings & Lester Young vol.2",T573mf6ktwzazpse2goimc5vvre
Put Your Heart In Song (Remastered),Mildred Bailey,Penthouse Serenade,Tobmwi7kakdkyqdaa6kpobrbdhy
Ruby My Dear,"Thelonious Monk, Gene Ramey, Art Blakey","The Famous Jazz Masterpieces' of Lionel Hampton, Jimmie Lunceford, Ben Webster and Other Hits, Vol. 5 (140 Songs)",Tqgu5guau7xwvakfenqikbpjm6i
Samba De Orpheu,Ben Webster 
Satin Doll (Original Mix),Ben Webster,Coal Train,Tjglss5syijcv2okwpbxoptlohq
Sophisticated Lady,Ben Webster,Dig Ben,Tzg2o2pbg6rdg4mluxxhf3h2vhu
Star Dust,Ben Webster,111 Swing Classic Masterpieces (Jazz Masters),Tyyaihhdp7e7qams3qzpn54t6li
Stella by Starlight,Ben Webster,The Jazz Collection,Tezrhviexcnte52z4sslr7pys3u
Tenderly,Ben Webster,BD Music Presents Black No Sugar,Ty74jjdrrh3i7ktn3b3c2tohmzy
Summertime (Bonus Track),Ben Webster|Harry Edison,Complete Quintet Studio Sessions (Bonus Track Version),Tswwrlcku3aruxlg4k5snujg42q
Baby It's Cold Outside (Take 5),Ben Webster,Dig Ben,T4w35ny7hcejunqhdbmq5p7efe4
Take the a Train,Ben Webster,Ben Webster: Only the Best (Remastered),Teai6xoq6ejrannkt5afpno5pmy
Tea For Two,Ben Webster,Stompin' At The Savoy Vol 2,Ttzj35rvdimaoepy3ppp7c2f2rm
Tenderly,Ben Webster,Dig Ben,Twfutsco26p4w66v5brnfo6iala
There Will Never Be Another You,Chet Baker,Gerry Mulligan. Ben Webster. Chet Baker,T5mlyinv4ysogbib5f34m5shgye
These Foolish Things,Ben Webster,Sax Scene,T4rkjsvlckqhhmxiuakoqfj6eia
Three Little Words (Remastered 2016),Carmen McRae,Remastered Hits (feat. Ray Charles / Ben Webster / Phil Woods / Zoot Sims / Art Farmer / Dick Katz) [Remastered 2016],Tjuspwody73dcl66b7hjvy3rz6e
Tidal Wave (Remastered),Ben Webster,Pennies from Heaven,Ttw2vkusg2cejhulxufqdzgkz4m
What Is This Thing Called Love,Ben Webster,At The Renaissance (Remastered),Ttmsytzyyvgnngef4di6vzu3zia
You're Driving Me Crazy,"Django Reinhardt, Stéphane Grappelli, Le Quintette du Hot Club de France","The Famous Jazz Masterpieces' of Lionel Hampton, Jimmie Lunceford, Ben Webster and Other Hits, Vol. 5 (140 Songs)",Tsy63wgzxth2xcbktsh43f56glu
'Round Midnight,The Art Farmer-Benny Golson Jazztet,The Jazztet at Birdhouse (HD Remastered),Tbtw6dguzppgbbqu2lnvzjw5ll4
"A Child Is Born (feat. Benny Golson, Bob Brookmeyer, Frank Wess, James Moody, Jimmy Owens & Richard Davis)",Hank Jones,One More - The Music of Thad Jones,Tawnsyaza2qg4vvehleaolt2zza
A Foggy Day,Benny Golson 
Swing it,Benny Golson,"All Blues, Benny Golson",Tqhlvew2dsmrjfoo4akdek3w6di
All Of Me (With Dialogue),Diana Ross,Lady Sings The Blues,Tm2ievb73ja6rnugfq7taddpbrq
The best thing for you is me,Benny Golson,"All Blues, Benny Golson",T7joochiz56b5yd5hm6vx667uua
Autumn Leaves,Benny Golson,Just Jazz!,Texlt6r45jobwsnor6t6c45n2bi
"Begin the Beguine (feat. Quincy Jones, Phil Woods, Benny Golson & Billy Mitchell)",Dizzy Gillespie,Dizzy In South America Volume 2,T7a3lid3zyrjkdoc5wfyxsgvuyi
Blues-Ette,Curtis Fuller,"The Savoy Story, Vol. 3",Tdy66bu3wqq5k5z2la7iu5enkkm
Body and Soul,Benny Golson Tenor Summit,Tenor Legacy,T6pgbopssab3okent6rkrzw7jb4
Whisper Not,Benny Golson,The Best of Me - Benny Golson,Tfycbzoe67jwyvurjnlobp5zt2i
I Remember Clifford (Remastered 2015),Buddy Rich,Blues Caravan (Remastered 2015),Tdffngwxk532wixwasltjbqepoy
