Dreamsville,Wes Montgomery,Fly Me to the Moon (Doxy Jazz),Teeyhb3jyrfnhks3jmxkh6joxiu
Fly Me To The Moon,Wes Montgomery,Road Song,T4pb3lbre5f3nlxbkuqj43ttir4
Airegin,Wes Montgomery,Four on Six,Tyfk24z2a2j45547i3cf2npnhhy
How High the Moon,Wes Montgomery,Wes Montgomery: In the Beginning,T34korm4ezq5xvjbbdiqjrdyad4
All the Things You Are (Remastered),Wes Montgomery,Love (115 Original Love Songs - Remastered),Trolcmwwzpdv6jvg7emqvhy3x6q
If I Should Lose You,Pat Martino,Remember -Tribute To Wes Montgomery,Tat4kueq2iiv5ci5ant2cljo3ua
I'll Remember April,Wes Montgomery,Body and Soul,Tcr2a3mytyn5e2od5ipaqdkoisu
If I Should Lose You,Wes Montgomery,The Classic Recordings: 1960-1962,Tzi3diyawqggh76il4gdc5r6zqq
In A Mellow Tone,Wes Montgomery,Wes Montgomery & The Billy Taylor Trio,T7gchnks6kuhvuhyia5mbpxussi
In a Sentimental Mood,Tom Bruner,Homage to a Hero: Tom Bruner Plays the Ballads of Wes Montgomery,Tmnzj6xywrbqlgv4dq3owcoofrq
Just Friends,Wes Montgomery,Wes Montgomery & The Billy Taylor Trio,Tplzdxp3m3jdd4fsqexrbfkstku
Misty,Wes Montgomery,The Best of Wes Montgomery,Tdhfznpwvxjvnejwqjiekn3prpi
My Funny Valentine,Milt Jackson,Milt Jackson & Wes Montgomery Bags Meets Wes! / Milt Jackson Quartet,Tjy7zwlio4h75aq7k66hy2vmmc4
Here's That Rainy Day,Wes Montgomery,"My Date Night, Vol.2",Tdkfduusvelpettiry6xzqczuny
On Green Dolphin Street,Wes Montgomery,So Much Guitar! [Original Jazz Classics Remasters],Tmuf5hv4yhkheb7dlkjnbwz64ee
Satin Doll,Wes Montgomery,"West Coast Blues, Vol 1",Tiyx75jwwkeg7ck2obvaqen2xyy
Stella By Starlight (Take 2),Wes Montgomery,Dangerous,Tuijcxprv4fxsvqgsxppasdyj34
So Do It!,Wes Montgomery,Enjoy Great Jazz - Vol.5,Tikehihkkppfttmafwzrbbnyyju
Sun Down,Wes Montgomery,Chill Out Jazz Guitar,T4b4qaxxgjcww5bimpyfjld6kae
Take the a Train,Wes Montgomery,The Best of Wes Montgomery,Ta2bwjzgv5vrb7yefksl7lt6vr4
How Insensitive,Wes Montgomery,The Girl From Ipanema: The Antonio Carlos Jobim Songbook,Tt6cwgrfknmo5koc2narmnub7zi
There Will Never Be Another You,Wes Montgomery,Wes Montgomery & The Billy Taylor Trio,Ttv76krq5q7xkruce4zjo7x7ni4
Yesterdays,Wes Montgomery,Yesterdays,Tsa67lhpe7nkbruialhdrw7exii
All of Me,Count Basie,All Of Me,Tbvvdb6ehqgrgekgsaj5axgz5em
All the Things You Are,Guy Lombardo,"Greatest Classics: Guy Lombardo, Louis Armstrong, Count Basie",Tf6e4ajt45sg2jntqiqnoqo57pi
Autumn Leaves,The Count Basie Orchestra,The Best Of The Count Basie Orchestra On Denon,T2xnnhmqoox57kafgwb22yfg22u
One O’Clock Jump,Count Basie,Billie Holiday & Friends,Tfagf2np6ogknf4563v222tshpm
Body And Soul,The Count Basie Orchestra,Basie Is Back,Tn4unh7wyqmjnyrq6x4tanrbyq4
Meet Me At No Special Place,Count Basie,Bill's Mill,T4di7kz4plkfm44ovmbss5c2tse
Cherokee,Count Basie,"Count Basie In Disco Order, Vol. 4",Trk6kcm3tpgpdtuvrne4qell3ja
"Days of Wine and Roses (From ""Days of Wine and Roses"")",Count Basie and His Orchestra,Broadway and Hollywood...Basie's Way,T4uc34wex4y4w7eiezydiczzeha
Bread,Count Basie,Basie Jazz (HD Remastered),Ttalr5myzwsb5g4xofznxi2w6ge
Fly Me to the Moon,Count Basie,50 Chansons de Noël,Tquk3k22pdskqedhdn6rzgqhqea
Perdido,Count Basie,Beaver Junction Vol.4,T6u7ocucwu3xis2fnlussmd3xna
Have You Met Miss Jones,The Count Basie Orchestra,High Voltage,Tqjloac3qxgsohafwky7ku3lc34
How High the Moon,Count Basie,Count Basie in London (Remastered),Tebt3lektps4ew7q4yqg2vht7eu
I Hear a Rhapsody (Remastered 2017),Benny Goodman,"Remastered Collection, Vol. 11 (feat. Count Basie / Charlie Christian / Fletcher Henderson / Lionel Hampton / Teddy Wilson / Helen Forrest / George Auld) [Remastered 2017]",Tpx3jqrev3z46fw3btuzxd7zeoa
"Hallelujah, I Love You So",Count Basie,The Jazz Collection Volume One,Tnun7ya3mshkc7nnlpiug34jh4a
With Plenty Of Money And You,Count Basie,Capitol Sings Harry Warren / An Affair To Remember (Volume 18),T6q4uqgmsbjwuekdhp6wf75xysy
I'll Remember April,Count Basie,Saga Jazz: Small Groups Studio Sides 1950-1952,T3mjorcf6eqhetjaw2xcxct3bqi
If I Were A Bell,Count Basie,You Can Count On Me,Tryjue44tdm75nnhumn4k2p3zhm
In a Mellow Tone,Count Basie,"April in Paris, Vol. 1",Tr4tifax3eks6r3xowxjqvhblmu
In a Sentimental Mood,Count Basie,Count Plays Duke,Tlkglxruojhlokx7btj2wqwitty
It Could Happen to You,Count Basie,King of Swing,Tznccki4jbmeksa7xh5lt2xkfyq
Just Friends,Count Basie,At Carnegie Hall,Tuoowncqp3bvrftibtdy3jpncn4
Mambo Mist,Count Basie,282 Masterpieces,Tjgkobg3jk3eoraeezpmjpplcrm
My Funny Valentine,Bill Henderson & Count Basie Orchestra,You Better Love Me,Ta5ajrrn7l4vocnb2awr47e6mom
Night And Day,Count Basie Sidemen,"Away From Base With Glenn, Una Mae & Sam 1939/41 Disc D",Tl3icifzrsyjbhb6fpazjdtwssy
On Green Dolphin Street (Remastered 2017),Joe Newman Quintet,Joe Newman Quintet at Count Basie's (Remastered 2017),Tf3kooqj3zidagqnshtmkvodfum
Satin Doll,Count Basie,100 Hits Love (Happy Valentine's Day),Twsyg2izlhlkgijirhznobvd4sq
Stella by Starlight,Count Basie,Stella by Starlight,Tqcsxd5vj2yqivvu5trm3oxr3tm
"Slow, But Sure",Count Basie,King of Swing,Tpbj3rim7qyrila2fdx3w4njsyq
Rat Race,Count Basie,The Midnight Sun Never Sets,T6lbcdytkatoqfug7z7xljzw46q
St. Thomas,Count Basie,The Big Band Sound Of Count Basie,Tdp5pzy46orqdvsgg3lzki2gzhe
Sweet Georgia Brown,Bill Henderson & Count Basie Orchestra,You Better Love Me,Tsajumwlgdtsz7hmrpyqonqne4i
"Take The ""A"" Train",Count Basie,Count Plays Duke,Tdycsbwtpohzxaqu3wu3ie26age
The Girl From Ipanema,"Sammy Davis, Jr.",Our Shining Hour,Tdym273doie3dzcuze7on5l5yee
There Will Never Be Another You,Count Basie,The Count Basie Collection,Tl7mymjb5qdxrvpd2fg5dfvdxue
What Is This Thing Called Love,Tommy Dorsey,The Masters of Swing! (33 Best of Tommy Dorsey & Count Basie),Tb6e5t52pjbxaezzpgk7c2egcb4
Yesterday,Count Basie,The Beatles (Instrumental Number Ones),T6lhkfktwtqmhg4jiavl7fiduxe
All Of Me,Benny Goodman,Ain't Misbehavin',Tohzxbn4r4zmhchtbvr7fk2engy
All the Things You Are,Benny Goodman,"Big Band Music for Lovers: Forever My Love, Vol. 3",Tbybvibklby35hhm6q7x7bbcwgm
Alone Together,Benny Goodman,Jazz for a Romantic Evening,Tg2ihjc7p4nuxj2ydq7xrwvlbsm
Ain't Misbehavin',Benny Goodman,Falling Leaves: Jazz Classics for Autumn,Tphc2pagekldc4j232dwlpnuiqu
Riffin' the Scotch,Billie Holiday,"Easy Bounce, Vol. 2",Tgtqvfiltienejwiqq2ppqa7mna
Body and Soul,The Benny Goodman Trio,Ken Burns Jazz - Benny Goodman,T6ll2yaoqlaaj2a6jnsnuu54lvm
But Not For Me,Benny Goodman,Slipped Disc,Te77x7ii5hd2kkaed7zlvdoq6xq
Bye Bye Blackbird,Benny Goodman,Moscow Sessions,Tnkmabgc44gw664qukc5olnmzb4
Cherokee,Benny Goodman,Battle of Clarinets,Tduwxqlcc7gh6tnwwfyjekl6fe4
Cherokee,Benny Goodman,The Best Jazz Tunes of 50's (Doxy Collection),Tdwamnitfbxxec3zfthjwf2afiu
Fly Me to the Moon,King Of Swing Orchestra,Memories of You (Benny Goodman Gala) [feat. Peter Fleischhauer],Tbhoktk3ujjjuespjorh4rpcl5y
Room 4 (Goin' To Town),Benny Goodman,The Complete Benny Goodman (1928-1929),Tkvhqletggwrtqvwvbhpxmtgwse
Have You Met Miss Jones,Benny Goodman,Traffic Jam Jazz 2,Tp4rirzgi6prin2kidmfvc4femy
How High The Moon,Benny Goodman,How High The Moon,Tkuprrzavn4mthhwhxmogqyxb7e
I Hear A Rhapsody,Benny Goodman,123 Benny Goodman King Of Swing,Ty7mbpvvkbpdbejwjm6hcqi2yti
Exactly Like You,Benny Goodman,Swing Time for Dancing Vol. 8,Tjyhdtrc4inw2uln63x3vnemkgy
You Forgot to Remember (Remastered),Benny Goodman,"Benny Goodman - Platinum Series, Vol. 4 (Remastered)",Tke3mwuzd2xle2hlr33kakkxezi
"I'll Remember April (From ""Captain America: First Avenger"") (feat. Ella Fitzgerald, Louis Armstrong, Chubby Checker, Stan Kenton, Benny Goodman & Glenn Miller)",Woody Herman & His Orchestra,Swingin' Jazz Classics - Deluxe Edition,Tbxnvbwya2w3gf3chkwkhwvnswi
I'm Old Fashioned (07-30-42),Benny Goodman,Complete Jazz Series 1942 - 1944,Tsebtylmzuk6w7uaukjk4xdtsbi
If I Should Lose You,Maynard Ferguson,Jazz for Dancing (HD Remastered),Tuse3vdm5tzwu5ujrc66k3xfcfq
In a Sentimental Mood,Benny Goodman,All the Cats Join In,Tbabfw5dlh6g5pwgri37jzearyq
It Could Happen to You,Benny Goodman,"Benny Goodman, The King of Swing",Ts2erpa52strzzjcawbzhhn3bw4
Can't We Be Friends?,Benny Goodman,The One and Only BG,Tofjze23ipx76q5id3zdoqt2xwu
Bei Mir Mist Du Schoen (3) (Digitally Re-Mastered),Benny Goodman,Jazz Goes Jewish (New Edition),Twfoojkez57r3p7gxr5eop3z24i
Makin' Whoopee,Benny Goodman,My Funny Valentine's Day,Teprrhp6c65ind5mnq2pat7bmw4
Night And Day,Benny Goodman,"Roll 'Em., Vol. 1",Tmldbw3oehmnewoih2z4qwv7fiu
On Green Dolphin Street,Nancy Wilson,"Holiday Jazz: Doris Day, Sarah Vaughn, Rosemary Clooney, Glenn Miller, Benny Goodman, Mel Torme, Peggy Lee and More",Ttwdcvfj7mengmawqlwxavb4fji
Satin Doll,Benny Goodman,Jazz Masters Deluxe Collection,Tyu3mkkne3ssqsbq52f5hkblilq
Slow but Sure,Benny Goodman,1931-1933 (HD Remastered),T64ei4a7r7jemxhtibaxzs6vkia
East Of The Sun (And West Of The Moon),Benny Goodman,The New Benny Goodman Sextet (HD Remastered),Thr6cmw6jmm4f75qitmpl7pxmsa
It's Tight Like That,Benny Goodman,"Jazz Days Are Back, Vol. 1",T4372rqxc523oly7dzmtjvnx2fm
Sweet Georgia Brown,Benny Goodman Quartet,Shades of Jazz (Benny Goodman Quartet),Tz4degqidye5pttio2ehxrlklo4
Take the A Train,Benny Goodman and his all Star Band,The Jazz Collection Vol. 1,T3dufjifooinu2wsyy256h2zlxa
The Girl from Ipanema,Benny Goodman,The Girl from Ipanema,T6u4fjfwqk4fvh7zxvqfjtemi7i
There Is No Greater Love,Benny Goodman,"The Yale University Archives, Volume 6: Rainbow Grill '66 and '67",Ty5agpxhdda474bh43puummxdeq
What Is This Thing Called Love,"Nat King Cole Trio, Oscar Moore, Johnny Miller","The Best Music Collection of Benny Goodman, Oscar Moore, Joe Lippman, Roy Eldrige, Sarah Vaughan and Other Famous Artists, Vol. 4 (150 Songs)",T4cyshrd2hpgwpk3ype6gzcn3ae
Sent For You Yesterday,Benny Goodman,Benny Goodman and His Orchestra Selected Favorites Volume 10,Tzpb2fop4r4hzkyx5kibchh3frq
All of Me,Ella Fitzgerald,All Of Me,Tn4rnaq6hcsndjp3jro5so4mpvq
All the Things You Are,Ella Fitzgerald,Great American Songbook,Ttcme3zjan7ld6d7yscyfwrkolu
Alone Together,Ella Fitzgerald,Ella Swings Brightly With Nelson,Tvgnxxr366y5nnchdit5p4vmog4
Stardust,Ella Fitzgerald,Autumn Leaves,Toxvluf5vhbvweiijyi5bx7dtrq
Two O' Clock Jump,Harry James and his Orchestra,"150 Original Jazz Greatest Hits (Remastered Version, Including Billie Holiday, Charlie Parker, Ella Fitzgerald)",Tyskils5x4w5dpcgzhnq7osqdoe
Body And Soul,Ella Fitzgerald,Ella Swings Gently With Nelson,Talo6i3nvqjtek2jh6klgqqmwhy
But Not for Me,Ella Fitzgerald,"Ella Fitzgerald Jazz Collection, Vol. 14 (Remastered)",Tz2ddsvnhhewoxdodgfb3ij5zfy
"Bye, Bye Blackbird",Peggy Lee & Ella Fitzgerald,Songs From Pete Kelly's Blues,Tzl3eupxrktg2v2wvp57hn3nyg4
How High The Moon,Charlie Parker,Confirmation: The Best Of The Verve Years,Tyu4ya7ku7zuq3rb5m5igsnqcv4
Days of Wine and Roses,Ella Fitzgerald,It Might as Well be Spring - Jazz Classics,To2xbfr4vfbvotmvb4fqarwhzqi
Blue Skies,Ella Fitzgerald,"The Complete Get Happy Sessions (Hd Remastered Edition, Doxy Collection)",Tqga5ygndrm5jctxgfqkojxd2pq
I'll Never Fall In Love Again,Ella Fitzgerald,Fly Me to the Moon: Easy Listening Songs,Tnqmfjxpvkzdvdgogubdpcnxi5e
I'll Chase the Blues Away,Ella Fitzgerald,Mixed Music Styles Vol. 4,Tfse7azcielzt6d7drhov3elg64
Have You Met Miss Jones,Ella Fitzgerald,Ella´s Treasures,T62edycvwb3kqn3y5wqcp56d7uq
How High the Moon,Ella Fitzgerald,Mack the Knife,T54tabel3xubtbmebfn5gks3eou
I Love You (for Sentimental Reasons),Ella Fitzgerald,I Get A Kick Out Of You,Tc3doxndsxyvllopqwzomvicege
Remember,Ella Fitzgerald,125 Ella e Louis Classics (The Beautiful Songs Remastering 2014),Tgj5w24wwpqv2n3ejid22rabd2u
I'm Old Fashioned,Ella Fitzgerald,Great American Songbook,T6g62eolqxtpbhcvvrggqiqkuu4
If I Should Lose You,Charlie Parker,"The Wonderful Jazz Music of Ella Fitzgerald, Charlie Parker, Fats Waller, Lennie Niehaus and Other Hits, Vol. 3 (140 Songs)",Tsqxlagwxzjwe6vzomtmdvxdqqy
If I Were a Bell,Ella Fitzgerald,The Jazz Collection Volume Two,Tkbjz24342dt7vr7bbpfi63vx7a
In A Mellow Tone,Ella Fitzgerald,Ladies In Jazz - Ella Fitzgerald Vol 6,Tymoua24ucpd7yqnll2wp4w6p2e
In A Sentimental Mood,Ella Fitzgerald,Ladies In Jazz - Ella Fitzgerald Vol 2,Tm6rv2wzn6bkaj2anj4a5uejohe
Medley: Candy - All I Do Is Dream of You - Spring Is Here - 720 In the Books - It Happened In Monterey - What Can i Say After i Say I'm Sorry (Remastered Version),Ella Fitzgerald,"50 Jazz Essentials, Vol.1 (The Finest Collection With Ella Fitzgerald, Miles Davis, Glenn Miller and Many More...)",Tml2uzpjpxdv56qt2clbtzm2mqe
My One and Only,Ella Fitzgerald,Frank Chacksfield & Friends Do Gershwin,T3ck2g55l5l4s5yfuql5ehex4iq
Misty,Ella Fitzgerald,125 Ella e Louis Classics (The Beautiful Songs Remastering 2014),T3n6bxqzkzugyesyvje6gxgg7ka
My Funny Valentine,Ella Fitzgerald,Ella Fitzgerald's Greatest,T6zbzbtk4hugzosaqoaky7s2gz4
Night and Day,Ella Fitzgerald,Ella Fitzgerald's Greatest,Teoqhxuuj435l5j5zgeww33nweq
On Green Dolphin Street,Ella Fitzgerald,Easy Living [Original Jazz Classics Remasters],Tlsnegwicqhx2qiww2ukcaff4iy
Satin Doll,Ella Fitzgerald,"Simply the Best, Vol. 1",Teryg7v4f2dvx6hfaflhmqiogva
Stella by Starlight,Ella Fitzgerald,All Over Again,Tbeythbr74q6eqejyhtefkbmcbi
Scrapple from the Apple,"Red Mitchell, James Clay, Lorraine, Billy Higgins","The Wonderful Jazz Music of Ella Fitzgerald, Charlie Parker, Fats Waller, Lennie Niehaus and Other Hits, Vol. 3 (140 Songs)",T7xpl2dk4pgeedcph6r7cfb272y
"Oh, so Nice",Ella Fitzgerald,Keep Calm and Listen Ella Fitzgerald (Vol. 04),Tyll2x4togsfg77ttuo5voq6vmy
Midnight sun,Ella Fitzgerald,Relaxing Chillout Dinner Music (Smooth Jazz Lounge Classics),T6aqn772n3t6gwe4msvl7snxzk4
St. Thomas,Dizzy Gillespie Quintet,"150 Original Jazz Greatest Hits (Remastered Version, Including Billie Holiday, Charlie Parker, Ella Fitzgerald)",Tpz2oojooficsnnrqrei3jiidze
Sweet Georgia Brown,Ella Fitzgerald,Sugar Blues,T7hawdxjfcu4bbq65227qsi2gre
Take the a Train,Ella Fitzgerald,Clássicos,Ttpaornxsxlzn6k5gkwshcmlema
The Girl From Ipanema,Ella Fitzgerald,Best Of The BBC Vaults,Tbbmsydh7xhxigyk3uiexqdwv44
There Is No Greater Love,Billie Holiday,Ella Fitzgerald vs. Billie Holiday,Tveax7b5pxkgpupmhgcubebuvvy
There Will Never Be Another You,Ella Fitzgerald,North Sea Jazz Legendary Concerts,Trcyghxi3tcse2qjmk44cj2tekm
Spring Can Really Hang You Up the Most,Ella Fitzgerald,"One O'Clock Jump / Clap Hands, Here Comes Charlie! (2 Classic Original Albums - Remastered)",Tf2zib2p4j4wh3fjiaxjty3zs5i
What is this Thing Called Love?,Ella Fitzgerald,Ella Fitzgerald's Greatest,T7tjvl4euxr76vcmo7h5s5olqr4
Yesterdays,Ella Fitzgerald,Paper Moon Smile: Movies and Music,T5icw2nsizkiawwkulqjf4pdzba
All of Me,Billie Holiday,"Billie's Blues (Hd Remastered, Restored Edition, Doxy Collection)",T2yjd56da2gh2u7k4fdu7ffiwky
I Only Have Eyes For You,Billie Holiday,All the Things you Are - The Love Song Collection,Tzkq6kxelty4sxtjwuextgv52di
Travelin' All Alone,Billie Holiday,Midnight Together,Tgl3ml2g3bglyilhbfw5esp3uh4
I'll Be Seeing You (The Notebook),Billie Holiday,Autumn Leaves,Tpk2w42ouxpzmc7z3kqypg7o5gi
Billie's Bounce,Charlie Parker,The Best Of Christmas Holidays (Fantastic Relaxing Songs),Tkpdknpf3tlytnjwz6gncxemfpm
Body And Soul,Billie Holiday,Billie's Blues Volume 1,Tqdqdhswqwfnmiaedwvckk2b7c4
But Not for Me,Billie Holiday,This Is... (Billie Holiday),Trmti2tmd3feeqfe3eajzli7oxa
Gloomy Sunday,Billie Holiday,BD Music Presents Bye Bye Blackbird,Tn5rdak3pcs4dqjxw6bajzm47fy
Cherokee,"Lennie Niehaus, Stan Kenton","The Legendary Music of Billie Holiday, The Mills Brothers, Louis Armstrong, Bessie Smith and Other Hits, Vol. 3 (160 Songs)",Tyxfkpbnwsqiqbdomxomqzywksq
"I Only Have Eyes For You (Days Of Wine And Roses, 1962)",Billie Holiday,Music From The Films Of Blake Edwards,T3zq7mugdkto35bmx2i4ou3a4be
Announcement,Billie Holiday,"Billie's Blues (Hd Remastered, Restored Edition, Doxy Collection)",Tdzie3qycqfkwbjtmy74xrct6yu
Fly Me to the Moon (Instrumental),Billy Holiday,Big Band Hits,Treldxgzy5la3p4gfmrrfjwt3ly
Footprints in the Snow,Billie Holiday,"70 Country Top Hits (70 Country Best Songs from Johnny Cash to Hank Snow, from Johnny Horton to Jim Reeves and Many Others)",Tqqwwe54e5k7yhf6gm7c3tz6j6a
Until the Real Thing Comes Along,Billie Holiday,Mixed Music Styles Vol. 4,Tnkni4k5pxtewk62bihh3q2pbpm
Have You Met Miss Jones?,Ella Fitzgerald,Soul Sisters: Billie Holiday & Ella Fitzgerald,Tso6ddmakcvrj522pqxe72665uu
How High the Moon,Billie Holiday,JATP All stars with Billie Holiday All of me,Tnlb5qg6av2cnwpde3l257tdmmm
I Loves You Porgy,Billie Holiday,"Melodious Harmony - Nat 'King' Cole, The Platters, Billie Holiday, Judy Garland",T2jo7p2rv7deuyqw6q2jx7smk4q
Did I Remember?,Billie Holiday,Billie Holiday: Billie's Blues,Tfc7pshvs7emqeswmkbjffn3drm
I'll Remember April,"Ella Fitzgerald, Billie Holiday",Ella Fitzgerald And Billie Holiday At Newport (Hd Remastered Edition),Tvkizyywbpzv5vcj2f6xbds65a4
Sometimes I'm Happy,Billie Holiday,Any Old Time (The Collection),Td4owylheuxmlgylgvcweuknqre
If I Should Lose You,Nina Simone,"For Lovers - Sarah Vaughan, Billie Holiday, Nina Simone",Tx5vj4meiollmtqjc3dikq3zsle
If I Were a Bell,Ella Fitzgerald,Ella Fitzgerald vs. Billie Holiday,Tqvjs6xt6fgyej7dncog3xs7pyu
In a Mellow Tone,Ella Fitzgerald,Soul Sisters: Billie Holiday & Ella Fitzgerald,Tcmr6x7wj6l4kpuodpzdkqesliq
The Mood That I'm In,Billie Holiday,Sentimental and Melancholy,Tpvqgtziosnzbegqfclscljabqi
They Can't Take That Away From Me,Billie Holiday,It Could Happen To You: Music From The Motion Picture,Twh3lrjqxwjhf3bf3xdiilla3j4
Just Friends,Billie Holiday,Billie's Blues,Tkqdjo7b3weqhguevwp4w5qw4xe
Misty,Billie Holiday,Misty,Th2hv5mwk7zo6ndmxbnf44e52oq
My Funny Valentine,Billie Holiday,Classic Hits of Billie Holiday & Ella Fitzgerald,T3c4sjfl6auvqqtdymxuvvkfrxe
Night and Day,Billie Holiday,One Night With..... (Billie Holiday),Tyexicmm2wo4d5hmrvjew3ujope
Ain't Nobody's Business,Billie Holiday,"Big Band Music Vocalese: Satin Dolls, Vol. 2",Tajihu4xkkp2ofllhq5tj4r7evy
Stella By Starlight,"Miles Davis, John Coltrane, Bill Evans, Paul Chambers","The Best Jazz Hits of Billie Holiday, Charlie Parker, Fats Waller and Other Hits, Vol. 7 (160 Songs)",Tbelbfyqx72c6cmfom4z7kjhjt4
Scrapple from the Apple,Charlie Parker,"The Best Jazz Hits of Billie Holiday, Charlie Parker, Fats Waller and Other Hits, Vol. 7 (160 Songs)",Tr4g7t4r53hdxvr3nxkjnyz44uu
Easy to Love (Remastered),Billie Holiday,Billie Holiday Sings (Remastered 2014),Tksjdzbj65gk25qc4q4ifht6vyu
East of the Sun,Billie Holiday,Billie's Blues Volume 1,T6mlrl7rgt5s4zy2rifcb5jcpp4
Life Beginns When You're in Love,Billie Holiday,Great Singer Hit Mix: Sweet Georgia Brown (Highlights 1936),Tb374k6oa5jqwwwredakjubiu6y
Take the A-Train (Instrumental),Billy Holiday,Big Band Hits,Tp5kucjfzcgo6h4cemeel5imdz4
(There Is) No Greater Love,Billie Holiday,Billie Holiday,Tlhcefhgmwqmlf7lkxytg4qtqky
There Will Never Be Another You,Lester Young & Oscar Peterson Trio,BD Music Presents Lester Young & Billie Holiday,Tfcxbmmfl77idz4pauwkhpsvjfe
What Is This Thing Called Love,Billie Holiday,What Is This Thing Called Love,Tiyb34g6vh4fxwz6urq2lvstl2e
Yesterdays,Billie Holiday,Billie's Blues,To3iqr5nxbnnakcu5bcupb4hcsi
All Of Me,Frank Sinatra,Ultimate Sinatra: The Centennial Collection,T5hig4bz5r4ylbe7ncqq2ksxtoe
All The Things You Are,Frank Sinatra,All Of Me,Tfru24weutks43liumy3oaijana
Together,Frank Sinatra,All Alone,Thk7ycvlwwb7ljgy3bld24s6dce
Autumn Leaves,Frank Sinatra,Frank Sinatra - Autumn Leaves,T56cydlw25icrmqcsa5frndepja
Body and Soul,Frank Sinatra,Frank Sinatra's Sunshine Cake,Tjub3lfq7g4bguakwprdiuxzx74
Love Me,Frank Sinatra,There's No Business Like Show Business,Tb5znbfdlcps67agfpjhhuxgzh4
"Bye, Bye Blackbird",Frank Sinatra,"Deluxe: Anthology, Vol. 5 - The Rat Pack",Ti3eq5lrkspopcf2xj4aiaxsa6q
Days of Wine and Roses,Frank Sinatra,Days of Wine and Roses,Tyjxvnkvmqkgic3emua6sjrh4cq
I've Got You Under My Skin (Remastered),Frank Sinatra,Romantic Jazz Moments (Doxy Collection Remastered),Tul2l7lg2pccrnipzbrfmw2vhta
Fly Me To The Moon,Frank Sinatra,Mid Night Club Vol. 1,Tiuektkkvcqhzhwz2cs72gj56qe
You Can Take My Word For It Baby,Frank Sinatra,Tiny Footsteps,Tl6kdqyevimr6oh6nu2ucsajnpe
You're Sensational,Frank Sinatra,"The Golden Age of Hollywood Musicals -, Vol. 4",Tdpcyurlt6czf5bnxkopvbczvhm
Have You Met Miss Jones?,Frank Sinatra,"Simply Swinging the American Songbook, Vol. 3",Tyzzh5qmcu5qg2jyxncwvn35bma
East Og the Sun (West of the Moon),Frank Sinatra,"Moon Jazz, Vol.1: How High The Moon",T7wki6ng5vtszy6lztu6kdmtjjm
I Hear A Rhapsody,Frank Sinatra,I've Got The World On A String,T7tob3u7c5gfvxbac6p3rfrfbxe
I Love You,Frank Sinatra,Saga All Stars: I've Got the World On a String / Selected Singles 1953-56,Tdfkq7da3myzl5zhxllkh52gcfy
Remember,Frank Sinatra,The Song Is You,Tzhkbwcypqi7ajwc56ksmsfr7nu
I'll Remember April,Frank Sinatra,Easter Playlist,Tklhrmygxfqlrmieayfl2rwevai
I'm in the Mood for Love,Frank Sinatra,Old Time Classics,Tsisweyzee2lfwn4xy3d5jlzd6q
If I Should Lose You,Frank Sinatra,"100 Beautiful Sinatra Romantic Songs (Famous Love Hits: My Funny Valentine, I Love You and Other)",T62wfkrshgu5aehdydwutaadeui
Jingle Bells,Frank Sinatra,Christmas Happiness: If I Were a Carpenter,T4mwlgdtrt4sdc2fhmcqt7ung2m
In a Mellow Tone (Alternate Take),Oscar Peterson,The Complete Cole Porter Songbook / Plays the Jerome Kern Songbook / Plays the Duke Ellington Songbook / a Jazz Portrait of Frank Sinatra,Ttyw4t3efamnm3chjzygzxrkfo4
In a Sentimental Mood,Sarah Vaughan,Chilled Jazz & Soul,Th2yruukvb2ucqhd2aephpni7fa
It Could Happen to You,Frank Sinatra,Lets Get Away from It All,Tkl4jqdwv3roj2bknjmb7a2ac3i
Just Friends,Frank Sinatra,"Just Frank Sinatra, Vol. 4",Tnsrl2ph33nt5lvujonucxq7uwm
Misty,Frank Sinatra,Simply Swinging the American Songbook - Frank and Tony,Tsa7k2izc4dvkgp4iwoqkzh5ype
My Funny Valentine,Frank Sinatra,Autumn in New York - 16 Romantic Songs Performed by the Voice,Twsvoz66bnlcrjip5ik4xm7pjha
Night and Day,Frank Sinatra,Autumn in New York - 16 Romantic Songs Performed by the Voice,Tzf372xbibx4xf2zmvy5qrsbzxm
Stella by Starlight,Frank Sinatra,"Legends of Swing, Vol. 15 (Original Classic Recordings)",Tlpxtfeihcwlpbytk6r6hhjnlpm
Till Then,Frank Sinatra,The Rat Pack Trilogy,T44ct425hngdwdzgz3rfkf3vo2q
Stardust,Frank Sinatra,Sun On My Skin,T2r5wns7qflrmnchsbpaqjvxnku
Let's Get Away from It All,Frank Sinatra,Swing When You're Singing,Tupxsuevmcmavgbi3ln3uxomf2i
Sweet Georgia Brown,"Nat King Cole, Oscar Moore, Johnny Miller","Voices of America: Men and Women in Jazz (The Greatest American Jazz Singers of All Time Sing the 88 Greatest American Songs of All Time - Ella Fitzerald, Frank Sinatra, Nat King Cole, Billie Holiday, Ray Charles and Many Others)",Ty7zujtbucasj4xuw4nm27t3pwe
"Take the ""a"" Train (Alternate Take)",Oscar Peterson,The Complete Cole Porter Songbook / Plays the Jerome Kern Songbook / Plays the Duke Ellington Songbook / a Jazz Portrait of Frank Sinatra,Tgs7icyzrvitwtfp55zv2tpgv5u
The Girl From Ipanema,Frank Sinatra,Ultimate Sinatra: The Centennial Collection,Tpignibi5znhib2ve3kaprwdige
There Is No Greater Love,Frank Sinatra,Frank Sinatra 100 Masterpieces,T2nplu2ur64chjsdfc42alwpubq
There Will Never Be Another You,Frank Sinatra,I Only Have Eyes for You,Tip2tzlwllt5bvz4efvxqtfthsm
What Is This Thing Called Love,Frank Sinatra,In The Wee Small Hours & Our Town,T7sj2nlcpux7zw5gq533carfyqa
Looking for Yesterday,Frank Sinatra,"Great Master, Vol. 9 (The Great Voice Collection)",T6pb3elagsvtjdhipjwux5bpbey
All Of Me,Lester Young,All Of Me,T3zkymwe6n7q7eq723544eyntxa
That's All,Lester Young,Things You Love With Jazz,T5qbzjm5a4jzufia6o5tziedlci
Alone Together,Oscar Peterson,"The Jazz Masters Collection: Lester Young, Vol. 19",Tfqnqdiwukbpgxuizhr3ugrgq4a
This Year's Kisses,Lester Young,Jump Lester Jump,T3ot54skb2rylchlucyuccmytii
Body And Soul,Lester Young,Lester's Mop Mop Blues,Tzg4ytrytnnty3p2cgt7sf2asqe
But Not for Me,Ketty Lester,"The Young Ones: Classic Hits of the 60s, Vol. 7",Tl3hl5b7syxb4fpdsvxokt2tkha
Cherokee (Parts 1& 2),Lester Young,Essential Masters,Ttxylwdmekiznl56gxhgc7kki4u
Embraceable You,Charlie Parker,Confirmation: The Best Of The Verve Years,Tmqlws62h2gpxainxctobcnqhza
Bugle Blues,Lester Young,"Amadeus, 1936-38 (HD Remastered)",Trpbngfketpfdnwvhzg5fwe6lgi
Neenah (Version 2),Lester Young,"Lester's Song Book, Vol. 4",T6esxlqmic7bfvsv3ewsxtns5du
How High the Moon,Lester Young,Lester's Song Book,Ta2cx7op5x2h64w3zlkhgc72esi
The Man I Love,Lester Young,Exactly Like You,Tdsoruixztopfq4bxylsvzss5wy
Something to Remember You By,Lester Young,Aladdin Recordings Vol. 2,Tukukhww66z4usgkww4gozgs724
I'll Remember April,Oscar Peterson,"The Jazz Masters Collection: Lester Young, Vol. 13",T7i6mefbfsv2zupkcqgqqyokwra
In A Mellow Tone,Ben Webster,"The Swing Tenors: Ben Webster, Coleman Hawkings & Lester Young vol.2",Tsrukhvh4j7l3fjp7ceq4f4diky
Polka Dots and Moonbeams,Lester Young Quartet,"Bar Jazz: In a Sentimental Mood, Vol. 2",T7y6fsuc677vr7g3562j35va7l4
It Could Happen To you,Lester Young,The Tenor Sax Masters,T5avcug6n65sx5ohkym5jdwoed4
Just Friends,Charlie Parker,"Bird (feat. Miles Davis, Dizzy Gillespie, Red Rodney, Thelonious Monk, Lester Young)",Ten4pa7deflzrp7fyvev7u3rmay
Misty,Lionel Hampton,"Golden Memory: Lester Lanin, Lester Young, Lionel Hampton",Two3tsy7jcto5f5avt7c6lsq7eq
Night And Day,Billy Holiday & Lester Young,Georgia On My Mind,Tfhlxxellbnhpcun2kbabmojyna
Stella by Starlight,Jimmy Raney,"Jump, Lester, Young",T3nagcjur4tpf6e2dbczblfvgcq
It's Sad But True,Lester Young,Lester's Dream,Tfrlqjufrzd2pqa2neejm2iv2gy
East Of The Sun (West Of The Moon),Lester Young,Lester's Be-Bop Boogie Vol 3,Twqyar5pde6qh32oawae7inc26m
Sweet Georgia Brown,Lester Young,"Lester's Song Book, Vol. 4",Txvpgegkg4yzmq7qymsymwodygm
"Take The ""A"" Train",Oscar Peterson,"The Jazz Masters Collection: Lester Young, Vol. 17",Tvlx66teajmocxp6tf47lote67m
There Will Never Be Another You,Lester Young,Lester's Be-Bop Boogie Vol 4,T7mbdadxrsqfzwishkpm2hli3fi
What Is This Thing Called Love?,Oscar Peterson,"The Jazz Masters Collection: Lester Young, Vol. 15",Twh2zkaq642o23oghga7vht6rcu
I Got Rhythm,Lester Young,Yesterday's Hits Vol 4,Tttb4dafmcvh5zgnwiasvkyip64
