Love's In Need Of Love Today,Stevie Wonder,Songs In The Key Of Life,Tlvfi6igovrzrqlrftoe2qzsmye
Isn't She Lovely,Stevie Wonder,Songs In The Key Of Life,Tjufou22egslvobpftv66kilu7y
Knocks Me Off My Feet,Stevie Wonder,Songs In The Key Of Life,Txoks3ki3knz262hwmautdzxbda
Summer Soft,Stevie Wonder,Songs In The Key Of Life,Tfo3vaemt26m4qgyjldxerbbinu
Ngiculela-Es Una Historia-I Am Singing,Stevie Wonder,Songs In The Key Of Life,T27cz7jdvbwcp6tar73zstvfvxq
Easy Goin' Evening (My Mama's Call),Stevie Wonder,Songs In The Key Of Life,T6u43sx2v53uzyramtgelcvlc7m
Ebony Eyes,Stevie Wonder,Songs In The Key Of Life,Tnlmd7dqm53ft5vdii7ne4jiyjq
Don't You Worry 'Bout A Thing,Stevie Wonder,Innervisions,Thle2kbkunwet3ckxiem6to3koy
Golden Lady,Stevie Wonder,Innervisions,Tlc7pq754gr2t7lhvph2lepekqy
He's Misstra Know-It-All,Stevie Wonder,Innervisions,Tdy2oknagjfgu5equibidjs47si
Blowin' In The Wind (Single Version),Stevie Wonder,Number Ones,T3h7hw46sz7cx5jkkn7zhq5qtgy
You Are The Sunshine Of My Life,Stevie Wonder,Number Ones,Tr5owaifh4z4veuojlwxbui4jnm
Ebony And Ivory (Remixed 2015),Paul McCartney,Tug Of War (Deluxe Edition),Tqmvtjklqkq2yoar6fcj3ieafl4
So What The Fuss,Stevie Wonder,Number Ones,T74dnlrk4nnwgcarhl3xudk2p2i
My Cherie Amour,Stevie Wonder,My Cherie Amour,Tsy6zp7dfikcezhyiblvwvl646q
Part-Time Lover,Stevie Wonder,In Square Circle,Top5ljmkshzoq4wg7ry3elrne34
I've Got You,Stevie Wonder,My Cherie Amour,T23uhwzehykqsezielf6vsmjzxq
Ordinary Pain,Stevie Wonder,Songs In The Key Of Life,Tye2bogvv2nznr3bggv7lhhm4wu
