"Happy (From ""Despicable Me 2"")",Pharrell Williams,G I R L,Tj7ujtq7hqfqvo4fwuppfj7wt5y
Mercy Mercy Me (The Ecology),The Strokes,You Only Live Once/Mercy Mercy Me,Tcni4dqwlkpssyuewwozfexh7ge
I Will Survive,Cake,Fashion Nugget,Te5cpo2sdret6ou47ziwhju5u6y
All Along the Watchtower,The Jimi Hendrix Experience,Electric Ladyland,Tixcfaeouvevc5q4ve6o2m5tziy
Let's Groove,"Earth, Wind & Fire",Raise!,Tlliukj2zdrlm27sls5o5a3qlm4
Got to Be Real (Single Version),Cheryl Lynn,The Best Of Cheryl Lynn: Got To Be Real,Ttmomd6nwpu2lalchgrks3gkc6u
Celebration,Kool & The Gang,Celebrate!,Tbvo4ausgwmmobgipxu7axxjem4
Who Am I (What's My Name)?,Snoop Dogg,Doggystyle,Twvfspkve33vvdqen5ofvhkjzb4
Let's Stay Together,Al Green,Let's Stay Together,Tqoqj75a6pg6cfp7bmtwiostl2q
You Are The Sunshine Of My Life,Stevie Wonder,Talking Book,Tvmloc4cn3jxqtl4oia5wto2omq
Rock with You (Single Version),Michael Jackson,Off the Wall,Tdb6wyj4p44umpuxuddjy63qetu
Love Never Felt So Good,Michael Jackson,XSCAPE,Tpxi74nni3lb6jf5ymvy6ndlok4
What's Going On,Marvin Gaye,What's Going On (40th Anniversary),Tn3js66ju2stp62qjbzffpxzwxy
I Want You (Single Version),Marvin Gaye,I Want You,Tb3suhmrqxcw4r47eq5vyiigu7u
Fresh Feeling,Eels,Souljacker,Tgzkmhnb24w774if4bkqh3nyhwy
Don't Stop Believin',Journey,The Essential Journey,Tgmu7frgday3jwrkj5hl7h5dkdi
See You When I Git There,Lou Rawls,The Essential Lou Rawls,Tvcc4v44lbmka2ljdcarcqvwc2i
All About That Bass,Meghan Trainor,All About That Bass,T3s4wi7m3eakrpzc2cakbojnea4
History Repeating (feat. Miss Shirley Bassey),Propellerheads,The Greatest Hits: This Is My Life,Ta5k2nuchfeay2ha2vi2an26syu
Daft Punk Is Playing at My House,LCD Soundsystem,LCD Soundsystem,T4cgv7u3oo2fpzpcxqr77w5b6wq
Rolam As Pedras,Kiko Zambianchi,Retratos,Tyry5xmfyjmmobnr7tbye6teife
Os outros (Remix),Kid Abelha,Educação Sentimental,Tsc6lwiwnf2xoeoldvnfbethujm
Romance Ideal,Os Paralamas Do Sucesso,O Passo Do Lui,Tr6d6ofxlxsrpqqrznn3n7762pq
Infinita Highway,Engenheiros Do Hawaii,A Revolta Dos Dandis,Tlh4l2mxxiwjuyumnd7gsybb5ea
Quando O Sol Bater Na Janela Do Teu Quarto,Legião Urbana,As Quatro Estações,Tvowxy4gmamsdz3gipulurumqyu
Lágrimas de Crocodilo,João Penca E Seus Miquinhos Amestrados,Hot 20 - João Penca e Seus Miquinhos Amestrados,Tudn74pkmrllp6loc6knkyrfhxq
As Sete Vampiras,Leo Jaime,Sessão da Tarde,Tryvcf36zwylqs4dcifjtqp37te
A Vida Tem Dessas Coisas,Ira!,Isso É Amor,Tjdqblw4a2qe5dnhwzfp6ukrhay
A Fórmula do Amor (Remasterizado) (feat. Kid Abelha e os Abóboras Selvagens),Leo Jaime,Nada Mudou (Box) [Remasterizado],Tq4mqt5ak5rjm432435uv2uuxai
Tolices,Ira!,Ira! 30 anos,T7qypdz56uyjm3ygdkquflbghna
Tarde Vazia (Versão Acústica) (feat. Samuel Rosa),Ira!,Acústico Ira!,T2vpbmavhwm7trefsowyodkungq
Tudo Pode Mudar,Metrô,Olhar,T6kme5cdxim7ixm22dbnjq6xova
Sentado À Beira do Caminho,Ira!,Isso É Amor,Tsbeino6bjm3jqt4vvwpzlzs2qi
Uma Barata Chamada Kafka,Inimigos Do Rei,Inimigos Do Rei,Tc3cmpt3fve6vqlwscbnrjqfqui
Sonífera ilha,Titãs,Volume 02,T6hnjcfmrxg7koajyfcsef7eytq
Pra Sonhar,Marcelo Jeneci,Feito Pra Acabar,Twsrqsvtuce4dp5t2ahs454uea4
Vou Deixar,Skank,#1 Hits,T73enxmqpzishibyprprv7dr544
Resposta (Album Version),Skank,#1 Hits,Te52vsp6pmzmyhxmsvw7w7fplwe
Balada do Amor Inabalável,Skank,#1 Hits,T6lktlrrj3zyy57z6xr6tcvhxua
Tanto (I Want You),Skank,#1 Hits,Tf7y7snh4atjeqckfxv33fmbism
Onde Você Mora? (Acústico),Cidade Negra,Hits,Tppkb7dqrqeccsbe3r6pgsgfldq
A Estrada,Cidade Negra,Hits,Td6vgbmh47kmohoqpa3ofyc7qpq
Firmamento (Wrong Girl To Play With),Cidade Negra,Hits,Tcyr6tsx3ks37hs25tzmzc5ewei
Te Ver,Skank,#1 Hits,Ti3binvjrdjze7bty53sanhxtpm
Tão Seu,Skank,#1 Hits,Tu2qhgro3ax3egezd7aloqgw3py
A Sombra da Maldade,Cidade Negra,Hits,Tjtoilnpi7chzm6hqhga6arv26y
Sábado a Noite (feat. Lulu Santos),Cidade Negra,Hits,T65be2dn4zijuh6qxar7ichs4xy
O Amor Não Sabe Esperar (feat. Marisa Monte),Os Paralamas Do Sucesso,A Arte De Os Paralamas Do Sucesso,T645wkzgv3ugikriswzazy4fkiq
Um Anjo do Céu,Maskavo,Já,T27pjcza35qllrkvdg7qabhr5ge
Tempestade,Maskavo Roots,"Se Não Guenta, Por Que Veio?",Tuomo3t63rwkgjceyacjmyor7wi
Quero Ser Feliz Também (Ao Vivo),Natiruts,Natiruts Acústico no Rio de Janeiro,T2lxxavi7humqnnvarm6n5cd4ya
Andei Só (Ao Vivo),Natiruts,Natiruts Acústico no Rio de Janeiro,Tw4cbhspblbkp265ow4dd4twpnm
Você Me Encantou Demais (Ao Vivo),Natiruts,Play: Namorados,Tunew64hcsy6o3ufumv2454qubq
Meu Abrigo,Melim,Melim,Tueoxwrnyybe7giwxoimt3v436u
Marvin,Titãs,Go Back,Tdo7o3weux4n2vyoridy34m6dce
Go Back,Titãs,Go Back,Tmqvmayrmwwrpjv2tkoxozqyzza
Não vou me adaptar,Titãs,Go Back,Ti3yq5zjv62ttq3tq5c3e4oakqu
Comida,Titãs,Jesus Não Tem Dentes No País Dos Banguelas,Tllcwnrmsws7kaoqoiugywxuyna
Família,Titãs,Cabeça Dinossauro,Tj6i4ckmcxprp7htmnvfvejb6ya
Vital E Sua Moto,Os Paralamas Do Sucesso,Cinema Mudo,T66eyltvl3g4v5skcj4jpukz4pi
Cinema Mudo,Os Paralamas Do Sucesso,Cinema Mudo,Tb7mat5hol3ujjjnl32dpexuafe
Fui Eu,Os Paralamas Do Sucesso,O Passo Do Lui (Remastered),Tb4sh5fz57ecghxa2jyvsjnuheu
Romance Ideal,Os Paralamas Do Sucesso,O Passo Do Lui (Remastered),Tpqo5oc7astuohmhbbx4apuvu2y
A Novidade,Os Paralamas Do Sucesso,Selvagem? (Remastered),T5osgj3gbdvaf23kkvh2r6xrisq
Melô Do Marinheiro,Os Paralamas Do Sucesso,Selvagem? (Remastered),Tcn4iq5c47x5zcjestjai43v7eq
Você,Os Paralamas Do Sucesso,Selvagem? (Remastered),Tgwcczqmy5fxyoh2zeyteqpweki
La Bella Luna,Os Paralamas Do Sucesso,Nove Luas,Tvn2crbn3x2afffrnlnlvpytfhi
Ela Disse Adeus,Os Paralamas Do Sucesso,Hey Na Na (Remastered),Tld77z7vk4y7taia5f2qpwh3me4
Uma Brasileira,Os Paralamas Do Sucesso,Vamo Batê Lata - Paralamas Ao Vivo (Live),Tdjbv6mvfgb4z3g5xkhbadm5mla
Vamos Fugir,Gilberto Gil,Raça Humana,Tws3wjzpiy2uwrevwztmn43lvqm
Presente De Um Beija-Flor,Natiruts,Cafe Octavio - Nova Brasil FM,Tupxu34ot7qcxye7dkiwrocg4dy
"Sorri, Sou Rei (feat. Claudia Leitte)",Natiruts,Raçaman,Tv543famwnwewsmcpoqzefcmpbq
Do Lado de Cá,Chimarruts,Só Pra Brilhar,Tcgboa77pqghbbwvqr7xi5xxdwa
Xote Dos Milagres,Falamansa,Falamansa Essencial,T4roiowuk6dkxsoro2aku4hr2ei
Xote da Alegria,Falamansa,Essa É Pra Vocês,Tczavuohtfkigx4fitvff7vw74i
Esperando na Janela,Gilberto Gil,"As Canções de Eu, Tu, Eles",Tmo7guo4bhbos7i7wf2pu6nojre
Qui Nem Jiló,Falamansa,As Sanfonas do Rei: Tributo aos 100 Anos de Luiz Gonzaga,Tcdc6zmhw42zfh773g2m25y4scy
Nosso Xote,Bicho De Pé,Planeta Forró,Tzcy5x7syt6x5pdsw5aclfq3n6i
Colo de Menina,Rastapé,Fale Comigo,Tvfk4jpf2vfkoyndxrqigwb3kga
Volta Pra Mim,Cacau Com Leite,"O Melhor do Forró Universitário, Vol 1",Thmjeqe46dyihv2vwtlrjyrjtme
Brigas,Bicho de Pé,A Vida Vai,Trsmzzmftkhvt274hyh2a55jgfa
Que Nem Jiló,Lucy Alves,The Voice Brasil (2ª Temporada),Tqunizfwx2c6nahcyhhbjcbyde4
Eu Só Quero Um Xodó,Bicho de Pé,A Vida Vai,T7bgwb5b6yrj3sgxikt6obbki4y
No Meu Pé de Serra/Só Xote/O Xote das Meninas,Bicho de Pé,Olhando Pra Lua (Tributo a Luiz Gonzaga),Tcm2t74nsra56apxb3exml2idri
Estrada De Canindé/A Letra I,Bicho de Pé,Olhando Pra Lua (Tributo a Luiz Gonzaga),Tklzko4p7uqxpmwywhrc7ha5cya
Rindo a Toa,Falamansa,Fundamental - Falamansa,Tqr6nrbdny2tlz7kd3gbzhpxcy4
Oh! Chuva,Falamansa,Fundamental - Falamansa,Tmrzdhwzqb37a7gnunhrz7qhfoe
Avisa,Falamansa,Fundamental - Falamansa,Tyvfo44bqfgfoa5tcsfvapgxzoe
Um Anjo do Céu,Rastapé,O Melhor do Rastapé,Tvn3bycwmaiqjrqgbsjizn7upju
"Que seja (feat. Dominguinhos, Caju & Castanha, Caju, Castanha, Miltinho Edilberto & Paulo César Pereio)",Bicho de Pé,Que seja,Tvbt2pc4ebdev3ymxrhty6bg4da
Versos Sinceros,Rastapé,Planeta Forró,Tri6rcsp447ztfm4weahil5rooa
Ponta de Lápis,Eliezer Setton,Ventos do Nordeste,Te7ikydopsviusti3xlllpfem4u
Sebastiana,Nation Beat,Growing Stone,Tf4te7r5fty3dieufl65wpbd2iy
Eu Só Quero um Xodó,Dominguinhos,Nas Costas Do Brasil,Tmgig6gbsdjbxpgm2fmomqvytje
O Mundo É Osso,Zaira,Antenas e Raízes,Txkc7yiddw5obioyo33tcvfcizm
Baião,Bicho de Pé,Olhando Pra Lua (Tributo a Luiz Gonzaga),Tfwsmqpzwq5etwzrtyorbyrsady
Qui Nem Jiló (feat. Baião de Quatro),Rastapé,Fundamental - Rastapé,Toihd2mifpkevs72oh62u5fos3a
Eu Só Quero um Xodó / É Proibido Cochilar / Vem Morena (feat. Baião de Quatro),Rastapé,Fundamental - Rastapé,Tikjcjdz777oxndy5ukr57ovwei
Pau de Arara,Bicho de Pé,Olhando Pra Lua (Tributo a Luiz Gonzaga),Tfkv4kt26ypunb4ghdfsrzspdyq
Braia Dengosa/17 Légua e Meia,Bicho de Pé,Olhando Pra Lua (Tributo a Luiz Gonzaga),Trgro654sh2q6uinj7gbholdma4
Glorious,Adam Friedman,Rock Dog (Original Motion Picture Soundtrack),Tjqhl6yf6bj3gfs6nu6vlhgus5a
Get Stupid,Aston Merrygold,Get Stupid,Tzcvb54t4bzupxa45hibzdn25zi
Gangnam Style,Psy,Gangnam Style,Tgmrl6gfrlrvta4jriy4qsm5jue
"Amor I Love You / Citação: Trecho Da Obra Intitulada ""Primo Basilio"" De Eça De Queiroz Declamado Por Arnaldo Antunes",Marisa Monte,"Memórias, Crônicas e Declarações de Amor",Tcmht7t3dx2ogaxfrwh4dvkxkwu
Mr. E's Beautiful Blues,Eels,Meet The EELS: Essential EELS 1996-2006 Vol. 1,Tajsa4dpyw5augkd7rn5qff7xyq
Rebana Ba Leshotho,Aura Msimang,Itshe,Trjfui2rwe2qdfkqj245ypbgzmy
"Axel F (From ""Beverly Hills Cop"" Soundtrack)",Harold Faltermeyer,Beverly Hills Cop (Music From The Motion Picture Soundtrack),Tsdqgv6wdfzngaemkqynkcvjed4
Jailhouse Rock,Elvis Presley,Jailhouse Rock,Tcd7gewrded6tbao7kvtqyyo7zy
Sonífera ilha,Titãs,Titãs,Tp22znpls3kyc3zzf65xag55uxe
