I Shot The Sheriff,Eric Clapton,461 Ocean Blvd. (Deluxe Edition),Tw6dqry4cbmzjti73uhv4m7atfe
Waiting In Vain,Bob Marley & The Wailers,Exodus,Tiemwvxpwzymib2vfjy6eeaoub4
D'yer Mak'er (2007 Remaster),Led Zeppelin,Mothership (Remastered),T2j3cn2ggy33k2hd5cija2mvqtu
Houses of the Holy (1990 Remaster),Led Zeppelin,Physical Graffiti,Tikmldonsrkoi5bu7cuywir4mkm
(You Gotta Walk) Don't Look Back [2002 Remaster],Peter Tosh,Bush Doctor,Tixvdtvt7ntohhfr3l2ixppngyi
Reggae Night,Jimmy Cliff,The Power And The Glory,Tn4ylgtwcvs7o6orxbrrwl7c4z4
We All Are One,Jimmy Cliff,We All Are One: The Best Of Jimmy Cliff,Tiyheew6w7zw2eq2z3llpnqud3a
Revolution Rock,The Clash,London Calling,Tjx5nvq73qofnl2wy2gnortgudi
Police & Thieves,Junior Murvin,Police & Thieves (Expanded Edition),Toptxk56tr7rbckrkugjamawpca
Could You Be Loved,Bob Marley & The Wailers,Uprising,Tpvulvpmzmbi3aaxdpuzm66qzcm
You're Wondering Now (Kid Jensen Session),The Specials,More Specials (Deluxe Version),Tbqae6xe64qmn264r3iewayu3ii
Is This Love,Bob Marley & The Wailers,Kaya (Deluxe Edition),Tfzpau6cleibrzl7vb6yixlhwe4
Bring Me Some Water,Melissa Etheridge,Melissa Etheridge,Tqpiph3ilhvsboaaihq65cuybrq
Dixieland Delight (Single Edit),Alabama,The Essential Alabama,Tjdycbhjn6iem35x3qipbx3f6oa
You Made It Right,The Ozark Mountain Daredevils,It'll Shine When It Shines,Tarxagznbyzcfrbr4efuvlptkra
Honky Tonk Moon,Randy Travis,On The Other Hand - All The Number Ones,Ttvkmlda3pefmojtquhlmihpcea
King Of The Road (Re-Recorded In Stereo),Roger Miller,Best Of Roger Miller,Twr6mfj3w3icyma2rngo2skcbhe
Have You Ever Seen The Rain,Creedence Clearwater Revival,Pendulum (40th Anniversary Edition),Tlc6t4c65zrj6edt7aruitabvva
Long Black Veil,Johnny Cash,Unearthed,Trg6ktsgkxwnz3vdw7hx3cuepqa
Man! I Feel Like A Woman!,Shania Twain,Come On Over,Trs2wp6wgt3l4l63u4qzp2ik72q
9 to 5,Dolly Parton,9 To 5 And Odd Jobs,Tbok5h2qfuylcfp2d2fn4a5ngbi
Country Boy,Alan Jackson,Good Time,Tggk4vsusnk7wy7xyyuzi7s2qmq
Long Black Veil,Johnny Rivers,That´s Rock and Roll,Teg3mnbiors3bvbriewolsucf44
It's a Heartache,Bonnie Tyler,Wings,Tf4f6tvmwpbxhmcskphkh5qjhdm
Kodachrome,Paul Simon,The Essential Paul Simon,Typmz3ad7eh43socxjrtihewmfu
Breaking All The Rules,Peter Frampton,Breaking All The Rules,Tc36aaavkgecyngtrkw4goqpasm
Don't Stop Believin',Journey,The Essential Journey,Tgmu7frgday3jwrkj5hl7h5dkdi
Love Will Find A Way,Yes,Big Generator,Txdhjon6cdm57n6pbqqvmtmf5wq
Only Time Will Tell,Asia,The Definitive Collection,Tjvijzd2cbojjheerglj4re5hhq
Iron Eagle (Never Say Die),King Kobra,Thrill Of A Lifetime,Tsysprhfsz5uwrnylhpsjqqcf2i
Burning Heart,Survivor,Rocky IV,Tulfvongvqtw6kwhajbub3q5sti
Separate Ways (Worlds Apart),Journey,Frontiers (Deluxe),Tdvgmqi6drq4ygdyx27bg6x67aa
It's Raining Men,The Weather Girls,Success,Tnwahmitfluqu24zlq7bil6yxca
Eye of the Tiger,Survivor,Rocky IV,Tglv3qe5zmpfujmhhmn6upuugna
Pain Lies On The Riverside,Live,Mental Jewelry,Tpxh64h7tqqxuj3yurtfd2grsoe
Love Ain't No Stranger,Whitesnake,Slide It In,Tlel6bp3m7zh2zqfxbg4kca6qbq
Start Me Up,The Rolling Stones,Tattoo You,Tgyekwg6b4dqwk3xcizsmzwycxi
(I Can't Get No) Satisfaction (Mono Version),The Rolling Stones,Out Of Our Heads,Tbdqayw4owahkbebc4shcnt7peu
Under My Thumb,The Rolling Stones,Aftermath (Remastered),Togihrjr6fu5725pc4z7mjssovi
Let's Spend The Night Together,The Rolling Stones,Between The Buttons (Remastered),Tmm3wbvbufxhgyahefykvfv4hja
Sympathy For The Devil,The Rolling Stones,Beggars Banquet,T6skkbvlhhlrxcsk6p5otkauqmm
Honky Tonk Women (Mono Version),The Rolling Stones,"Through The Past, Darkly (Big Hits Vol. 2)",T7xsd57sbd62z46qnqhe4xuvhxi
Gimme Shelter,The Rolling Stones,Let It Bleed,T4we6576rcqgaysm7xvobgvwcim
Brown Sugar,The Rolling Stones,Sticky Fingers,Tcfnz4omdrv7lnzr4go3go4zrku
"Paint It, Black",The Rolling Stones,Singles Collection (The London Years),Tvqry472q47q2uzz2gn2dovlwey
Susie Q,The Rolling Stones,12 X 5,Tviw2zltlqnbv62jjjqcbpmqx5y
Route 66,The Rolling Stones,The Rolling Stones (UK),T6aheueohg42cyh6yjpov2r3y6y
Rocks Off,The Rolling Stones,Exile On Main St.,Tromlxprmtyrpbr7qlscntsnpt4
It's Only Rock'n'Roll (But I Like It) (Remastered 2009),The Rolling Stones,It's Only Rock 'N' Roll (2009 Re-Mastered),T6kxcfwszvy77sdzzrkl3wtv4fy
Anybody Seen My Baby? (Remastered),The Rolling Stones,Bridges To Babylon (2009 Re-Mastered),Tskns554hqxajgypi7ae3zlo3iy
Around And Around,The Rolling Stones,12 X 5,Tyrngm3sdyoew6lkgix7ncdhhwq
Can't You Hear Me Knocking (Remastered),The Rolling Stones,Sticky Fingers,Tqq7tclandgy42hahnpjy6ryysa
All Along the Watchtower,The Jimi Hendrix Experience,Electric Ladyland,Tixcfaeouvevc5q4ve6o2m5tziy
Little Wing,The Jimi Hendrix Experience,Axis: Bold As Love,Tnwo72r22msxskoz2qe22flykey
Purple Haze,The Jimi Hendrix Experience,Are You Experienced,Ti3qalb77m5fmt7uycrksrkqrri
Hey Joe,The Jimi Hendrix Experience,Are You Experienced,Tybvzucha7ffgm6uzq75kyscqde
The Wind Cries Mary,The Jimi Hendrix Experience,Are You Experienced,Tla7qcm7vnn2wwcyb6k7qpmg7zi
Crosstown Traffic,The Jimi Hendrix Experience,Electric Ladyland,Tvbxu7gujdbyyywuaivjocqveom
Love Or Confusion,The Jimi Hendrix Experience,Are You Experienced,Tpzczrbhpthfskvdur7fslc5fhe
May This Be Love,The Jimi Hendrix Experience,Are You Experienced,Tcz5n5txeilqaudcyjrxj7ltqau
Fire,The Jimi Hendrix Experience,Are You Experienced,Tq7c3yubf7kpd6uggz2stth5xce
Third Stone From The Sun,The Jimi Hendrix Experience,Are You Experienced,Td3meyrhqghy6ozyvupx7hbz5ea
Roxanne (Remastered 2003),The Police,Outlandos D'Amour (Remastered),T324pmf5jf72lhwjwylxbwboyf4
So Lonely (Remastered 2003),The Police,Outlandos D'Amour (Remastered),T2djtuushcj4ydq4erzrt46fznu
