(Sittin' On) the Dock of the Bay,Otis Redding,The Dock of he Bay,T34zf6e7rumz5egh6shv52txteu
Let's Stay Together,Al Green,Let's Stay Together,Tqoqj75a6pg6cfp7bmtwiostl2q
My Girl,The Temptations,The Temptations Sing Smokey,Tcncnvqfropqfaksjlgbi647jry
If You Want Me to Stay,Sly & The Family Stone,Fresh,Tjdnsjda5p2ahhbdgownqocxrke
Cry to Me,Solomon Burke,The Very Best Of Solomon Burke,Txapjnks7xzkzdvs235eywn4tim
Be My Baby,The Ronettes,Be My Baby (The Very Best Of The Ronettes),Tj3rafaxio3mlgtb7x4ynuo2lmq
Stand by Me,Ben E. King,Top 100 Greatest Hits 1955-1962,Tfuita6xuk6mmrucr3ag4ken3nu
Baby It's You,The Shirelles,Baby It's You,T6bfuxev4n6mdibcbvgpghto32i
Bring It On Home to Me (Remastered),Sam Cooke,The Best of Sam Cooke,Tli6ekh3fxlb4t3uvepliy2ggru
You Send Me (Remastered 2015),Sam Cooke,Songs by Sam Cooke (Remastered 2015),Tuui6obc4r3z2lxfqqzkra7x2ae
Wonderful World,Sam Cooke,Tribute to a Lady (Original Album Plus Bonus Tracks),Th5qewalxs4qbmfep4brog4mwmu
You Can't Hurry Love,The Supremes,The Supremes A' Go-Go (Expanded Edition),T6i725z4zy4q67jmkeakshywwcm
Chinese Checkers (Single Version),Booker T. & The MG's,The Very Best Of Booker T. & The MG's,Ttuz3kimgcagnkqnklc2ot72keu
I Can't Wait Until I See My Baby's Face (Remastered),Aretha Franklin,Runnin' Out Of Fools,Tdcqkudkl75put4j7kpg42boioe
Just My Imagination (Running Away With Me),The Temptations,Sky's The Limit,Tzboz3d4fz646mpqx2sff24c2ka
Under the Boardwalk,The Drifters,Under The Boardwalk,T5cx5djucbctwtgpx5nson4345e
White Christmas,The Drifters,White Christmas / The Bells Of St. Mary's [Digital 45],Tcx3uei4xon5i7mbufdikwpp454
Will You Still Love Me Tomorrow (Remastered),The Shirelles,Dancing with the 60's (100 Classic Hits Remastered),Trz5mibl6yshixhxrggudnz7s7i
"A Heart In New York (Live at Central Park, New York, NY - September 19, 1981)",Simon & Garfunkel,The Concert in Central Park (Live),Th66td4x7xga36xjegzr6qxvhmi
All Along the Watchtower,The Jimi Hendrix Experience,Electric Ladyland,Tixcfaeouvevc5q4ve6o2m5tziy
It's Too Late,Carole King,Tapestry,Txey5rq3uq2b22qyo4xs32bt7eq
Punky's Dilemma,Simon & Garfunkel,Bookends,T4h2gf7xz36lpl262joxtlwkxim
Kodachrome,Paul Simon,The Essential Paul Simon,Typmz3ad7eh43socxjrtihewmfu
(I Can't Get No) Satisfaction (Mono Version),The Rolling Stones,Out Of Our Heads,Tbdqayw4owahkbebc4shcnt7peu
Winterlong (2017 Remaster),Neil Young,Decade,Tmtrkvpafde6467mrk3ahxylcfa
To Sir With Love (2002 Remastered Version),Lulu,Most Of Lulu / Lulu's Album,Thagah7iftego56meyj2ebwj3te
Alone Again (2008 Remaster),UFO,Lights Out (2008 Remaster),Tmhi7cfsrxnxnu43grsody6nk24
Show Me The Way,Peter Frampton,Frampton,Tcqb7al3rjqtfhsgajghlyo4deq
In My Life,Johnny Cash,American IV: The Man Comes Around,Tilo2ryakgofm5aimqu2zrsurpe
Spooky,Dusty Springfield,"Music From The Motion Picture Lock, Stock And Two Smoking Barrels",Tv2ryqyrmajpkioxfvdyoru3dey
King Of The Whole Wide World,Elvis Presley,Kid Galahad/Girls! Girls! Girls! - Elvis Presley,Tsp3x5fib47qbiiqjg2adm6jpx4
Suzie Q,Creedence Clearwater Revival,Creedence Clearwater Revival (40th Anniversary Edition),Tsbtli3s3kwhizmowwl2ppdqr6i
Rebel Yell,Billy Idol,Rebel Yell,Trnssvj65owys4khavnlffjgl5y
The Killing Moon,Echo And The Bunnymen,Ocean Rain,Tvd4d5fcivglloeh5r6yd3iysry
Here's Where the Story Ends,The Sundays,"Reading, Writing & Arithmetic",Tmgkxezjgwninp7qc7j7ya4ehcm
It's The End Of The World As We Know It (And I Feel Fine),R.E.M.,Document,T3dqq73gdjeq6zgbwijv4jugy2q
"Shellshock (7"" Edit) [2015 Remaster]",New Order,Singles (Remastered),Tcbkv2yii6xbgyp4uq3p5ebsm3i
Overkill,Men At Work,The Best Of Men At Work: Contraband,T6hre367ooqioctvixu5skscqou
Who Can It Be Now?,Men At Work,The Best Of Men At Work: Contraband,Truhxood62i3asc72d3oqdb4k74
Love For Sale (2005 Remastered Version),Talking Heads,True Stories,Trhnkk6vzlnupqp5qagpz7zeclm
Psycho Killer (2005 Remastered Version ),Talking Heads,Talking Heads 77 (Deluxe Version),Ts7akzewwzgr4gljolfj2dr4epu
Beds Are Burning (Remastered),Midnight Oil,20000 Watt RSL - The Midnight Oil Collection,Txog3qbyebpie3xf4pazl32spzq
Wild Wild Life (2005 Remastered Version),Talking Heads,True Stories,Tfgxw66dh4tokjcpjpvdyg2rwbu
Never Let Me Down Again,Depeche Mode,Music for the Masses (Deluxe),Tin5ljdsyj73oagkzpivfl6vyxi
Billie Jean,Michael Jackson,Thriller,Tk6ur4xurdj52rye63dqoi3cvmm
9 to 5,Dolly Parton,9 To 5 And Odd Jobs,Tbok5h2qfuylcfp2d2fn4a5ngbi
True (Single Edit),Spandau Ballet,Gold - The Best Of Spandau Ballet,Tej56lo6xuw33wai6twec4ukryy
Don't Stop Believin',Journey,The Essential Journey,Tgmu7frgday3jwrkj5hl7h5dkdi
Born to Run,Bruce Springsteen,Born To Run,Tnlwgpr4rl62zblmhhowiep653a
"If You Leave (From ""Pretty In Pink"")",Orchestral Manoeuvres In The Dark,If You Leave,Tyyzb6aufdoaxm2lr7esqvecvsi
Damaged Goods,Gang Of Four,Entertainment!,Tel7cv46dmigcigbuv3yxtt6one
I Found That Essence Rare,Gang Of Four,Entertainment!,Tvtmbotoqmo4zqkys5qjchuqhva
Eye in the Sky (Remastered),The Alan Parsons Project,Platinum & Gold Collection,T3am662s32nsllnejoxxvpgtlum
"Valerie (Live At BBC Radio 1 Live Lounge, London / 2007)",Amy Winehouse,Back To Black (Deluxe Edition),Tipvotjvlipp75kgs4ov4tzs54m
Rebana Ba Leshotho,Aura Msimang,Itshe,Trjfui2rwe2qdfkqj245ypbgzmy
Revolution (Remastered 2009),The Beatles,The Beatles 1967 - 1970 (Remastered),Tbl5wh5pssvwdalewfs2oxki7km
Day Tripper (Remastered 2015),The Beatles,1 (Remastered),Tny6ut56gsgh6gpjvbtb557rqba
Happiness Is A Warm Gun (Remastered 2009),The Beatles,The Beatles (Remastered),To2k3l3t74tn7glzgvad3oudg5u
Just Got Back From Baby's,ZZ Top,ZZ Top's First Album,Tsdpcuv44mbvsxw4ed6ag3kzhpm
What's Going On,Marvin Gaye,What's Going On (40th Anniversary),Tn3js66ju2stp62qjbzffpxzwxy
See You When I Git There,Lou Rawls,The Essential Lou Rawls,Tvcc4v44lbmka2ljdcarcqvwc2i
You'll Never Find Another Love Like Mine,Lou Rawls,All Things In Time,T4q3l6rawvlwcxxtqbu2zu3w5vq
Fresh Feeling,Eels,Souljacker,Tgzkmhnb24w774if4bkqh3nyhwy
The Man Who Sold The World (2015 Remastered Version),David Bowie,The Man Who Sold The World (2015 Remastered Version),Tqslzucz4xg2ptmdzghrliuzm6a
Changes (2015 Remaster),David Bowie,Hunky Dory (2015 Remastered Version),Tp6dzcajqvhglox5x7f77jfcuiq
Wenn ich ein Junge wär,Rita Pavone,Die besten deutschen Teenager-Hits der 50er und 60er,T73wl37y6mwkyfw7oq2r7l6e3e4
Compared to What,Roberta Flack,Girls Run The World,Trvvigpztv4d2xsusnrrpoo334e
My Cherie Amour,Stevie Wonder,My Cherie Amour,Tsy6zp7dfikcezhyiblvwvl646q
Female of the Species,Space,Spiders,Tq3tselqovwv6yekf3wlmx7yihi
Fly Me To The Moon (In Other Words),Frank Sinatra,Sinatra/Basie: The Complete Reprise Studio Recordings,Tkittjmae6svlw6gz7tsw53npuq
Honky Tonk Women (Mono Version),The Rolling Stones,"Through The Past, Darkly (Big Hits Vol. 2)",T7xsd57sbd62z46qnqhe4xuvhxi
Sun Goddess (feat. Ramsey Lewis),"Earth, Wind & Fire",Pure... Disco/Funk,T7as6hd53pjmamvwxuiypc34knu
Limbe,S-tone Inc,Sobrenatural,Tc3n2lu4ful75g7qsxgngmdm7tq
Seven Nation Army (Remasterisée),Ben L'Oncle Soul,Ben L'Oncle Soul,T3jakzuh22jgzgrc4usjjgyu47u
Paid In Full (Seven Minutes Of Madness - The Coldcut Remix),Eric B. & Rakim,Brown Sugar,T7izoqzjz2xqvvaglvats6a55gi
Nalingiyo,Manou Gallo,Lowlin,Tuaywk24odybrtrkwdaahtpgaiq
Brimful of Asha,Cornershop,When I Was Born For The 7th Time,T5377phtpr7t2q3sdwtpas5b2nm
In The City,The Jam,In The City,Tzxqe3wjq3hdsqjlwo4qu6it3ni
Falso milagre do amor,Trio Bembe,Trio Bembe,Tac465abbytdjwg3vdssgxw6xki
Ziggy Stardust,David Bowie,The Rise And Fall Of Ziggy Stardust And The Spiders From Mars (2012 Remastered Version),Tsp3koev2ornnhqlja7pln4efmi
Dreams (2004 Remaster),Fleetwood Mac,Rumours,Tnaufnr7s3bk4s5nnltgxxwutsq
Soul Love ,David Bowie,The Rise And Fall Of Ziggy Stardust And The Spiders From Mars (2012 Remastered Version),T453xsxfeiawy7pa5keo2hrplcu
Starman,David Bowie,The Rise And Fall Of Ziggy Stardust And The Spiders From Mars (2012 Remastered Version),Tmpksl7vc54yasomfgzhsgqhwxe
As The World Falls Down,David Bowie,Labyrinth,Tugeih7icbkyend2zwwm6rng2zy
Let 'Em In (Remastered 2014),Wings,At The Speed Of Sound (Deluxe Edition),T6runet5einkuxsaf3bfmfmeza4
Silly Love Songs (Remastered 2014),Wings,At The Speed Of Sound (Deluxe Edition),Tmd4zifunnfiwx7j523eskgt4yi
Band On The Run,Paul McCartney & Wings,Band On The Run (Standard),T5wk3xq4pc725dczen2r6ti3d4e
Las Vegas Turnaround (The Stewardess Song),Daryl Hall & John Oates,The Atlantic Collection,Tdqi5ayfrxpeykuh6ei6n4rejv4
My Ever Changing Moods (Single Version),The Style Council,Greatest Hits (Digitally Remastered),T5tvopsejcgwa2va4wtkrjiamjm
