Glorious,Adam Friedman,Rock Dog (Original Motion Picture Soundtrack),Tjqhl6yf6bj3gfs6nu6vlhgus5a
Let It Go,Demi Lovato,"Let It Go (from ""Frozen"")",Tf5p7rdwwguw423k2q2qdc435hm
Livin' la Vida Loca,Ricky Martin,Ricky Martin,Tvcfjgceavzxxef2kwydwyhe6u4
Get Stupid,Aston Merrygold,Get Stupid,Tzcvb54t4bzupxa45hibzdn25zi
Gangnam Style,Psy,Gangnam Style,Tgmrl6gfrlrvta4jriy4qsm5jue
Be Thankful for What You Got (Pt. 1 & Pt. 2),William DeVaughn,Be Thankful for What You Got,Tg2yju2f7fadm7fef43wmftekm4
Damaged Goods,Gang Of Four,Entertainment!,Tel7cv46dmigcigbuv3yxtt6one
Quantos Beijos / Orvalho Vem Caindo (feat. Fundo de Quintal),Ivan Lins,"Tributo A Noel Rosa, Vol. 2",Ti7hnrpiahfe4jdbsbwedunqrx4
When You're Smiling (The Whole World Smiles With You) (Voice),Dick Hyman,Mighty Aphrodite - Original Soundtrack,T2ny3dfijzbpgviwfqzjqhj4ycm
Suzie Q,Creedence Clearwater Revival,Creedence Clearwater Revival (40th Anniversary Edition),Tsbtli3s3kwhizmowwl2ppdqr6i
Barulho Bom,Zaíra,"Levanta, Sacode e Dança!",Trzt7twt3lr3gjxny6zlejb6gfq
I Can't Go for That (No Can Do) (Remastered),Daryl Hall & John Oates,The Essential Collection,Txjmeg3qn7g776k37j25y6lcszm
"Chora, Me Liga (Ao Vivo)",João Bosco & Vinícius,Seleção Essencial - Grandes Sucessos - João Bosco e Vinícius,Tdfeqg5ydx5prtrp46dyw5tkaxy
Deus e Eu no Sertão,Victor & Leo,Borboletas,Tlmw77ghaaoeh4qfaisi7jcropq
Tem Que Ser Você,Victor & Leo,Borboletas,Tbthg2e73zkwvwnid3cdelazeay
Contigo en la Distancia,Los Tres Ases,Regálame Esta Noche,Tsc74v67junxrgl4i6pyw7jaf4i
Me Espera (The Voice Brasil 2016),Lilian & Layane,Me Espera (The Voice Brasil 2016),Tawm4lsbuya4r3clicdymsnlqj4
Resposta Ao Tempo (The Voice Brasil),Amanda Amado,The Voice Brasil - Batalhas,To6nqxc5p5fdsn4qznhpyglgdzy
Perfeição,João Bosco,"Não Vou Pro Céu, Mas Já Não Vivo No Chão",Tvf7wsd6mpfmmd7glb3sfd7tnke
Shoutin' The Blues,B. B. King,Spotlight On Lucille,Tu6hlspc6lpqcmgwzswzpbsew2a
Things That Make You Go Hmmmm.... (feat. Freedom Williams),C+C Music Factory,Gonna Make You Sweat,Tpvuk42ea3gfnl4nnexp4q24yoe
Paid In Full (Seven Minutes Of Madness - The Coldcut Remix),Eric B. & Rakim,Brown Sugar,T7izoqzjz2xqvvaglvats6a55gi
Seven Nation Army (Remasterisée),Ben L'Oncle Soul,Ben L'Oncle Soul,T3jakzuh22jgzgrc4usjjgyu47u
Lazy (1997 Remix),Deep Purple,Machine Head - 25th Anniversary Edition,T4lkmzg3ijyywvuj3yxhs7kphcy
All About That Bass,Meghan Trainor,All About That Bass,T3s4wi7m3eakrpzc2cakbojnea4
Tell Me 'Bout It,Joss Stone,Introducing Joss Stone,Taxmbd4jfgksqugq7tb2e6lfqti
"Happy (From ""Despicable Me 2"")",Pharrell Williams,G I R L,Tj7ujtq7hqfqvo4fwuppfj7wt5y
People Get Up And Drive Your Funky Soul,James Brown,The Singles Vol. 9 (1973-1975),Trjiquuogv7fpif4eeekfmh3u5y
Got to Be Real,Cheryl Lynn,Cheryl Lynn,Thlgu7xcuru7ff6vfklkbfelc74
Limbe,S-tone Inc,Sobrenatural,Tc3n2lu4ful75g7qsxgngmdm7tq
Lovefool,The Cardigans,Enron: The Smartest Guys In The Room,T4imrzfklofuyjmss7jxmsmi4fm
Don't Talk Just Kiss,Right Said Fred,Up,Tuw3cv4vtwoo2zq6pl7ezsd2ujm
Saturday (Mousse Ts House Edit),Cunnie Williams,Exclusive House Vol.1,Tek7w5tufmj76khcvetwjthbcdm
Love Is In The Air,John Paul Young,I Hate the Music,Tfz3ybvheghfnbspiruzqz2e44m
28 Butts,Little Jackie,The Stoop,T3bdcssgrqzffxjeuqevwe2fzay
Why,Tortured Soul,Introducing Tortured Soul,Tbvrigqcaw7u4viofmsmj5ebiu4
Here I Am,David Morales,Here I Am,Tvngc6x7ijicv3wmoidtogejtai
Fresh Feeling,Eels,Souljacker,Tgzkmhnb24w774if4bkqh3nyhwy
Kamera,Wilco,Yankee Hotel Foxtrot,Teqwhxhuqvmiehng4mkqqssi7hu
Never Let Me Down Again,Depeche Mode,Music for the Masses (Deluxe),Tin5ljdsyj73oagkzpivfl6vyxi
Strangelove,Depeche Mode,Music for the Masses (Deluxe),Tgsuij4ljzvnv5sb5ogtuqhrusu
Silent Morning,Noel,Noel,Tpdxaxg4sr7tvcxnesom3tvlcqa
Enola Gay,Orchestral Manoeuvres In The Dark,The Best Of Orchestral Manoeuvres In The Dark,Tp4duwn7uhuh2igtzpmlp3uxsxy
It's a Sin,Pet Shop Boys,Discography - Complete Singles Collection,Tqgfuqr2ka3gxwaqz7dldoc4r24
Las Vegas Turnaround (The Stewardess Song),Daryl Hall & John Oates,The Atlantic Collection,Tdqi5ayfrxpeykuh6ei6n4rejv4
Domino Dancing (2001 Remastered Version),Pet Shop Boys,Introspective,Tt7s6na6rmhfjok3feoi3dkub5a
The Only Way Is Up,Yazz,Wanted,T43btgaub4l3f5v4xxtig2fk62y
I Beg Your Pardon (I Never Promised You A Rose Garden),Kon Kan,Move To Move,Tkanua5adzkwyfrn6mq5dox5tzm
Groove Is in the Heart,Deee-Lite,Groove Is In The Heart EP,Tnvx2anoq6qbgooh22qge5rxtsy
Gonna Make You Sweat (Everybody Dance Now),C+C Music Factory,Gonna Make You Sweat,Tqtd5pewceixiyminu6osaecz7y
Heart Of Glass (Remix),Blondie,Once More Into The Bleach,Taumfappih44lyb5p6xys6eesxy
Just Can't Get Enough,Depeche Mode,The Singles 81-85,To4kjwsjty6klimn2lorwbmhuqa
Everything Counts,Depeche Mode,The Singles 81-85,Ta2nempx6ivbc3ola2nuviins4i
Route 66,Depeche Mode,Music for the Masses (Deluxe),Thohvsucy4klt5lzp7lonlmawbu
I Shot The Sheriff,Eric Clapton,461 Ocean Boulevard,Tm5xiqrgywqs6y365xnshu6fdum
Do You Feel Like We Do (Live),Peter Frampton,Frampton Comes Alive! (Deluxe Edition),Tugvcza76pxkgtjg67zemmengbu
Do You Feel Like We Do,Peter Frampton,Frampton's Camel,Ti5hi5k35y4f6kdmb3h4wwlwaju
