Dead Cities,Exploited,The Punk Years: 1981,Trgxe2w72miebuxswm63cb67u6a
Police Car,Cockney Rejects,British Punk Anarchy,Tkeddvl7ghvgos5gxsy3aj5eyw4
Time Bomb (Time Bomb Demo),Blitz,Blitzed - An All Out Attack,Twp542colbhqms7bp3q6z5ne2fi
Maniac,Peter & The Test Tube Babies,Pissed And Proud,Tlunbfcn3vu44xovuhcaosurgia
Nothing to Shout About (Live in Europe),Guitar Gangsters,Made in England - Live in Europe,Ti3ccybpzvmotxowqvu3dmfd5na
Arms Race (Carry on Oi! Version),The Partisans,Carry on Oi!,Tpjxy3tq6ycfwj556jrrk7tkh34
Kids Of The Eighties,Infa Riot,The Best of Infa Riot,Tgayvioyyuz3lyxxir6nodimtzu
Fuck Off,Wayne County & The Electric Chairs,The Best of Jayne,Tlws4cucq2orlmjpdwbe46wuf6i
Wonder Woman,Wayne County & the Electric Chairs,Things Your Mother Never Told You,Tegh5tqemgpms522plwnyd3vp6a
FUCKMYLIFE666,Against Me!,23 Live Sex Acts,T7j2sot3qotnirkmooihjhczdsa
Black Me Out,Against Me!,Transgender Dysphoria Blues,Tyeeumyof7uiv7z7g3kzvnkxodi
Shot By Both Sides (Live),Magazine,BBC In Concert 22nd November 1978,T6gkvet7sfhb7fw4mzrx2ef2xsa
Rip Her To Shreds (Live),Blondie,Kung Fu Girl (Live),Tr2k4lifxrzxlko5oymk4l2cgse
"Oh Bondage, Up Yours! (Live)",X-Ray Spex,Punk- Live & Out Of Control,Tcq4ncralrov2hefyzfwpsg7srm
Too Many Creeps,Bush Tetras,"Too Many Creeps 7""",Tkkfbw2gkyqy476p6me6tycjsbu
Mannequin (2006 Remastered Version),Wire,Pink Flag,Tlmmqmqp57jlmlmlyq6eeptpqum
