The Look Of Love,Diana Krall,An Intimate Night,Tsohslihtxzivbruuxb2ty75s4i
Sweet Love,Anita Baker,Rapture,Tqcy3yw5vrlsmwfhlpidebjmwv4
Eye In The Sky,The Alan Parsons Project,Eye In The Sky (Expanded Edition),Tlztegk5pud6mezfbssg7o5o54m
"Your Song (From ""Moulin Rouge"" Soundtrack)",Ewan McGregor,Moulin Rouge (Soundtrack International Version),Tnc3n5yseai4po6akjpwvxhgydq
Pra Sonhar,Marcelo Jeneci,Feito Pra Acabar,Twsrqsvtuce4dp5t2ahs454uea4
Upside Down,Jack Johnson,Jack Johnson And Friends: Sing-A-Longs And Lullabies For The Film Curious George,Ttvxit2msajhdqwzq6mefgo4qzi
Desafinado,João Gilberto,Desafinado,T7nwndrw3w2jogd56jxjyoyle6y
Tereza Da Praia,Dick Farney,The Bossa Nova Wave - Digital,Tp7mhgrzm27nm337sqzdtz4ia6u
Só Tinha de Ser Com Você,Fernanda Porto,Best Of Fernanda Porto,Tqek7mchclvoafyfeenbxuhdr7e
