Good Life (feat. Ledisi),Eric Benét,Lost In Time,Tbiwscbu4xccvo3cdlhkznf4iyq
Turn The Music Up,DJ Kid Stretch,All Disco EP,T7peyjmc7prmcou7v2wpdppd3gq
Dreamin' (Jazz-N-Groove Mix),Loleatta Holloway,Salsoul: The Club Remixes,Tmppeul7oo4jduub3owtwvvda5y
No Message Of Love (Villa Stefano Mix),Kathy Diamond,No Message Of Love,Tra7p4vo6t7c5a746qt3u5qmfgy
Everybody,The Super Phonics,Interstellar,Tp3zuldcqij6iiuyevg6qvujzq4
My Gift (Destroyer Mix),Rogiérs,The Remix/Reject,Txi5dfrezyki2hrco47nl4smrle
Life Back,Sunshine Anderson,The Sun Shines Again,Tackb2xcccuslyxufbtbuwtsb5i
High Hopes,SEVEN,Shattered,Tumtdxwaeucvo2kpmk2247lrqou
Bon bon vie (Gimme the Good Life),T.S. Monk,House of Music,T3ik26jdjxer5pr57yiznbtugn4
Better Living (Neo Funk Mix) (feat. Stuart Lisbie),Juan Laya & Jorge Montiel,Better Living,T6ysmhadjnyyfggfjeies4t523y
Why (Joey Negro Block Party Mix) (feat. Diane Charlemagne),Kola Kube,Joey Negro Presents It's A Summer Groove Vol.3,Trrcc35zriq6zcycfuv2dl425fe
Let No Man Put Asunder,First Choice,"Salsoul Classics, Vol. 2",Tng6hlbbscqkwzfxyokkb4ayrem
The Love Of You (Reprise) (feat. Selina Campbell),Black Sauce,The Love Of You,Te4cn7cjvlkb7oyubgxrooblkna
You're a Star,Aquarian Dream,Tonight's The Night: Disco Gems,Tiwlmbbgmdue6pzjovtixtj2x3u
See You More (Original Mix),Tortured Soul,Did You Miss Me,T3yf6bxymwwdcleso2nbtd4v7gy
Time (Remix),Light Of The World,The Best of the Light of the World,T2vpekcxxwe2dnyonsl77n64uom
Let It Out (feat. Alexandra Hamnede),Physics,Influences,T46c56aeponlun6xfkp5hb37oty
Angels Calling (feat. Amalia),Koyla,Angels Callling,T2kbpinzc2jnveflsjy4trdlrrm
I love America,Patrick Juvet,"Age tendre… La tournée des idoles, Vol. 4",Tkpu2bgkjzt4ykoenhkmfpxdki4
Love Will Save The Day (feat. Miss Modest),JD73,Pure Gold,Troog6djsial4vkvntvb7ox53p4
Controversy,Prince,Controversy,T4epnly4jwe4ohi2s6zaa7ycnsa
