Lift Me Up (To the Sky) (feat. Laura Jackson),Cool Million,"Soulful Power House Workout, Vol. 2",T3w6poku5zd5ob2626rf4vka4ta
Step to the Plate,Bennson,Let the Love,Te73c3tnr2j6n3bbs76bf6zybt4
Thank You Love,Isaac Hayes,Juicy Fruit (Disco Freak),Tzzkxyue2auec3lujeilj6n36fi
Step Aside (Dimitri & DJ Meme Remix),Incognito,More Tales Remixed,Toi3trjkrwlzqqj22m2qnbbzldm
RIGHT NOW (feat. Marlena Shaw),Nathan Haines,Right Now,Tq4juffxd2n64wwm6wmecnpuwh4
Did You Miss Me (Mark de Clive-Lowe Keyapella),Tortured Soul,Did You Miss Me,Tppqvnasor6ilgt2tzqco4g552e
Thank You,Brahim,Evolution,T7zrpq43gz53wu4s5ot5qkintbq
Get It Boy,The Million Dollar Orchestra,Better Days,Tcei5eiwvwshgq252yjtwyebxwy
Lie Lost,Crazy P,Stop Space Return (Bonus Track Version),Tbgn4sb3fm4m3qccgwhaiylfglu
