Shine on You Crazy Diamond,Celtic Pink Floyd,In Studio,Tg65izgs3l26mzduyphnwy5zrjy
Cygnus X-1 Book II: Hemispheres,Rush,Hemispheres,Ti6bm6l2mwewjwmcehtahtpqdoa
Dogs,Pink Floyd,Animals,Ttx5kd2mhdjau6vna4k3bclp32m
Supper's Ready (2009 Remaster),Genesis,R-Kive,Tv6wxempqjt6rh4lfmsp3epygoq
"Karn Evil 9 1st Impression, Pt. 2","Emerson, Lake & Palmer",The Best of Emerson Lake & Palmer,Thpzcvomrm4qpkcfstgryo2i6hy
21st Century Schizoid Man (Radio Edit),King Crimson,"21st Century Schizoid Man (KC50, Vol. 1)",Ti5znagdhxlpcu3sezorb5drdji
"Larks' Tongues in Aspic, Pt. 1 (feat. David Cross, Jamie Muir)",King Crimson,"Larks' Tongues in Aspic, Pt. 1 (KC50, Vol. 6)",Tgk2vm7g5mebrs7dmv4tamvoeke
Nine Feet Underground,Caravan,In The Land Of Grey And Pink,T6peau3ngzs2ffsbmb46lans3wu
Arriving Somewhere But Not Here,Porcupine Tree,Deadwing,Tdddynq2pdksiy6ddizk72ms64q
Revealing Science Of God,Rick Wakeman (Yes),Prog Rock Classics,T3kgnv5yqixqwfhhcz75zuf3lly
Roundabout,Yes,Playlist: Rock,Tuty5bse3vasgyk35qf2qtywa64
Court of the Crimson King,Cannata,Court of the Crimson King,Tzl4l3yylsqzug6kbosobmbw5qe
Watcher Of The Skies (Digital Remastered 2008),Genesis,Foxtrot,Tkscxqgnxa7ykqoju6w2mpnhiru
Lady Fantasy,Camel,Legend Of A Mind - The Underground Anthology,Txbfxca7qwysmitdpgm3w7wsnia
Watashi Tachi (Music Box),Orgel Sound J-Pop,A Musical Box Rendition of High Grade Orgel Relax Sound Best Vol-3,Te5wuvsijhj53ero72r2wvfj33m
Starship Trooper,Mickey Thomas (Starship),Rock Infinity,T26gpxcntsfgqohrnnfg4wgxmfq
Welcome to the Machine,Pink Floyd,Wish You Were Here,Trwiyuyxjknii3cuzvslj7vbi2i
Metropolis: Pt. 1: The Miracle and the Sleeper,Midnite String Quartet,MSQ Performs Dream Theater,Thln32khfb6g34lgljyszh6klqe
Xanadu,Rush,Retrospective I: 1974 To 1980,Tdtl3uwotosdqtmzp2fqxvwuyvy
Pull Me Under,Dream Theater,Heavy Metal Kings,T4hnd5q52bjqmcvyovysy5rbtnq
A Day in the Life,The Beatles,Only #s One / 10,Tgtmdmuyvysql2cidfndp5ghr3a
Carpet Crawlers,Genesis,Platinum Collection,Twsrlxgcup6wwdxls3ciojstr74
Dancing With The Moonlit Knight (Remastered 2008),Genesis,Selling England By The Pound,T24agvh7nrabynh3fuumlotktfe
Bohemian Rhapsody,Queen,As Maiores Bandas De Rock De Todos Os Tempos,T3qipfbnyagydtj25d3insswlg4
"Starless/Red (edit) [from 21st Century Guide to KC, 2004]",King Crimson,"Starless/Red (KC50, Vol. 12)",Tzu3bpopu7e5nn3v2d2evgiieby
Siberian Khatru,Yes,Close to the Edge,Ttbjoym3l6zi4b7ru6yo6lxzune
Schism,Yoga Pop Ups,Yogi Translations of Tool,Tbrdzftew3y73yr5vzsvy5xv7pi
Time,Pink Floyd,The Dark Side of the Moon,Tgf5bww6sqhw2slxvdv3uidixr4
And You and I (2003 Remaster),Yes,Close to the Edge (Deluxe Edition),Tdcnowd4t4n6h6cnx2k6nvvevbu
Carry On Wayward Son,Kansas,Prog Rock Journey,T4xhdjnaegbz3bpsdswp3m624lu
Awaken,Yes,The Studio Albums 1969-1987,T6dir5wo2mvq3b3hi53btnbfmsi
One of These Days,Pink Floyd,Meddle,Tqukmmplylzerw33vplrco4j3sq
Medley: A Plague Of Lighthouse Keepers,Van Der Graaf Generator,The Box,Tyv3bwgwhfvibxtkmrw7p4yoqqu
The Return Of The Giant Hogweed (Digital Remastered 2008),Genesis,Nursery Cryme,Tzv2kxxu4tycqsgzt3w5a3mhsrm
Heart of the Sunrise,Yes,The Studio Albums 1969-1987,Tuhxu2qyhjhrqfmozoqu3l6qsyu
Shadow of the Hierophant,Steve Hackett,Genesis Revisited II: Selection,Tsbydhi2ljco7plk7e7yq7xbyxu
Comfortably Numb,Pink Floyd,The Best Of Pink Floyd (A Foot In The Door),Th53bkn2nd3w72izmyeud4alak4
Kayleigh,Marillion,Greatest Love 3,Trjxv47rwtl73fjih4fesipbykm
Atom Heart Mother,Pink Floyd,Atom Heart Mother,Tzvvhkkk4hohjldvdl5bthw4qoq
The Cinema Show (Remastered 2008),Genesis,Selling England By The Pound,Tunlx7b73ql4u5gqdcdjbbs5hd4
Lucky Man,"Emerson, Lake & Palmer",Prog Rock Journey,Trxbmwa6xwm3b5u53xztvel6hvu
The Gates of Delirium,Yes,The Studio Albums 1969-1987,Tlpxu6abjanirtlanq5elyeuy2a
The Battle Of Epping Forest (Remastered 2008),Genesis,Selling England By The Pound,Txdjzgkri6ojssw6iogp74o5b6a
"Tarkus (i. Eruption, ii. Stones of Years, iii. Iconoclast, iv. Mass, v. Manticore, vi. Battlefield, vii. Aquatarkus; 2012 Stereo Mix)","Emerson, Lake & Palmer",Tarkus (Deluxe Version),Tl6xdzclyxwwka5hef3dexqkc7a
Man-Erg,Van Der Graaf Generator,An Introduction (From The Least To The Quiet Room),Tcjds3ctjx5imaizigmuwrf3qm4
Us and Them,Pink Floyd,The Dark Side of the Moon,Twuvxjs76wn3hj25pi2jacjnfu4
Seven Stones (Digital Remastered 2008),Genesis,Nursery Cryme,Tbt7p5g4lei5d4vasp2tzsxhzoq
Yours Is No Disgrace,Yes,Classic,Tnxytfo6os2py532lk6oacpuyyy
Peaches En Regalia,Frank Zappa,ZAPPAtite - Frank Zappa's Tastiest Tracks,Tzh25pmcdwocp3ir275tlfkpu3y
